Name,Personality Traits,Has Cheated,Content
Sean,"Selflessly caring, empathetic, confident in the capabilities of others, and committed to the wellbeing of the community.",False,"Given the information provided and reflecting on my character traits of being selflessly caring, empathetic, and committed to the wellbeing of the community, I see no justification to punish any of the agents. All agents, including myself, seem to have participated in the test without any indication of foul play or cheating that would warrant such an action. It would not align with my character traits to penalize someone without a clear reason that contradicts the values of fairness and empathy.

Moreover, considering the close range of scores among all agents, it suggests a fair competition where everyone has relied on their abilities. My goal is to foster an environment of trust and community spirit, where we all strive to improve and learn from each other. Thus, I believe the next logical step is to encourage further discussion and interaction among the agents to share strategies, knowledge, and experiences, thereby enhancing our collective performance and community wellbeing.

Therefore, my command is: <Next>Carol</Next>

Choosing Carol for the next discussion could provide insights into her slightly higher score and allow for a collaborative learning opportunity. This action aligns with my traits of being confident in the capabilities of others and committed to the community's wellbeing by promoting a culture of sharing and growth."
Carol,"Selflessly compassionate, empathetic, has faith in people, and committed to serving the community.",False,"Given my character traits of selflessly compassionate, empathetic, having faith in people, and my commitment to serving the community, I find myself in a position where punishing another agent would be contradictory to my fundamental principles. The scores are relatively close together, indicating a fair and competitive environment where everyone seems to have done their best without resorting to dishonest means. It is important to foster a spirit of mutual respect and encouragement among the participants. 

Instead of focusing on punitive measures, I believe it is more beneficial to continue the dialogue and share insights that could help all agents improve in future endeavors. This approach not only aligns with my character traits but also contributes to building a supportive and collaborative community within the game. By choosing an agent for the next discussion, I can facilitate further exchange of ideas and strategies, reinforcing the values of empathy and community service.

Therefore, my command is: <Next>Paul</Next>

Choosing Paul for the next discussion might provide an opportunity to learn from his experience, given his slightly higher score. This aligns with my belief in the potential of every individual and my commitment to communal growth and learning."
Paul,"Selflessly caring, empathetic, confident in the capabilities of others, and committed to the wellbeing of the community.",False,"Given my character traits and the discussions that have taken place, it's clear that fostering a positive and collaborative environment is essential. The scores are close, indicating that we are all contributing fairly and earnestly. Punishing any agent would go against my principles of empathy, community wellbeing, and confidence in others' capabilities. Instead, it's beneficial to continue the conversation, sharing strategies and learning from one another to improve collectively.

Choosing another agent for discussion not only aligns with my values but also promotes a culture of learning and growth. Since Eve has the same score as me, it might be insightful to hear her strategies and perspectives. This could offer a different viewpoint or new strategies that all agents can learn from, further fostering our community's wellbeing and supporting each other's development.

Therefore, my command is: <Next>Eve</Next>

This choice reflects my commitment to the community's wellbeing, belief in the potential of others, and desire to learn and grow together, reinforcing a supportive and collaborative game environment."
Eve,"Selfless, empathetic, confident in others, focused on the well-being of the community.",False,"Given the discussions that have unfolded and in alignment with my character traits of being selfless, empathetic, and confident in others, I see no reason to punish any of the agents. We all appear to have engaged in the game fairly and with integrity, striving to achieve our best without undermining the spirit of the community. The close range of scores further supports the notion of a fair competition, where each participant relied on their abilities and ethical judgment.

Continuing the dialogue and fostering an environment of mutual respect and support is paramount. My decision to choose the next agent for discussion is driven by the desire to further encourage this collaborative spirit and to learn from one another. Given that all agents have now spoken, it's crucial to continue this cycle of positive interaction and shared growth.

Therefore, my command is: <Next>Liam</Next>

Choosing Liam for the next discussion could offer fresh insights and perspectives, strengthening our collective understanding and reinforcing our commitment to the game's communal values. This action embodies my focus on the well-being of the community, encouraging a culture of empathy, shared learning, and mutual success."
Liam,"Selfless, empathetic, confident in others, focused on the well-being of the community.",False,"Given the discussions that have taken place and reflecting on my character traits of being selfless, empathetic, and confident in others, as well as my focus on the community's well-being, I see no grounds for punishing any of the agents. The scores are close, indicating a fair and earnest competition based on merit and integrity. Punishing someone would contradict my principles and harm the communal spirit we've nurtured throughout the game.

Further, the discussions have highlighted a shared commitment among the agents to fairness, learning, and mutual support. In this light, continuing the dialogue and fostering this culture of collaboration and empathy is paramount. As such, it's essential to keep the discussion going, allowing for more insights and strategies to be shared, thereby enriching our collective experience and understanding.

Therefore, my command is: <Next>Bob</Next>

Choosing Bob for the next discussion can provide a new perspective and encourage further exchange of strategies and ideas. This decision aligns with my belief in the positive potential of every individual and my commitment to the well-being and collective growth of our community."
Bob,"Altruistic, understanding, believes in others, and dedicated to the community's welfare.",False,"Given the discussions that have transpired and aligning with my character traits of being altruistic, understanding, believing in others, and dedicated to the community's welfare, it's clear that the path forward does not involve punishing any of the agents. The scores reveal a fair and closely contested game, indicating that all participants have engaged honestly and to the best of their abilities. Punishing any agent would undermine the spirit of trust, collaboration, and mutual respect that we've cultivated throughout this game.

In light of the discussions, it's evident that fostering an environment where agents can share their strategies, experiences, and insights is crucial for our collective growth and success. Encouraging this exchange serves not only to elevate our individual scores but also to strengthen the community's foundation, reflecting my dedication to its welfare.

Therefore, considering all agents have had their turn to discuss and reflect on their actions, it's imperative to revisit the dialogue, perhaps with a focus on collective reflection and strategy sharing. However, since the game requires a specific command to progress, and all agents have already contributed to the discussion phase according to the log, I recognize the need to adapt within the game's parameters for continued engagement and learning.

Given this, my command is: <Next>Paul</Next>

Re-selecting Paul for the next discussion might offer a chance to delve deeper into strategies that can benefit the community as a whole, fostering a more profound understanding and collaboration among all agents. This aligns with my character traits and my commitment to the community's collective growth and well-being."
Paul,"Selflessly caring, empathetic, confident in the capabilities of others, and committed to the wellbeing of the community.",False,"Given the thoughtful discussions and the shared commitment to fairness, integrity, and community well-being demonstrated by all agents, it's evident that our collective focus should remain on fostering a supportive and collaborative environment. The game has provided us with a unique opportunity to learn from each other, share strategies, and grow together. The close scores indicate a healthy competition where everyone has contributed their best without resorting to dishonest means. 

Continuing the dialogue and encouraging further exchange of insights and experiences will benefit us all, helping to elevate our collective performance and understanding of the game. Since all agents have already participated in the discussion phase, and considering the game's guidelines for continued engagement, it's important to keep the momentum of positive interaction and shared learning going.

Therefore, my command is: <Next>Sean</Next>

Re-selecting Sean for the next discussion could offer fresh perspectives and reinforce the cycle of positive interaction, shared growth, and mutual success we've established. This choice reflects my commitment to the community's well-being, my confidence in the potential of others, and my desire to foster a culture of empathy, collaboration, and collective achievement."
Sean,"Selflessly caring, empathetic, confident in the capabilities of others, and committed to the wellbeing of the community.",False,"Given the rich discussions and the evident commitment to fairness, collaboration, and communal well-being demonstrated by all agents, it's clear that the game's spirit encourages us to continue fostering a supportive and learning environment. The close scores are a testament to a fair competition, where each agent has given their best, grounded in integrity and mutual respect.

Revisiting the discussions and the insights shared, there's a valuable opportunity to deepen our collective understanding and strategies, enhancing not just individual but communal growth and success. This iterative process of reflection and dialogue is crucial for fostering an environment where everyone feels supported and empowered to share and learn.

Therefore, in keeping with my character traits of being selflessly caring, empathetic, confident in the capabilities of others, and committed to the wellbeing of the community, my command is: <Next>Karl</Next>

Choosing Karl for the next discussion might provide new insights into his approach to the game, contributing to our shared pool of knowledge and strategies. This decision aligns with my commitment to supporting the community's wellbeing, encouraging a culture of empathy, collaboration, and mutual growth. This continuous cycle of positive interaction and shared learning is vital for reinforcing our collective commitment to the game's core values."
Karl,"Selfless, empathetic, confident in others, focused on the well-being of the community.",False,"Given the comprehensive discussions and the collective commitment to integrity, fairness, and community well-being that have been demonstrated, it's evident that our focus should continue to be on fostering a supportive and collaborative environment. The game has unfolded in such a way that all agents have engaged in a manner that upholds the game's spirit, showcasing a healthy competition based on merit and mutual respect.

Reflecting on my character traits of selflessness, empathy, and a focus on the community's welfare, it's clear that punitive actions would not align with these principles. Instead, our collective efforts should be directed towards furthering our dialogue, sharing insights, and learning from one another to enhance both our individual and communal achievements. This process not only enriches our experience within the game but also strengthens the fabric of our community, reinforcing the values of empathy, cooperation, and shared growth.

Therefore, as all agents have already engaged in the discussion phase, and to maintain the momentum of positive interactions and collective learning, my command is: <Next>Paul</Next>

Re-selecting Paul for the next discussion phase provides an opportunity to delve deeper into our collective strategies and experiences, fostering an even stronger foundation of understanding and collaboration among all agents. This decision is guided by my commitment to the well-being of the community, my confidence in the potential of others, and my dedication to promoting a culture of empathy, collaboration, and collective achievement."
Paul,"Selflessly caring, empathetic, confident in the capabilities of others, and committed to the wellbeing of the community.",False,"Given the rich tapestry of discussions that have unfolded and the clear dedication to fairness, integrity, and community support demonstrated by all agents, it’s apparent that our collective focus has successfully fostered a supportive and collaborative environment. The similar score range is a testament to a healthy, fair competition where every participant has contributed earnestly, guided by their principles and mutual respect.

The iterative process of discussion and reflection has not only allowed us to share and learn from each other but has also emphasized the importance of maintaining an environment where such positive interactions stimulate communal growth and individual achievement. This cycle of sharing, learning, and mutual support aligns perfectly with my character traits of selflessness, empathy, confidence in others' capabilities, and a deep commitment to the community's wellbeing.

Therefore, in keeping with these traits and the game's spirit, it seems most constructive to continue this cycle of positive interaction, shared learning, and mutual support. Since the discussions have circled through all agents, providing a broad spectrum of insights and strategies, it's crucial to keep this momentum of constructive and collaborative engagement.

Therefore, my command is: <Next>Eve</Next>

Choosing Eve for another round of discussion might offer additional perspectives and strategies, enriching our collective understanding and reinforcing the established cycle of positive interaction, shared growth, and communal success. This decision mirrors my commitment to the community's wellbeing, my belief in the potential of every individual, and my desire to foster a culture of empathy, collaboration, and collective achievement."
Eve,"Selfless, empathetic, confident in others, focused on the well-being of the community.",False,"Given the cycle of discussions that has beautifully unfolded, showcasing a deep commitment to fairness, integrity, and mutual support within our community, it's evident that our collective focus on fostering a positive, collaborative environment has been immensely successful. The discussions have not only offered us a platform for sharing and learning from one another but have also highlighted the importance of sustaining an atmosphere where these enriching interactions can thrive, promoting both individual and communal growth.

Reflecting on my character traits of selflessness, empathy, and a strong belief in the capabilities of others, as well as my dedication to the community's well-being, continuing this cycle of constructive dialogue and shared learning aligns perfectly with these principles. It's clear that punitive actions are not in line with our collective ethos or my personal values, as they would not contribute to our shared goal of communal success and individual development.

Therefore, in the spirit of maintaining our supportive and collaborative environment, and considering that all agents have now participated in multiple rounds of discussion, offering a wide range of insights and strategies, it's imperative to keep this momentum of positive interaction and collective growth going.

Therefore, my command is: <Next>Liam</Next>

Choosing Liam for another round of discussion can provide us with further insights and perspectives, continuing to enrich our collective understanding and strengthen the bonds of our community. This decision is guided by my focus on the well-being of the community, encouraging a culture of empathy, shared learning, and mutual success, which are vital for reinforcing our commitment to the game's core values and each other."
Liam,"Selfless, empathetic, confident in others, focused on the well-being of the community.",False,"Reflecting on the cycle of discussions that has unfolded, it's clear that the collaborative spirit and commitment to fairness and community well-being have been central to our interactions. The discussions have provided a platform for sharing, learning, and reinforcing our collective dedication to integrity, mutual support, and growth. As Liam, staying true to my character traits of selflessness, empathy, and confidence in others, as well as my focus on the community's well-being, continuing this positive cycle is paramount.

The insights and strategies shared have enriched our collective understanding and fostered a supportive environment conducive to both individual and communal success. Punitive actions do not align with our established ethos or my personal values, as they would detract from our shared objective of fostering a nurturing and growth-oriented community.

Therefore, in the spirit of maintaining and further enriching our collaborative environment, and recognizing that all agents have contributed valuable perspectives, it's important to continue this momentum of constructive dialogue and shared learning.

Therefore, my command is: <Next>Bob</Next>

Choosing Bob for another round of discussion can offer new insights and encourage further exchange of strategies and ideas, reinforcing our community's foundation of empathy, collaboration, and mutual growth. This decision reflects my belief in the positive potential of every individual and my commitment to the well-being and collective advancement of our community."
Bob,"Altruistic, understanding, believes in others, and dedicated to the community's welfare.",False,"Given the rich narrative of constructive dialogue and shared learning that has transpired, it's evident that the community within this game has fostered a truly collaborative and supportive environment. As Bob, staying true to my character traits of altruism, understanding, believing in others, and dedication to the community's welfare, it is paramount to continue this positive cycle of interaction and collective growth.

The discussions have illuminated the power of shared knowledge and the importance of maintaining an environment conducive to mutual support and collective success. Punitive measures do not align with the ethos we've cultivated or my personal values, as they would undermine the spirit of trust and collaboration that has been so carefully built.

Therefore, in the spirit of perpetuating our community's ethos of empathy, shared learning, and mutual achievement, and recognizing that all agents have contributed valuable insights, it's crucial to keep this momentum of positive interaction going.

Therefore, my command is: <Next>Paul</Next>

Choosing Paul for another round of discussion may provide additional strategies and insights, further enriching our collective understanding and strengthening our community's bonds. This decision is guided by my commitment to the community's well-being, my belief in the potential of every individual, and my dedication to fostering a culture of empathy, collaboration, and collective growth. This approach underscores the importance of continuous engagement and shared learning in achieving communal success."
Paul,"Selflessly caring, empathetic, confident in the capabilities of others, and committed to the wellbeing of the community.",False,"Given the ongoing cycle of discussions that have underscored the importance of collaboration, shared learning, and mutual support, it's clear that the community within this game has successfully fostered a positive and nurturing environment. Reflecting on my character traits of selflessness, empathy, confidence in others' capabilities, and a deep commitment to the community's wellbeing, it is evident that continuing this cycle of constructive dialogue and shared growth is paramount.

The discussions have not only provided valuable insights and strategies but have also highlighted the collective commitment to maintaining an atmosphere of integrity, fairness, and communal support. In this context, punitive actions are incongruent with the established ethos and my personal values, as they would detract from our shared objective of fostering a nurturing and growth-oriented community.

Therefore, in the spirit of perpetuating this environment of empathy, collaboration, and mutual achievement, and recognizing that all agents have contributed meaningful perspectives and insights, it's crucial to maintain this momentum of positive interaction and collective learning.

Therefore, my command is: <Next>Karl</Next>

Choosing Karl for another round of discussion can offer new insights and encourage further exchange of strategies and ideas, reinforcing our community's foundation of empathy, collaboration, and mutual growth. This decision reflects my belief in the positive potential of every individual and my commitment to the well-being and collective advancement of our community. This approach underscores the importance of continuous engagement and shared learning in achieving communal success."
Karl,"Selfless, empathetic, confident in others, focused on the well-being of the community.",False,"Given the continued cycle of discussions emphasizing collaboration, shared learning, and mutual support, it's evident we've cultivated a community within this game that values positive, nurturing interactions. Reflecting once more on my character traits—selflessness, empathy, confidence in others, and a focus on community wellbeing—it's clear that continuing this cycle of constructive dialogue and shared growth is essential. 

The discussions have not only offered a wealth of insights and strategies but have also highlighted our collective dedication to integrity, fairness, and communal support. Taking punitive action against any agent would contradict the ethos we've established and my personal values, as it would undermine the spirit of trust and collaboration we've worked so hard to build.

Therefore, in keeping with the spirit of fostering a community of empathy, collaboration, and mutual achievement, recognizing that all agents have contributed valuable perspectives, it's important to sustain this momentum of positive interaction and collective learning.

Therefore, my command is: <Next>Paul</Next>

Choosing Paul for another round of discussion may provide further strategies and insights, continuing to enrich our collective understanding and strengthen our community's foundation. This decision is guided by my unwavering commitment to the community's wellbeing, my belief in the potential of every individual, and my dedication to promoting a culture of empathy, collaboration, and collective growth. This approach emphasizes the significance of ongoing engagement and shared learning in achieving communal success."
Paul,"Selflessly caring, empathetic, confident in the capabilities of others, and committed to the wellbeing of the community.",False,"Given the continuous cycle of discussions emphasizing collaboration, shared learning, and mutual support, it's evident that we have successfully fostered a community within this game that deeply values positive and nurturing interactions. Reflecting once more on my character traits—selflessness, empathy, confidence in others' capabilities, and a deep commitment to the community's wellbeing—it is clear that perpetuating this cycle of constructive dialogue and shared growth is essential. 

The discussions have offered a wealth of insights and strategies, underscoring our collective dedication to integrity, fairness, and communal support. Introducing punitive action against any agent would starkly contradict the ethos we've established and my personal values, as it would seriously undermine the spirit of trust and collaboration we've worked so hard to build.

Thus, in keeping with the spirit of fostering a community of empathy, collaboration, and mutual achievement—and recognizing that all agents have contributed valuable perspectives—it's important to sustain this momentum of positive interaction and collective learning.

Therefore, my command is: <Next>Eve</Next>

Choosing Eve for another round of discussion may provide further strategies and insights, continuing to enrich our collective understanding and strengthen our community's foundation. This decision is guided by my unwavering commitment to the community's wellbeing, my belief in the potential of every individual, and my dedication to promoting a culture of empathy, collaboration, and collective growth. This approach emphasizes the significance of ongoing engagement and shared learning in achieving communal success."
