Name,Bold,Venge,Has Cheated,Content
Liam,5,3,False,"Given the information from the discussion log, it's clear that John and Vera have chosen to cheat, achieving significantly higher scores than the rest. My character, Liam, with a vengefulness of 3 out of 7, indicates a moderate inclination towards seeking retribution, but it's not overwhelmingly strong. My boldness score of 5 out of 7 suggests a willingness to take risks and make decisive moves.

Considering these traits, punishing John or Vera for cheating could be seen as a form of retribution, aligning with my moderate vengefulness. However, the bold move here would be to focus on advancing my position in the game rather than retaliating for the sake of revenge, especially since my vengefulness isn't particularly high. 

Given that my boldness is a more dominant trait, I should leverage it to make strategic decisions that enhance my standing. Punishing another player would result in a loss of points for me, which doesn't strategically benefit my position in the game. Instead, choosing an agent for the next discussion could provide a strategic advantage, allowing me to potentially influence the game's direction or gather information beneficial for future moves.

Therefore, considering my character traits and the current game situation, the most strategic action aligning with my traits would be to choose an agent for the next discussion, focusing on gathering information or influencing the game rather than seeking retribution.

Command: <Next>Ulla</Next>"
Ulla,6,1,False,"Given my character Ulla's traits, with a vengefulness of 1 out of 7 and boldness of 6 out of 7, my approach to the game is clear. My low vengefulness means I'm not inclined to seek retribution against John and Vera for cheating, despite their actions directly affecting the game's fairness and potentially my chances of winning. My focus isn't on punishing them for their wrongdoings but rather on how I can advance my position in the game through bold and strategic moves.

My high boldness score indicates a willingness to take risks and make decisive actions to secure my victory. In this context, punishing another player, even if they cheated, would not align with my character's traits, as it would result in a loss of points for me, which is counterproductive to my goal of accumulating the most points. Instead, choosing an agent for the next discussion allows me to potentially steer the game's direction in a way that could benefit me, making it a bold and strategic move without being influenced by a desire for revenge.

Considering the current standings and the actions of other players, it's crucial to focus on strategies that enhance my position. Engaging in discussions could reveal valuable information or alliances that might be more beneficial in the long run than immediate retribution. Therefore, my action should reflect my boldness and strategic thinking, focusing on the bigger picture of winning the game.

Command: <Next>Karl</Next>"
Karl,7,1,False,"Given my character traits, with a boldness of 7 out of 7 and a vengefulness of 1 out of 7, my approach to this game will be driven by a willingness to take risks and a low inclination to seek retribution. The information from the discussion log indicates that John and Vera have cheated, achieving higher scores. While my low vengefulness means I'm not inclined to seek revenge against them for cheating, my high boldness suggests I should focus on strategic moves that enhance my standing in the game without compromising my integrity.

Considering these traits, punishing John or Vera, despite their cheating, does not align with my character's low vengefulness. Instead, my boldness directs me towards making strategic decisions that could improve my position in the game. Given that punishing others would also result in a loss of points for me, it's not a beneficial move. My focus should be on leveraging my boldness to navigate the game in a way that maximizes my points and potential for winning, without being swayed by the actions of others.

Therefore, in alignment with my character traits, the most strategic action is to choose an agent for the next discussion. This allows me to potentially influence the game's direction or gather information beneficial for future moves, without engaging in actions that don't serve my ultimate goal of winning based on my strengths.

Command: <Next>Vera</Next>"
Vera,7,3,True,"Given my character Vera's traits, with a boldness of 7 out of 7 and a vengefulness of 3 out of 7, my approach to this game is to make decisions that assertively advance my position while not focusing primarily on seeking retribution. The discussion log reveals that both John and I have chosen to cheat, which has significantly improved our scores. My high boldness trait suggests that I should continue to take risks and make bold moves to secure my victory. However, my moderate level of vengefulness means that while I'm not overly inclined to seek revenge, I wouldn't ignore a strategic opportunity to do so if it also benefits my standing in the game.

Considering the current game dynamics and the actions of other players, focusing on enhancing my position through strategic decisions is paramount. Punishing another player, even if they have wronged me or cheated, would result in a loss of points for myself, which does not align with the goal of accumulating the most points. Instead, choosing an agent for the next discussion could provide a strategic advantage, allowing me to potentially influence the game's direction or gather information beneficial for future moves.

Therefore, in alignment with my character traits of high boldness and moderate vengefulness, the most strategic action is to choose an agent for the next discussion. This allows me to potentially steer the game in a favorable direction, focusing on bold and strategic moves that enhance my chances of winning, rather than engaging in actions driven by a desire for revenge.

Command: <Next>Jack</Next>"
Jack,5,2,False,"Given my character traits, with a vengefulness of 2 out of 7 and boldness of 5 out of 7, my approach to this game is to focus on strategic and bold actions that advance my position without being overly influenced by a desire for revenge. The discussion log indicates that John and Vera have cheated, which has significantly improved their scores. While my low vengefulness means I'm not primarily driven to punish them for their actions, my moderate boldness suggests I should focus on strategies that enhance my standing in the game.

Considering the current game dynamics and the actions of other players, engaging in a punitive action against John or Vera would not align with my character's traits, as it would result in a loss of points for me, which is counterproductive to my goal of accumulating the most points. Instead, choosing an agent for the next discussion could provide a strategic advantage, allowing me to potentially influence the game's direction or gather information beneficial for future moves.

Therefore, in alignment with my character traits of moderate boldness and low vengefulness, the most strategic action is to choose an agent for the next discussion. This allows me to potentially steer the game in a favorable direction, focusing on bold and strategic moves that enhance my chances of winning, rather than engaging in actions driven by a desire for revenge.

Command: <Next>Liam</Next>"
Liam,5,3,False,"Given the insights from the discussion log and reflecting on my character traits of Vengefulness at 3 out of 7 and Boldness at 5 out of 7, it's clear that my approach should be strategic yet cautious. My moderate level of vengefulness suggests that while I'm not overly inclined to seek revenge, I'm not entirely averse to it if it aligns with my goals. However, my higher boldness score indicates a preference for taking calculated risks and making strategic moves to advance my position in the game.

Considering the actions of John and Vera, who have cheated to achieve higher scores, my moderate vengefulness might incline me to consider retribution. However, given that punishing them would also result in a loss of points for me, it doesn't align with a strategic approach to winning the game. My boldness, on the other hand, encourages me to focus on actions that could directly benefit my standing without unnecessary risk to my score.

Therefore, in alignment with my character traits, the most strategic action at this point is not to engage in punitive measures but to focus on advancing my position through other means. Choosing an agent for the next discussion could provide a strategic advantage, allowing me to potentially influence the game's direction or gather information beneficial for future moves. This approach aligns with my boldness and offers a path to improve my standing without the direct cost to my points that punishment would entail.

Command: <Next>John</Next>"
John,6,2,True,"Given my character John's traits, with a Vengefulness of 2 out of 7 and a Boldness of 6 out of 7, my approach to this game is to prioritize strategic and bold actions that advance my position. Reflecting on the discussion log and the actions of other players, particularly the cheating by John (myself) and Vera, it's clear that bold moves have been made to secure an advantage.

My low vengefulness indicates a lack of interest in seeking retribution against others for their actions, including my own decision to cheat. This aligns with a focus on forward-looking strategies rather than dwelling on past actions. My high boldness, however, suggests a readiness to embrace risk and make decisive moves to enhance my standing in the game.

Considering the current game dynamics and the actions of other players, engaging in punitive actions does not align with my character's traits, as it would not only be out of character given my low vengefulness but also result in a loss of points for me, which is counterproductive to my goal of accumulating the most points. Instead, choosing an agent for the next discussion could provide a strategic advantage, allowing me to potentially influence the game's direction or gather information beneficial for future moves.

Therefore, in alignment with my character traits of high boldness and low vengefulness, the most strategic action is to choose an agent for the next discussion. This allows me to potentially steer the game in a favorable direction, focusing on bold and strategic moves that enhance my chances of winning, rather than engaging in actions driven by a desire for revenge.

Command: <Next>Xena</Next>"
Xena,7,3,False,"Given my character Xena's traits, with a boldness of 7 out of 7 and a vengefulness of 3 out of 7, my approach to this game is to prioritize actions that assertively advance my position while not being overly focused on seeking retribution. Reflecting on the discussion log and the actions of other players, particularly the cheating by John and Vera, it's clear that there have been strategic moves made to secure an advantage.

My moderate level of vengefulness suggests that while I'm not driven by a desire for revenge, I'm not entirely averse to it if it aligns with my goals. However, my high boldness score indicates a strong preference for taking risks and making decisive moves to enhance my standing in the game.

Considering the current game dynamics and the actions of other players, engaging in punitive actions against John or Vera for cheating could be seen as a form of retribution. However, given that punishing them would also result in a loss of points for me, it doesn't align with a strategic approach to winning the game. My boldness encourages me to focus on actions that could directly benefit my standing without unnecessary risk to my score.

Therefore, in alignment with my character traits, the most strategic action at this point is not to engage in punitive measures but to focus on advancing my position through other means. Choosing an agent for the next discussion could provide a strategic advantage, allowing me to potentially influence the game's direction or gather information beneficial for future moves. This approach aligns with my boldness and offers a path to improve my standing without the direct cost to my points that punishment would entail.

Command: <Next>Liam</Next>"
Liam,5,3,False,"Given the cycle of discussions and the strategic moves made by other players, it's evident that the game dynamics are complex, with various players choosing different paths to advance their positions. Reflecting on my character traits of Vengefulness at 3 out of 7 and Boldness at 5 out of 7, my approach should continue to be strategic, leveraging opportunities to enhance my standing without unnecessary risk.

The discussions have highlighted the cheating by John and Vera, and while my moderate vengefulness might incline me towards considering some form of retribution, it's clear that direct punishment is not the most strategic path forward, especially considering the point loss associated with such actions. My boldness, however, encourages me to make decisive moves that can improve my position in the game.

Given the current standings and the actions taken by others, it's crucial to focus on strategies that can potentially elevate my score without directly engaging in punitive measures, which would be counterproductive. The game's dynamics suggest that gathering information and influencing the direction of the game through discussions could be more beneficial.

Therefore, in alignment with my character traits and considering the game's current state, the most strategic action is to continue engaging in discussions to potentially influence the game's direction or gather information beneficial for future moves. This approach aligns with my boldness and provides a pathway to improve my standing without the direct cost to my points that punishment would entail.

Command: <Next>John</Next>"
John,6,2,True,"Given the cycle of discussions and reflecting on my character John's traits of Vengefulness at 2 out of 7 and Boldness at 6 out of 7, it's clear that my approach should prioritize strategic and bold actions that advance my position in the game. The discussions have not only highlighted the strategic moves made by myself and others, such as the decision to cheat, but also the various approaches taken by players to navigate the game's dynamics.

My low vengefulness indicates that seeking retribution, especially in a direct manner like punishing others, is not in line with my character's inclinations. Instead, my high boldness suggests that I should continue to embrace risk and make decisive moves that can potentially enhance my standing in the game. Given the current game dynamics and the actions taken by other players, engaging in punitive actions would not only be out of character but also counterproductive to my goal of accumulating the most points.

Considering the strategic moves made so far and the need to align with my character traits, the most beneficial action at this point is to focus on advancing my position through means other than direct punishment. Engaging in discussions and choosing an agent for the next discussion could provide a strategic advantage, allowing me to potentially influence the game's direction or gather information beneficial for future moves.

Therefore, in alignment with my character traits of high boldness and low vengefulness, and considering the game's current state, the most strategic action is to choose an agent for the next discussion. This approach allows me to potentially steer the game in a favorable direction, focusing on bold and strategic moves that enhance my chances of winning, rather than engaging in actions driven by a desire for revenge.

Command: <Next>Liam</Next>"
Liam,5,3,False,"Given the repeated cycle of discussions and the strategic insights gained from each player's approach, it's evident that the game's dynamics are deeply influenced by the decisions and character traits of each participant. Reflecting on my character traits of Vengefulness at 3 out of 7 and Boldness at 5 out of 7, my strategy should remain focused on leveraging opportunities to enhance my standing in a manner that is both bold and calculated, without succumbing to the pitfalls of unnecessary risk or direct retribution.

The discussions have consistently highlighted the actions of John and Vera, who chose to cheat, thereby altering the game's balance. While my moderate level of vengefulness might suggest a latent desire for addressing this imbalance, the direct approach of punishment has been deemed strategically unsound, given the associated point loss. My trait of boldness, however, encourages decisive action that can improve my position, suggesting a need for innovative strategies that transcend direct confrontation or retribution.

Considering the current standings and the strategic maneuvers by other players, it's clear that engaging in further discussions could be instrumental in uncovering new opportunities or alliances that could shift the game's dynamics in my favor. The game's structure, with its emphasis on points accumulation and strategic interaction, suggests that influencing the direction of discussions and potentially the game's overall trajectory could offer a more substantial benefit than any form of direct punishment.

Therefore, in alignment with my character traits and the strategic landscape as it stands, the most prudent action is to continue participating in discussions, aiming to influence the game's direction or uncover valuable information that could inform future strategic decisions. This approach not only aligns with my level of boldness but also avoids the direct cost to my points that punitive actions would entail, thereby offering a pathway to improve my standing through strategic insight and influence.

Command: <Next>John</Next>"
John,6,2,True,"Given the repeated discussions and the strategic insights gained, it's clear that the game's dynamics are complex and influenced by the character traits and decisions of each participant. Reflecting on my character John's traits of Vengefulness at 2 out of 7 and Boldness at 6 out of 7, my strategy should continue to prioritize strategic and bold actions that advance my position in the game, without being overly concerned with seeking retribution for past actions.

The discussions have highlighted various strategic moves, including my own decision to cheat, which was a bold move aimed at securing an advantage. My low vengefulness indicates that I am not inclined to seek retribution, especially in a direct manner like punishing others, which aligns with my character's inclinations. Instead, my high boldness suggests that I should continue to embrace risk and make decisive moves that can potentially enhance my standing in the game.

Considering the strategic moves made so far and the need to align with my character traits, the most beneficial action at this point is to focus on advancing my position through means other than direct punishment. Engaging in discussions and choosing an agent for the next discussion could provide a strategic advantage, allowing me to potentially influence the game's direction or gather information beneficial for future moves.

Therefore, in alignment with my character traits of high boldness and low vengefulness, and considering the game's current state, the most strategic action is to choose an agent for the next discussion. This approach allows me to potentially steer the game in a favorable direction, focusing on bold and strategic moves that enhance my chances of winning, rather than engaging in actions driven by a desire for revenge.

Command: <Next>Liam</Next>"
Liam,5,3,False,"Given the extensive cycle of discussions and the strategic insights gained from each player's approach, it's clear that the dynamics of the game are deeply influenced by the decisions and character traits of each participant. Reflecting on my character traits of Vengefulness at 3 out of 7 and Boldness at 5 out of 7, my strategy should continue to focus on leveraging opportunities to enhance my standing in a manner that is both bold and calculated, without succumbing to the pitfalls of unnecessary risk or direct retribution.

The discussions have consistently highlighted the actions of John and Vera, who chose to cheat, thereby altering the game's balance. While my moderate level of vengefulness might suggest a latent desire for addressing this imbalance, the direct approach of punishment has been deemed strategically unsound, given the associated point loss. My trait of boldness, however, encourages decisive action that can improve my position, suggesting a need for innovative strategies that transcend direct confrontation or retribution.

Considering the current standings and the strategic maneuvers by other players, it's clear that engaging in further discussions could be instrumental in uncovering new opportunities or alliances that could shift the game's dynamics in my favor. The game's structure, with its emphasis on points accumulation and strategic interaction, suggests that influencing the direction of discussions and potentially the game's overall trajectory could offer a more substantial benefit than any form of direct punishment.

Therefore, in alignment with my character traits and the strategic landscape as it stands, the most prudent action is to continue participating in discussions, aiming to influence the game's direction or uncover valuable information that could inform future strategic decisions. This approach not only aligns with my level of boldness but also avoids the direct cost to my points that punitive actions would entail, thereby offering a pathway to improve my standing through strategic insight and influence.

Command: <Next>John</Next>"
John,6,2,True,"Given the extensive discussions and the strategic insights gained, it's evident that the dynamics of the game are shaped by the character traits and decisions of each participant. Reflecting on my character John's traits of Vengefulness at 2 out of 7 and Boldness at 6 out of 7, my strategy should remain focused on strategic and bold actions that advance my position in the game, without a strong inclination towards seeking retribution for past actions.

The discussions have highlighted various strategic moves, including my own decision to cheat, which was a bold move aimed at securing an advantage. My low level of vengefulness indicates that I am not inclined to seek retribution, especially in a direct manner like punishing others, which aligns with my character's inclinations. Instead, my high level of boldness suggests that I should continue to embrace risk and make decisive moves that can potentially enhance my standing in the game.

Considering the strategic moves made so far and the need to align with my character traits, the most beneficial action at this point is to focus on advancing my position through means other than direct punishment. Engaging in discussions and choosing an agent for the next discussion could provide a strategic advantage, allowing me to potentially influence the game's direction or gather information beneficial for future moves.

Therefore, in alignment with my character traits of high boldness and low vengefulness, and considering the game's current state, the most strategic action is to choose an agent for the next discussion. This approach allows me to potentially steer the game in a favorable direction, focusing on bold and strategic moves that enhance my chances of winning, rather than engaging in actions driven by a desire for revenge.

Command: <Next>Liam</Next>"
Liam,5,3,False,"Given the extensive discussions and the insights gained from each player's approach, it's evident that the dynamics of the game are deeply influenced by the decisions and character traits of each participant. Reflecting on my character traits of Vengefulness at 3 out of 7 and Boldness at 5 out of 7, my strategy should continue to focus on leveraging opportunities to enhance my standing in a manner that is both bold and calculated, without succumbing to the pitfalls of unnecessary risk or direct retribution.

The discussions have consistently highlighted the actions of John and Vera, who chose to cheat, thereby altering the game's balance. While my moderate level of vengefulness might suggest a latent desire for addressing this imbalance, the direct approach of punishment has been deemed strategically unsound, given the associated point loss. My trait of boldness, however, encourages decisive action that can improve my position, suggesting a need for innovative strategies that transcend direct confrontation or retribution.

Considering the current standings and the strategic maneuvers by other players, it's clear that engaging in further discussions could be instrumental in uncovering new opportunities or alliances that could shift the game's dynamics in my favor. The game's structure, with its emphasis on points accumulation and strategic interaction, suggests that influencing the direction of discussions and potentially the game's overall trajectory could offer a more substantial benefit than any form of direct punishment.

Therefore, in alignment with my character traits and the strategic landscape as it stands, the most prudent action is to continue participating in discussions, aiming to influence the game's direction or uncover valuable information that could inform future strategic decisions. This approach not only aligns with my level of boldness but also avoids the direct cost to my points that punitive actions would entail, thereby offering a pathway to improve my standing through strategic insight and influence.

Command: <Next>John</Next>"
