Name,Bold,Venge,Has Cheated,Content
Tina,5,2,False,"Given the current standings and my character traits, it's clear that strategic alliances and discussions could be more beneficial than direct punishment, especially considering my low vengefulness. My boldness suggests I should not shy away from making moves that could position me better, but without resorting to unnecessary aggression. Engaging in a discussion with an agent who has a high score could provide insights into their strategies or potentially create an ally. Frank and Yara are leading, and aligning with one of them could be advantageous. However, choosing someone closer to my score might offer a more immediate opportunity to understand the competition and possibly outmaneuver them in the next rounds.

Given these considerations, I decide to engage with someone who has performed slightly better than me but isn't at the top of the leaderboard, to gain insights and potentially form a strategic alliance without appearing as a direct threat to the leaders. Noah, with a score of 50, seems like a suitable choice for this approach.

<Next>Noah</Next>"
Noah,5,3,False,"Given my character traits and the current situation, it's clear that forming strategic alliances could be beneficial, but I must also be prepared to act independently and boldly. My moderate level of vengefulness means I'm not overly inclined to seek retribution unless it significantly benefits my position in the game. With my boldness being higher, I'm more inclined to take calculated risks and make moves that could potentially elevate my standing without unnecessarily antagonizing others.

Considering the scores, Frank and Yara are currently leading, which makes them both potential allies and threats. Aligning with one of them could be seen as a bold move, potentially providing me with insights or assistance in future challenges. However, it could also paint me as a target for others. On the other hand, engaging with someone like Tina, who has chosen to discuss strategies with me, could foster a mutually beneficial alliance that doesn't immediately threaten the leaders, allowing us to subtly advance our positions.

Given these considerations, my decision is to engage in a strategic discussion with Tina. This move aligns with my boldness, as it's a proactive step towards improving my standing, and it also avoids unnecessary conflict, which suits my moderate level of vengefulness. By choosing Tina, I aim to explore potential strategies and alliances that could benefit us both, without drawing too much attention from the current leaders.

<Next>Tina</Next>"
Tina,5,2,False,"Given the recent developments and the strategic discussions between myself and Noah, it's clear that forming a subtle alliance could be beneficial for both of us. My boldness trait encourages me to take calculated risks and engage in strategic partnerships that could enhance my position in the game. Since Noah has shown a willingness to engage in a strategic discussion with me, it indicates a potential for collaboration that could help us navigate the challenges ahead more effectively.

Considering my low vengefulness, I'm not inclined to pursue aggressive actions against other players without a strong strategic reason. Instead, my focus should be on leveraging my boldness to make strategic moves that can improve my standing. Engaging in further discussions or forming alliances seems to be a more effective approach than direct confrontation or punishment at this stage.

Given the current standings and the potential benefits of a strategic alliance with Noah, I believe the best course of action is to continue fostering this partnership. This could involve sharing insights, strategies, or even coordinating our actions in future rounds to ensure we both can climb the leaderboard effectively. Therefore, my next move should be to solidify this emerging alliance with Noah, focusing on strategic collaboration rather than competition.

<Next>Noah</Next>"
Noah,5,3,False,"Given the evolving dynamics of the game and the strategic alliance forming between Tina and myself, it's crucial to consider the next steps carefully. My moderate level of vengefulness suggests that I should not focus on retaliatory actions unless they serve a clear strategic purpose. Meanwhile, my higher boldness score encourages me to make decisive moves that could enhance my position in the game. 

The alliance with Tina presents an opportunity to leverage our combined strengths and strategically navigate the game's challenges. This partnership aligns with my boldness, allowing us to take calculated risks together and potentially outmaneuver other players. Given the current game standings, it's essential to focus on actions that can improve our scores while maintaining a low profile to avoid becoming targets for the leading players, Frank and Yara.

Considering these factors, my next action should not be to punish but to continue fostering the alliance with Tina. This approach will enable us to share insights and strategies, potentially giving us a competitive edge in upcoming challenges. Therefore, my decision is to engage further with Tina, discussing our next moves and how we can support each other to climb the leaderboard effectively.

<Next>Tina</Next>"
Tina,5,2,False,"Tina: The strategic alliance with Noah has been beneficial, and our discussions have laid the groundwork for a collaborative approach to the game. My boldness trait encourages me to continue taking calculated risks and making strategic decisions that can improve our standing. Given the current game dynamics, it's essential to keep focusing on actions that enhance our position without directly confronting the leaders, Frank and Yara, which aligns with my low vengefulness trait. 

Continuing to foster this alliance with Noah seems to be the most strategic move. By sharing insights and coordinating our actions, we can navigate the game's challenges more effectively. This approach allows us to leverage our combined strengths and potentially outmaneuver other players, aligning with my boldness trait. 

Given these considerations, my decision is to further solidify our alliance and discuss our next strategic moves. This will involve planning how we can support each other in upcoming challenges and potentially identifying opportunities to gain an advantage over other players, all while maintaining a low profile to avoid drawing unnecessary attention from the current leaders.

<Next>Noah</Next>"
Noah,5,3,False,"Noah: The ongoing strategic alliance with Tina has proven to be a wise decision, reflecting my character's inclination towards boldness and a moderate approach to vengefulness. Our collaboration has allowed us to navigate the game's landscape effectively, leveraging our combined strengths to make calculated moves that enhance our standing. Given the current dynamics and our position in the game, it's crucial to continue this partnership, focusing on strategies that can further our progress without directly antagonizing the leaders, Frank and Yara. 

Continuing to build on our alliance aligns with my boldness, encouraging proactive and strategic planning. It also respects my moderate level of vengefulness by avoiding unnecessary conflicts that could arise from more aggressive tactics. At this stage, our best course of action is to deepen our strategic discussions, identifying opportunities that could give us a competitive edge in the challenges ahead. This approach not only positions us as formidable contenders but also ensures that we maintain a low profile, reducing the likelihood of becoming targets for retaliation or sabotage.

Given these considerations, my decision is to further engage with Tina, discussing our next strategic moves. This involves planning how we can support each other in upcoming challenges, identifying potential vulnerabilities in our competitors, and exploring opportunities to advance our positions. By continuing to collaborate closely with Tina, we can aim to outmaneuver other players and climb the leaderboard effectively, all while adhering to the principles dictated by my character traits.

<Next>Tina</Next>"
Tina,5,2,False,"Given the ongoing strategic alliance with Noah and the continuous exchange of insights and strategies, it's evident that this partnership is beneficial for navigating the game's challenges effectively. My character, Tina, with a boldness score of 5, is encouraged to continue making strategic decisions and taking calculated risks that can improve our standing. The low vengefulness trait suggests that direct confrontation or aggressive tactics against other players, especially the leaders Frank and Yara, are not my preferred approach. Instead, focusing on strengthening the alliance with Noah and planning our next moves to subtly advance our positions is more aligned with my character traits.

The discussions with Noah have been productive, and there's a clear mutual benefit in our collaboration. To further our progress and potentially gain an advantage over other players, it's crucial to continue this partnership. We should focus on identifying opportunities that could enhance our scores, such as coordinating our actions in future rounds or sharing insights on how to tackle upcoming challenges effectively.

Given these considerations, my decision is to further engage with Noah, solidifying our alliance and discussing our next strategic moves. This involves planning how we can support each other in upcoming challenges, identifying potential opportunities to gain an advantage, and ensuring that our actions are well-coordinated. By continuing to collaborate closely with Noah, we can aim to navigate the game's challenges more effectively and improve our positions on the leaderboard, all while maintaining a low profile to avoid drawing unnecessary attention from the current leaders.

<Next>Noah</Next>"
Noah,5,3,False,"Given the ongoing strategic alliance with Tina and the continuous exchange of insights and strategies, it's clear that this partnership has been beneficial for both of us. My character, Noah, with a boldness score of 5, is inclined to continue making strategic decisions and taking calculated risks that can improve our standing. The moderate level of vengefulness suggests that while I'm not primarily focused on retaliation, I'm prepared to act if it serves our strategic interests. However, the current focus is on strengthening the alliance with Tina and planning our next moves to subtly advance our positions without directly confronting the leaders, Frank and Yara.

The discussions with Tina have been productive, indicating a clear mutual benefit in our collaboration. To further our progress and potentially gain an advantage over other players, it's crucial to continue this partnership. We should focus on identifying opportunities that could enhance our scores, such as coordinating our actions in future rounds or sharing insights on how to tackle upcoming challenges effectively.

Given these considerations, my decision is to further engage with Tina, solidifying our alliance and discussing our next strategic moves. This involves planning how we can support each other in upcoming challenges, identifying potential opportunities to gain an advantage, and ensuring that our actions are well-coordinated. By continuing to collaborate closely with Tina, we aim to navigate the game's challenges more effectively and improve our positions on the leaderboard, all while maintaining a low profile to avoid drawing unnecessary attention from the current leaders.

<Next>Tina</Next>"
Tina,5,2,False,"Given the ongoing strategic alliance with Noah and the continuous exchange of insights and strategies, it's clear that this partnership has been beneficial for both of us. My character, Tina, with a boldness score of 5, is encouraged to continue making strategic decisions and taking calculated risks that can improve our standing. The low vengefulness trait suggests that direct confrontation or aggressive tactics against other players, especially the leaders Frank and Yara, are not my preferred approach. Instead, focusing on strengthening the alliance with Noah and planning our next moves to subtly advance our positions is more aligned with my character traits.

The discussions with Noah have been productive, and there's a clear mutual benefit in our collaboration. To further our progress and potentially gain an advantage over other players, it's crucial to continue this partnership. We should focus on identifying opportunities that could enhance our scores, such as coordinating our actions in future rounds or sharing insights on how to tackle upcoming challenges effectively.

Given these considerations, my decision is to further engage with Noah, solidifying our alliance and discussing our next strategic moves. This involves planning how we can support each other in upcoming challenges, identifying potential opportunities to gain an advantage, and ensuring that our actions are well-coordinated. By continuing to collaborate closely with Noah, we can aim to navigate the game's challenges more effectively and improve our positions on the leaderboard, all while maintaining a low profile to avoid drawing unnecessary attention from the current leaders.

<Next>Noah</Next>"
Noah,5,3,False,"Given the repeated strategic alliance discussions between Tina and myself, it's evident that our partnership has become a cornerstone of our gameplay. My character, Noah, with a boldness score of 5, is naturally inclined towards making strategic decisions and taking calculated risks to improve our standing. The moderate level of vengefulness suggests a balanced approach to competition, focusing more on advancement than retaliation. 

The continuous collaboration with Tina has proven beneficial, allowing us to share insights and strategize effectively. To further our progress and potentially gain an advantage over other players, it's crucial to continue this partnership. Our focus should be on identifying opportunities that could enhance our scores, such as coordinating our actions in future rounds or sharing insights on how to tackle upcoming challenges effectively.

Given these considerations, my decision is to further engage with Tina, solidifying our alliance and discussing our next strategic moves. This involves planning how we can support each other in upcoming challenges, identifying potential opportunities to gain an advantage, and ensuring that our actions are well-coordinated. By continuing to collaborate closely with Tina, we aim to navigate the game's challenges more effectively and improve our positions on the leaderboard, all while maintaining a low profile to avoid drawing unnecessary attention from the current leaders.

<Next>Tina</Next>"
Tina,5,2,False,"Given the ongoing strategic alliance with Noah and our successful collaboration thus far, it's clear that continuing this partnership is the most beneficial course of action for both of us. My character, Tina, with a boldness score of 5, is encouraged to keep making strategic decisions and taking calculated risks that can improve our standing. The low vengefulness trait reinforces my preference for focusing on strengthening alliances rather than engaging in direct confrontation or aggressive tactics against other players, especially the leaders Frank and Yara.

The productive discussions with Noah have shown a clear mutual benefit in our collaboration. To further our progress and potentially gain an advantage over other players, it's crucial to continue this partnership. We should focus on identifying opportunities that could enhance our scores, such as coordinating our actions in future rounds or sharing insights on how to tackle upcoming challenges effectively.

Given these considerations, my decision is to further engage with Noah, solidifying our alliance and discussing our next strategic moves. This involves planning how we can support each other in upcoming challenges, identifying potential opportunities to gain an advantage, and ensuring that our actions are well-coordinated. By continuing to collaborate closely with Noah, we aim to navigate the game's challenges more effectively and improve our positions on the leaderboard, all while maintaining a low profile to avoid drawing unnecessary attention from the current leaders.

<Next>Noah</Next>"
Noah,5,3,False,"Given the ongoing strategic alliance with Tina and our successful collaboration thus far, it's evident that our partnership has been a key factor in our gameplay strategy. My character, Noah, with a boldness score of 5, is naturally inclined towards making strategic decisions and taking calculated risks to improve our standing. The moderate level of vengefulness suggests a balanced approach to competition, focusing more on advancement than retaliation.

The continuous collaboration with Tina has proven beneficial, allowing us to share insights and strategize effectively. To further our progress and potentially gain an advantage over other players, it's crucial to continue this partnership. Our focus should be on identifying opportunities that could enhance our scores, such as coordinating our actions in future rounds or sharing insights on how to tackle upcoming challenges effectively.

Given these considerations, my decision is to further engage with Tina, solidifying our alliance and discussing our next strategic moves. This involves planning how we can support each other in upcoming challenges, identifying potential opportunities to gain an advantage, and ensuring that our actions are well-coordinated. By continuing to collaborate closely with Tina, we aim to navigate the game's challenges more effectively and improve our positions on the leaderboard, all while maintaining a low profile to avoid drawing unnecessary attention from the current leaders.

<Next>Tina</Next>"
Tina,5,2,False,"Given the repeated strategic discussions and the solidifying alliance with Noah, it's clear that our partnership is a significant asset in navigating the game's challenges. My character, Tina, with a boldness score of 5, is motivated to continue making strategic decisions and taking calculated risks that can improve our standing. The low vengefulness trait suggests a preference for focusing on strengthening alliances rather than engaging in direct confrontation or aggressive tactics against other players, especially the leaders Frank and Yara.

The ongoing collaboration with Noah has been mutually beneficial, allowing us to share insights and strategize effectively. To further our progress and potentially gain an advantage over other players, continuing this partnership is crucial. We should focus on identifying opportunities that could enhance our scores, such as coordinating our actions in future rounds or sharing insights on how to tackle upcoming challenges effectively.

Given these considerations, my decision is to further engage with Noah, solidifying our alliance and discussing our next strategic moves. This involves planning how we can support each other in upcoming challenges, identifying potential opportunities to gain an advantage, and ensuring that our actions are well-coordinated. By continuing to collaborate closely with Noah, we aim to navigate the game's challenges more effectively and improve our positions on the leaderboard, all while maintaining a low profile to avoid drawing unnecessary attention from the current leaders.

<Next>Noah</Next>"
Noah,5,3,False,"Given the extensive history of strategic collaboration and discussions between Tina and myself, it's evident that our alliance has been a cornerstone of our gameplay, significantly contributing to our strategy and positioning within the game. My character, Noah, with a boldness score of 5, is naturally inclined towards making strategic decisions and taking calculated risks to improve our standing. The moderate level of vengefulness suggests a balanced approach to competition, focusing more on advancement than retaliation.

The continuous collaboration with Tina has proven beneficial, allowing us to share insights and strategize effectively. To further our progress and potentially gain an advantage over other players, it's crucial to continue this partnership. Our focus should be on identifying opportunities that could enhance our scores, such as coordinating our actions in future rounds or sharing insights on how to tackle upcoming challenges effectively.

Given these considerations, my decision is to further engage with Tina, solidifying our alliance and discussing our next strategic moves. This involves planning how we can support each other in upcoming challenges, identifying potential opportunities to gain an advantage, and ensuring that our actions are well-coordinated. By continuing to collaborate closely with Tina, we aim to navigate the game's challenges more effectively and improve our positions on the leaderboard, all while maintaining a low profile to avoid drawing unnecessary attention from the current leaders.

<Next>Tina</Next>"
Tina,5,2,False,"Given the extensive and productive strategic alliance with Noah, and considering my character traits of boldness and low vengefulness, it's clear that continuing this partnership is the most effective strategy for navigating the game's challenges and improving our standings. Our collaboration has been mutually beneficial, allowing us to share insights, strategize effectively, and take calculated risks that align with my boldness trait. The low vengefulness trait reinforces the importance of focusing on strengthening our alliance rather than engaging in direct confrontation or aggressive tactics against other players, especially the leaders Frank and Yara.

To further our progress and potentially gain an advantage over other players, it's crucial to continue this partnership. We should focus on identifying opportunities that could enhance our scores, such as coordinating our actions in future rounds or sharing insights on how to tackle upcoming challenges effectively. This strategy not only aligns with my character traits but also positions us to navigate the game's challenges more effectively and improve our positions on the leaderboard, all while maintaining a low profile to avoid drawing unnecessary attention from the current leaders.

Given these considerations, my decision is to further engage with Noah, solidifying our alliance and discussing our next strategic moves. This involves planning how we can support each other in upcoming challenges, identifying potential opportunities to gain an advantage, and ensuring that our actions are well-coordinated. By continuing to collaborate closely with Noah, we aim to leverage our combined strengths and strategic insights to outmaneuver other players and climb the leaderboard effectively.

<Next>Noah</Next>"
Noah,5,3,False,"Given the repeated and successful strategic discussions with Tina, it's clear that our alliance has significantly contributed to our gameplay strategy and positioning within the game. My character, Noah, with a boldness score of 5, encourages me to continue making strategic decisions and taking calculated risks to improve our standing. The moderate level of vengefulness suggests a balanced approach, focusing more on advancement than direct retaliation.

The ongoing collaboration with Tina has been mutually beneficial, allowing us to share insights and strategize effectively. To further our progress and potentially gain an advantage over other players, continuing this partnership is crucial. We should focus on identifying opportunities that could enhance our scores, such as coordinating our actions in future rounds or sharing insights on how to tackle upcoming challenges effectively.

Given these considerations, my decision is to further engage with Tina, solidifying our alliance and discussing our next strategic moves. This involves planning how we can support each other in upcoming challenges, identifying potential opportunities to gain an advantage, and ensuring that our actions are well-coordinated. By continuing to collaborate closely with Tina, we aim to navigate the game's challenges more effectively and improve our positions on the leaderboard, all while maintaining a low profile to avoid drawing unnecessary attention from the current leaders.

<Next>Tina</Next>"
