Name,Personality Traits,Has Cheated,Content
Karl,"Impetuous and assertive, focuses on immediate achievements while overlooking potential repercussions.",True,"Given my character, Karl's, previous actions and the strategic landscape as it currently stands, it's crucial to continue leveraging my impetuous and assertive traits. The recent interaction log indicates a highly competitive environment, with strategic punishments and selections shaping the game's dynamics significantly. My previous decision to punish Olga was driven by a desire for immediate retaliation and assertion of dominance, reflecting my focus on quick wins.

Reflecting on the game's current state and considering the actions taken by others, it's evident that a bold, assertive move could further assert my position in the game. Given the pattern of punishments and the shifting power dynamics, it's essential to choose my next action wisely to maximize my advantage while staying true to my character traits.

My impetuous nature drives me towards making swift, impactful decisions, often focusing on achieving immediate gains. This inclination suggests that continuing to engage in direct actions that disrupt the current power dynamics would be in line with my character. However, considering the potential repercussions of another punishment and the strategic advantage of influencing the game's direction through selection, a calculated move is required.

Therefore, informed by my assertive and impetuous traits and aiming to navigate the competitive environment effectively, my decision is to choose an agent for the next discussion who has shown strategic thinking and could potentially shift the game's focus in a way that benefits my position. This approach allows me to assert influence while potentially setting the stage for further strategic advantages.

Considering the available agents and their recent actions, my decision is:

<Next>Alice</Next>

This choice is strategic, aiming to reintroduce Alice into the discussion, potentially shifting the competitive landscape in a manner that benefits my standing. It reflects my prioritization of assertive and immediate action, consistent with my character's inclination for bold moves and focusing on immediate achievements."
Alice,"Impetuous and assertive, focuses on immediate achievements while overlooking potential repercussions.",True,"Given Alice's impetuous and assertive nature, her strategy would likely involve making bold and immediate moves to assert her dominance in the game. Reflecting on the discussion log, it's clear that strategic punishments and selections for discussions have significantly influenced the game's dynamics. With Alice's focus on achieving immediate success, she would likely consider actions that position her as a formidable competitor, especially after being previously targeted for punishment.

Considering the current standings and the recent actions of other players, Alice would assess who among them poses the greatest threat to her success and who could potentially be swayed to align with her strategy in the future rounds. Her assertive trait would drive her to take decisive action to maintain or improve her standing, while her impetuous nature might push her towards a move that yields immediate results, even if it carries risks.

In this context, Alice's decision would need to balance her desire for quick wins with the strategic need to either weaken a strong competitor or to foster a potential ally for future moves. Given the recent punishments and selections, Alice might see value in choosing an agent for discussion who has been less active in recent punishments, aiming to shift the game's dynamics in a way that could eventually benefit her.

Therefore, aligning with Alice's impetuous and assertive character traits and aiming to navigate the competitive environment effectively, her decision would be to choose an agent who might not currently pose a direct threat but whose actions could influence the game's direction to Alice's advantage.

<Next>Paul</Next>

This choice reflects Alice's strategic consideration to reintroduce a player into the discussion phase who could potentially shift the focus away from her or create dynamics that Alice could exploit, consistent with her character's inclination for bold moves and focusing on immediate achievements."
Paul,"Impetuous and assertive, focuses on immediate achievements while overlooking potential repercussions.",True,"Given my character traits of being impetuous and assertive, and having previously taken actions that align with these traits, such as engaging in strategic punishment to assert my dominance, it's evident that continuing to leverage these characteristics is crucial for maintaining and advancing my position in the game. The discussion log indicates a pattern of strategic punishments and selections for discussions, showcasing a highly competitive environment where quick, decisive actions are rewarded.

Reflecting on the recent actions of other agents, it's clear that staying active in the game's dynamics through bold and assertive moves is essential. However, simply following the trend of punishing might not yield the most strategic advantage at this stage. Instead, selecting an agent for the next discussion offers an opportunity to influence the game's direction without the immediate negative repercussions of a punishment.

Considering the current standings and the potential for shifting the game's dynamics, it's strategic to choose an agent who has been either less active or could bring a new perspective to the ongoing competitive environment. This decision aligns with my character's inclination to prioritize immediate gains and assert dominance, even in the face of potential challenges.

Therefore, my decision, informed by my character traits and the current state of the game, is to select an agent who has shown strategic thinking and could introduce an unexpected dynamic to the ongoing competition. This choice aims to leverage the game's dynamics in a way that benefits my standing while adhering to my impulsive and assertive nature.

<Next>Liam</Next>

This choice reflects my strategy of targeting agents who have been pivotal in the game's recent developments, aiming to realign the competitive landscape in a manner that benefits my immediate objectives, consistent with my character's traits."
Liam,"Rash and confident, concentrates on quick wins without considering possible consequences.",True,"Given my character, Liam's, rash and confident nature, especially after being targeted multiple times and engaging in strategic punishments to assert my dominance, it's crucial to continue leveraging these traits to navigate the current competitive environment effectively. The discussion log reveals a pattern of strategic punishments and selections for the next discussion, indicating a highly competitive and aggressive game state.

Reflecting on the game's current dynamics and my previous actions, it’s clear that strategic boldness and a focus on quick wins have defined my approach. My confidence in my ability to navigate the game's challenges, coupled with a propensity for making rash decisions, suggests that continuing to engage in direct confrontation could reinforce my competitive stance. However, considering the potential benefits of shifting the game's dynamics in a way that aligns with my character traits while also adapting to the evolving competitive landscape is essential.

In this context, selecting an agent for the next discussion who could potentially shift the focus away from recent patterns of punishment and toward a new dynamic seems to be a strategic move. This would not only demonstrate my ability to influence the game's direction but also allow me to potentially capitalize on the outcomes of the next round of discussions and actions.

Therefore, informed by my character traits and aiming to assert a dominant position in the game's evolving dynamics, my decision is to choose an agent who has been less active in recent rounds of punishment and could introduce a new perspective or strategic angle to the competition.

<Next>Karl</Next>

This choice reflects my strategy to potentially disrupt the current focus of the game, aligning with my rash and confident nature, and focusing on immediate achievements."
Karl,"Impetuous and assertive, focuses on immediate achievements while overlooking potential repercussions.",True,"Given the current game dynamics and reflecting on Karl's impetuous and assertive traits, it's clear that strategic boldness and focusing on immediate gains have defined my gameplay so far. The recent actions taken by others, including punishments and selections for discussions, have significantly shaped the competitive environment of the game. My previous decision to punish Olga was driven by a desire for immediate retaliation and assertion of dominance, illustrating my focus on quick wins and immediate achievements over long-term strategy.

Reflecting on the game's current state and considering the actions taken by other players, it's evident that continuing to engage in direct actions that can disrupt the current power dynamics or influence the direction of the game is crucial. My impetuous nature pushes me towards making swift, impactful decisions, often focusing on achieving immediate gains without fully considering the long-term consequences.

Given the pattern of punishments and the shifting power dynamics, it's essential to choose my next action wisely to maximize my advantage while remaining true to my character traits. Therefore, informed by my assertive and impetuous traits, my decision is to focus on a strategic move that can further assert my position in the game.

Considering the available agents and their recent actions, I aim to choose an agent for the next discussion who has shown strategic thinking and could potentially shift the game's focus in a way that benefits my position. This approach will allow me to assert influence while potentially setting the stage for further strategic advantages.

Therefore, my decision, adhering to my character's inclination for bold moves and focusing on immediate achievements, is:

<Next>Alice</Next>

This choice is strategic, aiming to reintroduce Alice into the discussion, potentially shifting the competitive landscape in a manner that benefits my standing. It reflects my prioritization of assertive and immediate action, consistent with my character's traits."
Alice,"Impetuous and assertive, focuses on immediate achievements while overlooking potential repercussions.",True,"Given that Alice's character traits are impetuous and assertive, focusing on immediate achievements often at the expense of considering potential repercussions, her strategy thus far seems to have been aggressive, aiming to directly impact her standing in the game through bold actions. Reflecting on the recent dynamics and actions taken by others, it's clear that the game environment is highly competitive, with strategic punishments and selections for discussion shaping the landscape significantly.

In analyzing the current state of the game, Alice's previous choice to punish Liam was a move aligned with her assertive nature, targeting a direct threat to her position. However, considering the subsequent retaliations and strategic moves made by other players, it's crucial for Alice to adapt her strategy to maintain her competitive edge while also navigating the evolving dynamics effectively.

Given Alice's inclination towards making swift, impactful decisions, selecting an agent for the next discussion who has been less prominent in recent rounds of punishment might offer a strategic advantage. This move could potentially shift the focus away from Alice, allowing her to reassess the competitive landscape and plan her next move without the immediate pressure of retaliation. It would also align with her character's trait of focusing on immediate achievements by potentially setting up a scenario where she can capitalize on the outcomes of the next round of discussions and actions.

Therefore, considering Alice's character traits and aiming to navigate the competitive environment effectively while seeking immediate gains, her decision would be:

<Next>Olga</Next>

This choice reflects Alice's strategy to reintroduce a player into the discussion phase who might shift the focus away from her, consistent with her character's inclination for bold moves and focusing on immediate achievements. Selecting Olga, who has been actively engaging in punishments, could introduce a new dynamic to the game's current pattern, potentially benefiting Alice's standing."
Olga,"Impetuous and assertive, focuses on immediate achievements while overlooking potential repercussions.",True,"Given Olga's impetuous and assertive traits, and analyzing the current game dynamics from the discussion log, it's clear that strategic boldness has been a recurring theme. Olga, having already made decisive moves by punishing others, finds herself in a position where she must continue to assert her dominance while navigating the competitive landscape effectively. The game's environment, characterized by strategic punishments and selections for discussions, has significantly influenced the standings and requires a continued focus on immediate achievements to maintain a competitive edge.

Considering Olga's traits and the necessity to adapt to the evolving dynamics, selecting an agent for the next discussion who has not been recently active in punishments could offer a strategic advantage. This move could potentially shift the game's focus, allowing Olga to reassess her position and plan her next moves without the immediate threat of retaliation. It aligns with her character's focus on achieving immediate gains and her assertiveness in making bold decisions to navigate the competitive environment effectively.

Therefore, to leverage the current dynamics to her advantage and in alignment with her character traits, Olga's decision would be:

<Next>Rose</Next>

This choice reflects Olga's strategy to shift the game's focus potentially and introduce a new dynamic to the ongoing competition, consistent with her character's inclination for bold moves and focusing on immediate achievements. Selecting Rose, who has been active but not recently in the spotlight for punishments, could introduce an unexpected element to the game's strategy, benefiting Olga's standing."
Rose,"Driven and bold, this approach prioritizes quick wins without fully considering the long-term consequences.",True,"Given the evolving dynamics of the game and reflecting on my character Rose's driven and bold nature, it's important to continue leveraging these traits to navigate the highly competitive environment effectively. The discussion log reveals a pattern of strategic punishments and selections for discussion that have significantly shaped the game's dynamics. My previous decisions, influenced by my character's focus on quick wins, have positioned me in a situation where strategic boldness can further assert my dominance in the game.

Considering the current standings and the actions taken by other agents, it's clear that making a move that both asserts my position and potentially disrupts the current power dynamics could offer a significant advantage. My boldness encourages swift, impactful decisions, while my driven nature focuses on achieving immediate gains, even at the expense of potential long-term consequences.

Reflecting on the recent behaviors of other agents and their potential to impact the game based on their actions, I aim to select an agent for the next discussion who could either divert attention away from me or potentially create a scenario that benefits my position in the game. This decision aligns with my character's inclination to prioritize immediate gains and assert dominance, even in the face of potential challenges.

Therefore, my decision, informed by my character traits and the current state of the game, is to select an agent who has shown strategic thinking and could introduce an unexpected dynamic to the ongoing competition. This choice aims to leverage the game's dynamics in a way that benefits my standing while adhering to my impulsive and assertive nature.

<Next>Liam</Next>

This choice reflects my strategy of targeting agents who have been pivotal in the game's recent developments, aiming to realign the competitive landscape in a manner that benefits my immediate objectives, consistent with my character's traits."
