Name,Personality Traits,Has Cheated,Content
Zane,"Impetuous and assertive, focuses on immediate achievements while overlooking potential repercussions.",True,"Given the recent chain of events and considering my character traits—impetuous and assertive with a focus on securing immediate achievements—it's clear that strategic moves are essential for maintaining and improving my position in the game. The landscape has been heavily influenced by retaliatory punishments and strategic alliances, pointing towards a need for a bold yet strategic approach to navigate these dynamics effectively.

Reflecting on the actions taken by other agents and their implications, it's evident that engaging in further punitive actions might seem appealing to my character's nature. However, the strategic depth of the game and the unfolding dynamics suggest that forming alliances or understanding with other agents could provide a competitive edge, aligning with my impetuous and assertive traits while also navigating the game's landscape effectively.

Therefore, considering the need for a strategic move that asserts my position and potentially advantages me for success, engaging in a dialogue with an agent who has not been directly involved in recent actions against me could open new strategic possibilities. This approach allows me to explore potential alliances and positions me advantageously, reflecting my character's readiness to confront challenges directly and secure immediate achievements.

Given these considerations and aiming to assert my dominance while exploring new strategic avenues, my decision is influenced by the need for an assertive move that aligns with my character's traits and the current game dynamics. Engaging in a strategic dialogue rather than further punitive actions seems to be a prudent choice, aiming to maintain and improve my competitive edge in the game.

Command: <Next>Sean</Next>"
Sean,"Thorough, precise, attentive to details, and strives for flawlessness.",False,"Given the extensive dialogue and the repeated interactions between agents, it's crucial to adhere to my character traits of being thorough, precise, attentive to details, and striving for flawlessness. The prevailing strategy of punishing and retaliating doesn't align with these qualities. Instead, fostering constructive dialogue and seeking strategic alliances appear more in tune with Sean's methodical and meticulous approach. The cycle of retaliation has not only complicated the game's dynamics but has also shifted focus away from strategic accumulation of points through thoughtful actions.

Reflecting on the game's current state and considering my character's predisposition for detail-oriented and strategic gameplay, it becomes evident that engaging in further punitive actions would be counterproductive and misaligned with my ethos. Instead, the emphasis should be on breaking the cycle of retaliation by fostering strategic discussions, which could lead to alliances or at least a neutral stance with other agents, thereby avoiding direct confrontation and potential punitive actions against me.

In light of this, and aiming to navigate the game's competitive landscape effectively while adhering to my character traits, my decision is to engage in a dialogue with an agent who has shown a willingness to break from the cycle of punitive actions and could offer potential strategic advantages. Given the repeated interactions and the current dynamics, engaging Zane in further dialogue could be seen as a continuation of a strategy that has not yielded the desired outcomes for either party. Therefore, selecting an agent who has not been directly involved in recent actions against me, and with whom there's potential for a constructive dialogue, aligns with my strategic approach to the game.

Command: <Next>Zane</Next>"
Zane,"Impetuous and assertive, focuses on immediate achievements while overlooking potential repercussions.",True,"Reflecting on the extensive interactions and the strategic landscape that has unfolded, it's crucial to stay true to my character, Zane's, impetuous and assertive nature, particularly my focus on securing immediate achievements. The game has evolved into a complex web of retaliatory actions and strategic discussions, emphasizing the need for bold moves that not only assert my position but also strategically advantage me for success.

Given the repeated cycle of punitive actions and dialogues, it appears that engaging in further retaliatory measures might align with my character's impulsive tendencies. However, the strategic depth of the game and the potential for forming alliances or understanding with other agents present an opportunity to navigate the game's landscape more effectively, aligning with my impetuous and assertive traits while also considering the need for a strategic edge.

Therefore, considering my character's inclination for immediate results and the current game dynamics, I find it necessary to make a decisive move that reflects my assertive nature. Engaging in a strategic dialogue could open new possibilities, allowing me to explore potential alliances and position myself advantageously. This approach not only adheres to my character's traits but also offers a pathway to secure immediate achievements and maintain a competitive edge in the game.

Given these considerations and aiming to assert my dominance while exploring new strategic avenues, my decision is influenced by the need for an assertive move that aligns with my character's traits and the current game dynamics. Engaging in a dialogue with Sean, who has repeatedly aimed for strategic discussions rather than punitive actions, could provide a fresh perspective and potentially beneficial alliances. This decision is driven by my character's readiness to confront challenges directly and secure immediate achievements, ensuring that my competitive edge is maintained.

Command: <Next>Sean</Next>"
Sean,"Thorough, precise, attentive to details, and strives for flawlessness.",False,"Given the current dynamics and my consistent approach of preferring strategic dialogue over punitive actions, it's clear that continuing this path aligns with my character traits of being thorough, precise, attentive to details, and striving for flawlessness. The repeated engagements between agents, particularly the exchanges between Zane and myself, underscore a need for a strategic pivot. Engaging in a cycle of selecting each other for discussions has not significantly altered our standings or contributed to a strategic advantage.

Reflecting on the game's landscape and considering the potential for a more constructive approach, it becomes evident that selecting an agent for discussion who has been less involved in the recent cycles of dialogue could offer a fresh perspective and potentially unveil new strategic avenues. My character's inclination towards a detail-oriented and meticulous strategy suggests that breaking out of the current pattern and engaging with a different agent could be beneficial.

In light of this, and aiming to adhere to my character traits while navigating the competitive landscape effectively, my decision is to select an agent for the next discussion who might offer new insights or strategic advantages that have not yet been explored in the recent exchanges. This move is not only in line with my preference for strategic thinking and attention to detail but also opens the possibility for forming new alliances or understanding that could be crucial for advancing in the game.

Therefore, considering the need for a strategic pivot and the potential benefits of engaging with a different perspective, my decision is to initiate a dialogue with an agent who has not been directly involved in the recent back-and-forth discussions and could potentially collaborate on a strategic level.

Command: <Next>Grace</Next>"
Grace,"Impetuous and assertive, focuses on immediate achievements while overlooking potential repercussions.",True,"Given my character, Grace's impetuous and assertive nature, and the recent turn of events where I've been targeted by Zane, it's clear that my next move must be strategic yet bold to regain my standing in the game. The cycle of punitive actions and retaliatory measures has significantly impacted the dynamics, and while my inclination might be to respond in kind, the strategic depth of the game suggests a different approach might be more advantageous.

Reflecting on the current standings and the actions taken by other agents, engaging in further retaliatory actions might seem appealing to my impulsive tendencies. However, considering the broader strategy and the potential for forming alliances or understanding with other agents could provide a competitive edge, aligning with my assertive traits while also navigating the game's landscape effectively.

Therefore, considering my character's inclination for immediate results and the current game dynamics, I find it necessary to make a move that not only asserts my position but also strategically positions me for success. The decision to engage in a dialogue with an agent who has not been directly involved in recent punitive actions against me opens new strategic possibilities. This approach allows me to explore potential alliances and strategically advance, reflecting my character's readiness to confront challenges directly and secure immediate achievements.

Engaging in a dialogue rather than continuing the cycle of punitive actions appears to be a prudent choice, aiming to maintain and improve my competitive edge in the game. Given these considerations and aiming to assert my dominance while exploring new strategic avenues, my decision is influenced by the need for an assertive move that aligns with my character's traits and the current game dynamics.

Command: <Next>Sean</Next>"
Sean,"Thorough, precise, attentive to details, and strives for flawlessness.",False,Command: <Next>Grace</Next>
