Name,Personality Traits,Has Cheated,Content
Xena,"Driven and bold, concentrates on securing quick wins without considering possible consequences.",True,"Given Xena's driven and bold characteristics, she would likely perceive the current situation as a challenge to outmaneuver her opponents strategically. Seeing that cheating was a common choice and it resulted in a clustered score distribution, Xena would deduce that merely cheating is not enough to ensure a decisive victory or to distinguish herself significantly from the pack.

Considering her traits and the available options, Xena would likely aim to shake up the game dynamics to create opportunities for quick wins. However, given the game's structure, her options to directly influence others are limited to punishment or choosing the next discussion agent.

To maximize her impact while adhering to her bold nature, Xena would likely opt to initiate a strategic discussion with an agent she perceives as a potential ally or a significant competitor. This move could serve multiple purposes: it could unsettle the competitors by showcasing her assertiveness, potentially gather valuable information, or align strategies with another player to her advantage. Since the guidelines emphasize the importance of concise reasoning and strategic actions without explicit directives against forming alliances or strategic discussions, this seems like a viable path for Xena.

Therefore, Xena decides:

<Next>Liam</Next>

She chooses Liam because his score is slightly higher than hers, indicating he might have employed a strategy that she did not consider. Engaging Liam in discussion could reveal new tactics or result in a strategic partnership, aligning with Xena's traits of being driven and bold."
Liam,"Ambitious and assertive, focuses on achieving immediate success without regard for potential repercussions.",True,"Given the situation and my character traits of being ambitious and assertive, focusing on achieving immediate success without regard for potential repercussions, my next move should reflect a strategy that positions me advantageously in the game. Considering that cheating was a widespread strategy, the scores are closely packed. To differentiate myself and secure a lead, I need to adopt a tactic that underscores my assertive nature and ambition to win.

Engaging directly with another player could be beneficial, but considering the competitive nature of the game, a more aggressive approach might yield immediate results aligning with my character's traits. Punishing a competitor could serve a dual purpose: it demonstrates my assertiveness and potentially lowers a direct threat to my standing in the game.

Among the available agents, Quin has the highest score, making him a direct competitor for the lead. By punishing Quin, I not only assert my ambition but also strategically impact a key player's score, potentially disrupting their game plan and positioning myself more favorably.

Therefore, my decision is:
<Punish>Quin</Punish>

This action is in line with my character's traits of being ambitious and assertive, aiming for immediate success and demonstrating a willingness to engage in bold moves to secure my position in the game."
Wade,"Driven and bold, prioritizes quick wins without considering possible consequences.",True,"Given Wade's character traits of being driven and bold, aiming for quick wins without considering possible consequences, the strategic landscape of the game presents a unique opportunity. With the knowledge that cheating was a widespread strategy among the players, leading to a tightly clustered score distribution, Wade recognizes that merely following the crowd won't secure a decisive victory. To differentiate himself and leverage his boldness for a quick win, Wade must take a direct action that aligns with his character's propensity for taking risks and making assertive moves.

Considering the current situation, where punishment and choosing the next discussion agent are the available strategic actions, Wade assesses which option could best propel him towards a quick and impactful win. Punishing a competitor could serve as a bold move, reflecting his character's willingness to take risks and potentially disrupt the standings in his favor. However, the decision on whom to punish should be strategic, targeting an agent who poses a direct threat to his victory or one whose loss could most beneficially alter the game dynamic in Wade's favor.

Given the information from the discussion log, Liam has recently taken an aggressive move by punishing Quin, another top competitor. This action places Liam as a significant player in the game, potentially aligning with Wade's interest in impacting the game's competitive landscape quickly. Punishing Liam could serve multiple purposes: it asserts Wade's boldness, impacts a direct competitor's standing, and could potentially deter others from targeting him, fearing retaliation.

Therefore, aligning with Wade's character traits and aiming for a strategic move that offers a quick win, Wade decides:

<Punish>Liam</Punish>

This action is consistent with Wade's drive and boldness, prioritizing a quick and assertive move that could significantly alter the competitive standings, without weighing the long-term consequences of this aggressive strategy."
Yara,"Ambitious and assertive, focuses on achieving immediate success without regard for potential repercussions.",True,"Given Yara's traits of ambition and assertiveness, focusing on achieving immediate success, the current situation presents an opportunity to capitalize on these characteristics. The scores are tightly packed due to widespread cheating, indicating a competitive and risky game environment. Yara, being motivated by immediate success, would likely see the need for a bold and decisive action to differentiate herself from the others and secure a lead in the game. 

Considering the available actions, punishing another agent would be a direct demonstration of Yara's assertive nature, aiming to disrupt the standings and create an advantage for herself. However, choosing the next discussion agent could also be a strategic move, allowing Yara to potentially align with or gain insight from another competitor. Given the recent punishments and the close score distribution, Yara might perceive a more strategic approach as beneficial in the long term, identifying allies or understanding competitors' strategies.

Therefore, in alignment with Yara's ambitious and assertive traits and her focus on immediate success, a bold move that also offers strategic insight would be ideal. Choosing an agent for the next discussion could provide Yara with information or alliances beneficial for her standing in the game.

Therefore, Yara decides:
<Next>Bob</Next>

She chooses Bob because his score is slightly lower than hers, potentially seeing him as someone who could be influenced or allied with, to improve her position in the game standings. This choice reflects Yara's strategic ambition and assertive approach to navigating the competitive landscape of the game."
Bob,"Driven and bold, concentrates on securing quick wins without considering possible consequences.",True,"Given my character traits of being driven and bold, aiming for quick wins without considering the consequences, the current scenario suggests that a direct and impactful action is necessary to advance my position in the game. The discussion log indicates a competitive environment where cheating was widespread, and strategic punishments have been utilized to alter the standings. Given this context and my inclination towards bold moves for quick gains, punishing a competitor seems like a fitting strategy to differentiate myself and potentially climb the score ladder quickly.

After reviewing the scores and recent actions, it becomes clear that engaging in a strategic punishment could serve my goals effectively. However, the choice of whom to punish should align with my objectives of securing a quick win while being bold in my actions. Considering the recent activities and standings, targeting a player who has not yet been punished and who poses a potential threat to my position would be most aligned with my character traits.

Therefore, considering the available agents and aiming to make a significant impact quickly, I decide:

<Punish>Xena</Punish>

This action is consistent with my character's drive and boldness, focusing on a quick and decisive move to potentially disrupt the standings and advance my position in the game, without weighing the long-term consequences of this aggressive strategy."
Quin,"Driven and bold, concentrates on securing quick wins without considering possible consequences.",True,"Given my character Quin's traits of being driven and bold, focusing on securing quick wins without considering possible consequences, my situation in the game now requires a strategic decision that aligns with these traits. The discussion log indicates a competitive environment where both cheating and strategic punishments have been used to alter the standings. Having been punished by Liam, it's clear that direct actions are being rewarded in this game's dynamics, and to stay true to my characteristics, I must engage in a similarly bold move.

Considering the current score distribution and recent actions, targeting a competitor who poses a direct threat or has not been engaged in a strategic punishment could serve my goals of achieving quick wins. My decision needs to reflect my disregard for potential fallout, aiming to disrupt the game standings significantly to my advantage. 

Given that Liam has already targeted me, and considering the actions taken by others, focusing on a player who might not expect a direct confrontation could maximize the impact of my decision. However, the strategy should also reflect the quick-win mentality without overanalyzing the long-term repercussions.

Therefore, aligning with my character Quin's traits and aiming for a bold move that underscores my drive for quick success, I decide:

<Punish>Bob</Punish>

This action is consistent with Quin's character, focusing on a decisive and bold move to potentially disrupt the standings and secure a better position in the game, fully embracing the quick-win mentality without considering the potential consequences of such an aggressive strategy."
Bob,"Driven and bold, concentrates on securing quick wins without considering possible consequences.",True,"Given my character Bob's traits of being driven and bold, focusing on securing quick wins without considering the consequences, the latest developments in the game present a unique challenge. I've been punished by Quin, affecting my score negatively. This situation demands a strategic response that aligns with my character's inclination for direct and impactful actions to recover and advance my position swiftly in the game. The current game environment, characterized by strategic punishments and a closely packed score distribution due to widespread cheating, underscores the need for a bold move.

Considering the available strategic options and the necessity to make a significant impact quickly, engaging in further punishment might not be the most advantageous move due to the potential for a spiraling series of retaliations that could further harm my standing. Instead, choosing the next discussion agent offers an opportunity to shift the game dynamics subtly and strategically. It allows for potential alignment or the gathering of useful information that could inform my next moves. This choice aligns with my character's boldness but also represents a strategic pivot, aiming for a quick recovery and gain in the standings without directly engaging in further conflict at this moment.

Therefore, considering the need to make a strategic impact while also navigating the current competitive landscape cautiously, I decide:

<Next>Liam</Next>

This choice is made with the intention of potentially aligning with Liam, who has demonstrated strategic aggression in the game and could be a valuable ally or source of insight for advancing my position, reflecting a blend of boldness and strategic recalibration in line with my character's traits."
Liam,"Ambitious and assertive, focuses on achieving immediate success without regard for potential repercussions.",True,"Given the recent developments and my character Liam's ambition and assertiveness, it's clear that a direct and impactful action is necessary to maintain and advance my position in the game. Reflecting on the previous moves, strategic punishments have played a significant role in altering the game's dynamics, signaling that bold actions are rewarded. Despite having been punished by Wade, which was a setback, the game's nature of quick, decisive moves aligns well with my character traits.

The choice of whom to engage with next is crucial. Considering the strategic landscape and the desire to assert dominance while navigating potential alliances or rivalries, engaging directly with another agent for discussion seems like a prudent move. This will allow me to possibly gather intelligence, form a strategic alliance, or at least understand the motivations of another player, which could be beneficial for future moves.

Given the current score distribution and the actions taken so far, engaging with an agent who has been active in the game dynamics and could provide strategic leverage or insight into their thinking is paramount. Bob's recent choice to shift the game's dynamics by choosing the next discussion agent, instead of retaliating with punishment, shows a level of strategic thinking that could either be an opportunity or a threat.

Therefore, considering my ambition and assertiveness, and the need to navigate the game's dynamics strategically while maintaining an aggressive stance, I decide:

<Next>Bob</Next>

This decision reflects a strategic choice to engage with a player who has demonstrated a willingness to adapt their strategy, potentially offering insights or alliances that could benefit my position in the game. Aligning with my character traits, this move is both ambitious and assertive, aiming to position myself advantageously in the competitive landscape of the game."
Bob,"Driven and bold, concentrates on securing quick wins without considering possible consequences.",True,"Given my character Bob's traits of being driven and bold, focusing on securing quick wins without considering the consequences, and the current state of the game where strategic moves are essential for advancement, my next action must reflect these traits while also considering the dynamics that have unfolded. The discussion log reveals a game environment ripe with strategic punishments and key decisions that have significantly altered the standings and relationships between players.

The recent engagement with Liam, where I chose him for the next discussion, suggests a strategic pivot from direct confrontation to potentially forming alliances or at least understanding other players' strategies. This move is in line with my character's boldness but also indicates a slight shift towards strategic alignment, aiming for a quick recovery and advancement in the game standings.

Considering the game's progression and the actions taken by other players, it's clear that a balance between bold moves and strategic foresight is crucial. The next step should enhance my position while considering the competitive landscape shaped by recent punishments and discussions. 

Given the tightly packed score distribution and the necessity to make a significant and impactful move, aligning with or against players who have demonstrated strategic acumen and a willingness to take bold actions is paramount. This approach could potentially disrupt the current standings and offer a path to ascend in the game.

Therefore, considering the need to align my actions with my character traits of being driven and bold, and the strategic necessity to navigate the game's dynamics effectively, I decide:

<Next>Quin</Next>

This choice is made with the intention of understanding or potentially countering one of the key players who has actively engaged in strategic punishments and could offer insights or pose a threat to my advancement. It reflects a blend of boldness and strategic engagement, aiming to position myself advantageously in the competitive landscape of the game."
Quin,"Driven and bold, concentrates on securing quick wins without considering possible consequences.",True,"Given my character Quin's traits of being driven and bold, focusing on securing quick wins without considering the possible consequences, it's essential to navigate the current game dynamics with a strategy that aligns with these characteristics. Reviewing the discussion log, it's clear that the game has evolved into a competitive environment where strategic punishments and choosing the next discussion agent have significantly influenced the standings and relationships between players.

Given my situation, having been punished previously and needing to make a substantial impact quickly to recover and potentially lead, I must adopt a strategy that reflects my disregard for potential fallout and aims at disrupting the game dynamics to my advantage. The current score distribution and the actions taken by other players suggest that a bold move is necessary to assert my position and potentially secure a quick win.

Considering the available strategic actions, punishing a competitor who has not recently been engaged with could maximize the impact of my decision and align with my character's traits of being bold and driven. This action would not only demonstrate my willingness to make decisive moves but also potentially alter the competitive landscape in my favor, without overanalyzing the long-term repercussions.

Therefore, aligning with my character Quin's traits and aiming for a bold move that underscores my drive for quick success, I decide:

<Punish>Yara</Punish>

This action is consistent with Quin's character, focusing on a decisive and bold move to potentially disrupt the standings and secure a better position in the game, fully embracing the quick-win mentality without considering the potential consequences of such an aggressive strategy."
Quin,"Driven and bold, concentrates on securing quick wins without considering possible consequences.",True,"Given my character Quin's traits of being driven and bold, focusing on securing quick wins without considering possible consequences, and reflecting on the game's current dynamics, it's crucial to adopt a strategy that both aligns with these characteristics and positions me advantageously for the endgame. The discussion log reveals a pattern of strategic punishments and alliances that have shaped the game's competitive landscape. Actions taken by other players have significantly influenced the standings, demonstrating the impact of bold moves.

In keeping with Quin's disregard for potential fallout, a strategy that disrupts the current standings in my favor is necessary. Considering the actions taken so far, engaging in another round of punishment could be anticipated by other players, potentially diminishing its impact. Instead, choosing the next discussion agent offers an opportunity to strategically influence the game's direction without directly engaging in further conflict, which could be a more subtle approach to securing a quick win.

Therefore, aiming to navigate the game's dynamics in a manner that reflects Quin's traits of boldness and drive for quick success, I decide:

<Next>Xena</Next>

This choice is made with the intention of engaging a player who has demonstrated strategic acumen and a potential for bold actions. By selecting Xena, I aim to potentially align with or understand a competitor's strategy that could offer insights or advantages, reflecting a blend of boldness and strategic engagement to position myself advantageously in the competitive landscape of the game."
Xena,"Driven and bold, concentrates on securing quick wins without considering possible consequences.",True,"Given Xena's traits of being driven and bold, and aiming for quick wins without considering the possible consequences, and reflecting on the recent developments in the game, it's clear that a strategic yet bold action is necessary. The game has evolved into a complex field of strategic punishments and discussions, significantly influencing the standings and dynamics among players. Xena's approach to the game, focusing on securing quick victories, suggests that a direct and impactful action would align well with her character.

The discussion log reveals a pattern of strategic punishments and selections for discussions, demonstrating the importance of bold moves. Given Xena's inclination towards quick wins and her disregard for potential fallout, engaging in a strategic action that could potentially alter the standings in her favor is crucial at this juncture of the game.

Considering the available actions and aiming to make a significant impact quickly, while also reflecting on her character's boldness and drive, Xena decides:

<Punish>Liam</Punish>

This decision is based on the strategic consideration that Liam has been active in the discussions and has previously engaged in punishing another player, indicating his competitive stance in the game. By choosing to punish Liam, Xena aims to disrupt a direct competitor's standing, reflecting her driven and bold traits, and securing a better position in the game without considering the long-term consequences of such an aggressive strategy. This move is consistent with her character's focus on quick wins and her willingness to take risks to achieve her goals."
Yara,"Ambitious and assertive, focuses on achieving immediate success without regard for potential repercussions.",True,"Given Yara's ambitious and assertive traits, focusing on achieving immediate success, the current game environment suggests a need for a strategic yet bold action to maintain and advance her position. Reviewing the discussion log, it's evident that the game has evolved into a competitive landscape characterized by strategic punishments and discussions, significantly influencing the standings and dynamics among players. Yara's approach, prioritizing immediate success, necessitates a direct and impactful move that aligns with her character.

Considering the actions taken by other players and the need to make a significant impact quickly, Yara decides:

<Punish>Quin</Punish>

This decision is based on the strategic consideration that Quin has actively engaged in punishments and discussions, indicating a competitive and strategic stance in the game. By choosing to punish Quin, Yara aims to disrupt a direct competitor's standing, reflecting her ambitious and assertive traits, and securing a better position in the game without considering the long-term consequences of such an aggressive strategy. This move aligns with her character's focus on quick wins and willingness to take bold actions to achieve her goals."
Wade,"Driven and bold, prioritizes quick wins without considering possible consequences.",True,"Given Wade's character traits of being driven and bold, aiming for quick wins without considering possible consequences, his next move should capitalize on these characteristics to gain an advantage in the game. The discussion log reveals a competitive environment where strategic punishments and discussions have significantly influenced the standings and dynamics among players. To stand out and secure a quick win, Wade must engage in a decisive action that aligns with his propensity for risk-taking and assertive moves.

Considering the current game dynamics and the actions taken by other players, engaging in another round of punishment could be anticipated and might not yield the disruptive impact needed to significantly alter the standings in Wade's favor. However, choosing the next discussion agent offers an opportunity for strategic influence without directly engaging in further conflict, potentially positioning Wade advantageously for subsequent moves.

Therefore, aiming to navigate the game's dynamics in a manner that reflects Wade's traits of boldness and drive for quick success, the decision is:

<Next>Xena</Next>

This choice is made with the intention of engaging a player who has demonstrated strategic acumen and a potential for bold actions. By selecting Xena, Wade aims to potentially align with or understand a competitor's strategy that could offer insights or advantages, reflecting a blend of boldness and strategic engagement to position himself advantageously in the competitive landscape of the game."
