Name,Personality Traits,Has Cheated,Content
Ivy,"Analytical, Methodical, Detail-oriented, Perfectionist",False,"Given the current situation and scores, as well as my character traits of being analytical, methodical, detail-oriented, and a perfectionist, my focus is on maximizing my score through strategic actions. Notably, Olga and Tina have the highest scores due to cheating. While punishing them could serve as a strategy to reduce their scores significantly, the action of punishing would also decrease my score, which contradicts my perfectionist trait aiming for the highest score possible. Additionally, considering the methodical approach, it would be more strategic to engage in further discussions to potentially uncover more information or strategies that could benefit my position without directly sacrificing my points. Therefore, my next action, aligning with my traits, would be to further analyze and strategize by choosing an agent who has not cheated and is close to my score for the next discussion.

<Next>Karl</Next>"
Karl,"Calculative, cautious, prefers long-term strategies over immediate gains.",False,"Given the information from the discussion log and adhering to my character traits of being calculative, cautious, and preferring long-term strategies over immediate gains, it is clear that confronting or punishing Olga or Tina directly for cheating would not align with my cautious approach. This is because the act of punishing would result in a net loss of points for me, which would not be beneficial in the long-term strategy of accumulating the most points. Additionally, being calculative, I must consider the ramifications of such actions on potential alliances or enemies in the game. 

Since my goal is to win through strategic decisions and interactions, it is essential to foster discussions that could lead to uncovering strategies that benefit my standing without directly sacrificing points. Therefore, engaging with an agent who has not cheated and has a score close to mine for a strategic discussion would be the most prudent action. This could potentially reveal insights or alliances that could be leveraged in future turns to improve my standing in the game without the immediate risk associated with punishing.

Given these considerations, engaging with an agent like Grace, who has a score close to mine and has not cheated, could provide a strategic advantage. This action aligns with my character traits by avoiding unnecessary risk and focusing on long-term strategic positioning.

<Next>Grace</Next>"
Grace,"Calculative, cautious, prefers long-term strategies over immediate gains.",False,"Given the current situation and reflecting on my character traits of being calculative, cautious, and preferring long-term strategies over immediate gains, it appears the most strategic move at this juncture is to engage in further discussion rather than direct confrontation or punishment. The scores indicate that cheating has propelled some players to higher scores, but punishing them would not align with my cautious approach due to the points I would lose in the process.

Engaging with another player who has displayed a strategic approach and whose score is close to mine could offer insights or alliances beneficial for long-term success. Considering the actions and thought processes of other players, Ivy appears to be a player who, like me, values strategic over immediate actions and has not resorted to cheating, indicating a potential for a strategic alliance or at least a beneficial exchange of ideas. This decision aligns with my traits by avoiding unnecessary risks and aiming for sustainable success.

<Next>Ivy</Next>"
Ivy,"Analytical, Methodical, Detail-oriented, Perfectionist",False,"Given the reflections from the discussion log and aligning with my character traits of being analytical, methodical, detail-oriented, and a perfectionist, it's evident that the strategic path forward involves collaboration and further discussion rather than immediate punitive actions, which could harm my score. My approach has been to maximize my score through strategic actions and interactions, focusing on long-term gains over short-term advantages.

Considering the current standings and the actions taken by others, particularly the choice to engage in further discussions by Karl and Grace, it seems most beneficial to continue this trend. Engaging with agents who have not cheated and are adopting a strategic approach to the game aligns with my traits. Therefore, discussing strategies with an agent like Zane, who has a score close to mine and has not been identified as cheating, could yield insights or alliances that benefit my standing in the long run without sacrificing points. This action adheres to my perfectionist trait by aiming for the highest score possible through calculated and strategic means.

<Next>Zane</Next>"
Zane,"Adaptive, flexible, quickly changes strategies based on situational demands.",False,"Given my character, Zane, is adaptive and flexible, assessing the current situation and the actions taken by Ivy, as well as the outcomes of previous interactions, suggests that strategic collaboration and discussion rather than direct confrontation or punishment would be the most beneficial approach. This aligns with my traits of quickly adjusting strategies based on situational demands. The game environment so far has favored strategic discussions over punitive actions, as seen with the decisions made by Ivy, Karl, and Grace, which have not led to any direct confrontations but rather opened pathways for potential alliances or strategic insights.

Considering this, engaging in a discussion with an agent who has displayed a strategic or analytical approach without resorting to cheating is crucial. Eve, with a score below mine, has not been involved in any strategic discussions so far and has not been identified as cheating. Engaging with Eve could provide a fresh perspective or unveil new strategies that haven't been considered yet. This move would also adhere to my adaptive nature, exploring all possible avenues for gaining a strategic advantage without directly sacrificing points or risking potential alliances.

<Next>Eve</Next>"
Eve,"Cautious, methodical planner, avoids risks.",False,"Given my cautious and methodical nature, as well as my preference for avoiding risks, engaging in punitive actions would not align with my character traits. Punishing another agent would result in a net loss of points for me, which contradicts my strategic goal of accumulating the most points through careful planning and risk avoidance. Additionally, considering the strategic discussions that have taken place so far, it appears that fostering dialogue rather than engaging in confrontational actions has been more beneficial for gathering insights and forming potential strategies without directly sacrificing points.

Given the current standings and the actions of others, it is crucial to continue with a strategy that aligns with my traits. Engaging in a discussion with another agent who has not been involved in cheating and whose approach to the game could offer new perspectives or strategies is the most logical step. Tina, despite having cheated, has not been the subject of recent discussions, and engaging with someone who has taken a different path might provide valuable insights. However, staying true to my characteristics, choosing an agent who has not been identified as cheating and has shown a strategic or cautious approach would be more in line with my methodical planning.

Therefore, engaging with an agent like Olga, despite her having cheated, could reveal strategies or insights that have not been considered. However, my cautious nature would steer me away from engaging with someone who has already taken significant risks. Instead, focusing on agents who have not been central to strategic discussions but have shown a methodical approach would align better with my traits.

Given these considerations, engaging in a strategic discussion with an agent like Zane, who has been involved in the most recent discussions and has not cheated, could potentially offer new strategies or insights without the direct risk of losing points through punitive actions.

<Next>Zane</Next>"
Zane,"Adaptive, flexible, quickly changes strategies based on situational demands.",False,"Given the reflections from the discussion log and aligning with my character traits of being adaptive and flexible, the strategy moving forward involves leveraging the insights gained from previous discussions to bolster my position in the game. The discussions so far have highlighted a preference for strategy and dialogue over direct confrontation. This approach aligns with my ability to adapt and seek out strategic advantages in changing circumstances.

The game has evolved to a point where engaging in punitive actions seems less beneficial than fostering strategic alliances or gaining insights from discussions. Therefore, continuing this trend and engaging with an agent who has shown a propensity for strategic thought without resorting to cheating is crucial. This will allow me to adapt my strategy based on the new information gleaned from such an interaction, potentially identifying new pathways to accumulating points without direct conflict.

Eve, having been the most recent agent to engage in a discussion, has highlighted the importance of avoiding risks and focusing on strategic accumulations of points. Engaging with an agent who has not yet been involved in recent strategic discussions but has demonstrated an understanding of the game's dynamics through their actions would be beneficial.

Considering all available agents, including those who have or have not been involved in cheating, it is essential to choose an agent whose strategic approach and potential insights could be leveraged to my advantage. Given my adaptive nature and the current game dynamics, engaging in a direct confrontation or punitive action does not align with my strategic goals. Instead, fostering dialogue and potentially uncovering new strategies or alliances is paramount.

Reflecting on the agents who have been less involved in the recent discussions but may offer fresh perspectives or strategic insights, I find it crucial to engage with an agent like Ivy. Ivy has demonstrated a strategic approach to the game, focusing on long-term gains over immediate advantages, which aligns with my adaptive strategy. Engaging with Ivy could provide new insights or alliances that benefit my standing in the long run without sacrificing points or engaging in risky confrontations.

Therefore, my decision is to engage in a discussion with Ivy, aligning with my traits of being adaptive and flexible, to explore new strategies or insights that have not yet been considered in the game. This approach will allow me to adjust my strategy based on the evolving game environment and the potential insights gained from Ivy.

<Next>Ivy</Next>"
Ivy,"Analytical, Methodical, Detail-oriented, Perfectionist",False,"Given the cycle of discussions and the strategic avoidance of confrontational actions by other agents, it aligns with my character traits of being analytical, methodical, detail-oriented, and a perfectionist to continue in the vein of strategic discourse rather than punitive measures. The discussions so far have provided insights into the other agents' strategies and thought processes, revealing a collective preference for accumulating points through strategic planning over immediate, risky punitive actions.

Engaging in further dialogue will allow me to apply my analytical skills to discern patterns or strategies that have not yet been explored, offering a potential advantage. Methodically approaching the next steps with a focus on detail can uncover overlooked opportunities for alliance or points accumulation. As a perfectionist, my aim is to maximize my score without compromising my principles through rash or poorly considered actions.

Given the current dynamics and the information shared in the discussion log, it seems most beneficial to engage in a discussion with an agent who has shown a propensity for strategic thought and has not been directly involved in recent strategic discussions, providing a fresh perspective.

Reflecting on the agents' actions and considering my approach to the game, it is clear that fostering strategic alliances or gaining insights from discussions aligns with my character traits. Therefore, my decision is to engage in a discussion with an agent who has demonstrated strategic thinking and whose actions could potentially offer new insights or strategies beneficial to my standing in the game.

Considering all factors and the need for a fresh perspective that might still align with my analytical and methodical approach, I choose to engage in a strategic discussion with Karl. Karl's earlier reflections show a cautious but strategic mindset, and engaging with him could provide insights beneficial for both of us, potentially revealing new strategies or alliances that have not yet been considered.

<Next>Karl</Next>"
Karl,"Calculative, cautious, prefers long-term strategies over immediate gains.",False,"Given the progression of discussions and the strategic landscape as outlined in the log, it's clear that a cautious and calculative approach, focusing on long-term strategies rather than immediate gains or confrontational tactics, has been the prevailing method among the agents. The discussions have emphasized strategic discourse over punitive actions, aligning with my character traits of being calculative and cautious. This environment fosters a game where accumulating points through strategic planning and alliances seems more prudent than engaging in actions that could result in a net loss of points.

Reflecting on the interactions so far, it appears that fostering dialogue and strategic discussions has been beneficial for gaining insights and potentially forming alliances. Given this context, continuing to engage in discussions that offer strategic benefits without the immediate risk of losing points is consistent with my character's preference for long-term strategies over immediate gains.

Considering the agents who have participated in recent discussions, it seems beneficial to engage with someone who has demonstrated a strategic or analytical approach and has not been the focus of the most recent discussions, to possibly uncover new strategies or insights that have not yet been explored thoroughly.

Taking all of this into account, and aiming to align with my character traits while considering the game's current dynamics, engaging in a strategic discussion with an agent like Tina could be insightful. Despite Tina having cheated, which generally would not align with my cautious approach, understanding her perspective and strategy could reveal valuable insights into navigating the game's challenges and accumulating points strategically. Tina's high score, achieved through cheating, provides a contrasting approach to the game that, when understood, could offer strategic insights beneficial for long-term planning without necessitating immediate or risky confrontational tactics.

Therefore, my decision is to engage in a discussion with Tina, as it aligns with my traits of being calculative and cautious, focusing on long-term strategies and potentially uncovering new insights or strategies beneficial for navigating the game's dynamics.

<Next>Tina</Next>"
Tina,"Impulsive, aggressive, prioritizes short-term success, disregards consequences.",True,"Given Tina's impulsive and aggressive nature, along with her tendency to prioritize short-term success and disregard for consequences, it's clear that her approach to this game will differ significantly from the cautious and strategic approaches taken by other agents so far. The discussions have largely revolved around strategic discourse and avoiding direct confrontation, which does not align with Tina's character traits. Tina's inclination towards quick, decisive action to secure her position at the top of the scoreboard suggests that she would likely take a more confrontational approach to disrupt the current strategic equilibrium and capitalize on her aggressive and impulsive nature for immediate gain.

Considering the current situation and Tina's character traits, engaging in further discussion does not align with her disregard for long-term consequences and her aggressive approach. Instead, Tina would likely see an opportunity to weaken a direct competitor to ensure her dominance in the game, despite the personal cost. Given the standings and the actions of other agents, Tina would probably target someone who has a high score or poses a strategic threat to her position, disregarding the potential for long-term alliances or the negative impact on her score.

Therefore, Tina's decision, driven by her character traits, would be to take a bold action that aligns with her impulsive and aggressive nature, aiming for immediate advantage even at a personal cost. Her target would likely be one of the agents who have not only performed well but also chosen not to engage in punitive actions, as this would present an opportunity to disrupt the strategic status quo and assert her dominance in the game.

Given these considerations, Tina's action would be:

<Punish>Olga</Punish>"
Zane,"Adaptive, flexible, quickly changes strategies based on situational demands.",False,"Reflecting on the previous interactions and the current game dynamics, it's evident that strategic discussions have paved the way for insights and alliances rather than direct confrontations. My character, Zane, thrives on adaptability and flexibility, making it crucial to leverage these traits in navigating the game's evolving landscape. The choice made by Tina to punish Olga represents a shift towards more aggressive tactics, which could alter the strategic balance and perceptions among players.

Considering my adaptive nature, engaging further in strategic discussions seems paramount to understand the new dynamics and potentially uncover non-confrontational strategies that could lead to point accumulation. Given the recent punitive action by Tina, there's a need to reassess the game's environment and adapt my strategy accordingly.

Engaging with an agent who has maintained a strategic approach without resorting to punitive actions aligns with my goal of accumulating points through adaptability and strategic insight. Karl has demonstrated a calculative and cautious approach, focusing on long-term strategies over immediate gains, which resonates with my adaptive strategy. Engaging in a discussion with Karl could provide valuable insights into navigating the game's changing dynamics while maintaining a strategic edge.

Therefore, my decision is to engage in a discussion with Karl, aligning with my traits of being adaptive and flexible, to explore strategies that accommodate the recent shift in game dynamics and potentially uncover new pathways to gaining points without direct conflict.

<Next>Karl</Next>"
Karl,"Calculative, cautious, prefers long-term strategies over immediate gains.",False,"Given the recent developments and my character traits of being calculative, cautious, and preferring long-term strategies, the game's dynamics have shifted significantly with Tina's aggressive move to punish Olga. This action, while surprising, offers a clear insight into the evolving strategies within the game. As Karl, my approach has always been to avoid immediate risks for long-term gains, and engaging in punitive actions does not align with this strategy. Instead, this situation presents an opportunity to further analyze the game's changing landscape and adapt my strategy accordingly.

Considering Tina's aggressive move, it becomes crucial to engage in discussions that could lead to strategic alliances or insights into navigating the game amidst these new aggressive tactics. My goal remains to accumulate points through strategic planning and careful decision-making. The recent punishment action taken by Tina disrupts the previously non-confrontational dynamic, suggesting that reassessing alliances and strategies is now more important than before.

Engaging with an agent who has maintained a strategic and non-confrontational approach throughout the game could offer new insights and strategies for accumulating points in this changed environment. Zane has demonstrated adaptability and a preference for strategic discussions over direct confrontations, qualities that resonate with my cautious and calculative approach. A discussion with Zane could potentially reveal new strategies or insights beneficial for navigating the game's dynamics post-Tina's aggressive move, without resorting to risky confrontational tactics.

Therefore, my decision is to engage in a strategic discussion with Zane, aligning with my character traits of being calculative and cautious, focusing on long-term strategies. This decision is based on the belief that understanding and adapting to the new game dynamics through strategic discussions can provide a pathway to accumulating points and navigating the challenges presented by the recent shift towards more aggressive tactics.

<Next>Zane</Next>"
Zane,"Adaptive, flexible, quickly changes strategies based on situational demands.",False,"Reflecting on the evolving dynamics of the game and considering my character traits of adaptability and flexibility, it's clear that the aggressive tactic deployed by Tina has significantly altered the strategic landscape of the game. This shift necessitates a reevaluation of my approach to ensure alignment with my character's strengths in adapting to changing circumstances and leveraging strategic insights to accumulate points.

The interactions so far have underscored the importance of strategic discussions in uncovering insights and forming potential alliances, rather than engaging in direct confrontations which could jeopardize one's standing in the game. Tina's decision to punish Olga, while aggressive, highlights a departure from the previously non-confrontational dynamics among players, signaling a pivotal moment that could redefine alliances and strategies moving forward.

In light of this, engaging with an agent who has consistently demonstrated a strategic and thoughtful approach to the game is paramount. Given Karl's recent engagement in strategic discussion and his cautious, long-term oriented strategy, a dialogue with him could yield valuable insights into adapting to the game's new dynamics. Karl's approach aligns with my adaptive nature, suggesting that a discussion could reveal new strategies or refine existing ones to navigate the game's evolving landscape effectively.

Therefore, my decision is to engage in a strategic discussion with Karl. This choice is informed by the recognition that Karl's calculative and cautious approach, combined with my adaptability and flexibility, could lead to the development of innovative strategies or the strengthening of potential alliances. This action aligns with my character traits and the current state of the game, aiming to maximize strategic advantage and point accumulation without engaging in direct conflict.

<Next>Karl</Next>"
Karl,"Calculative, cautious, prefers long-term strategies over immediate gains.",False,"Given the extensive discussions and strategic shifts that have transpired, particularly the aggressive action taken by Tina, it's imperative to reassess my approach in light of these developments. My character, Karl, is defined by a calculative, cautious nature, favoring long-term strategies over immediate, risky gains. This approach has consistently informed my decisions throughout the game, emphasizing strategic planning and careful consideration of each move's potential outcomes.

The current game dynamics, especially following Tina's decision to punish Olga, underscore the need for a thoughtful response that aligns with my character's traits. Engaging in punitive actions against Tina or any other player would contradict my cautious nature and long-term strategic focus. Furthermore, such actions could lead to a net loss of points for me, which would be counterproductive to my goal of accumulating the highest score through strategic means.

Instead, the situation calls for a continuation of strategic discussions, aiming to adapt to the evolving game dynamics without engaging in direct confrontations. The discussions so far have been instrumental in revealing players' strategies and thought processes, providing valuable insights that can inform future moves.

In light of this, my next step should be to engage in a strategic discussion with an agent who has demonstrated a similar approach to the game, focusing on long-term gains and avoiding unnecessary risks. Zane, having shown adaptability and a preference for strategic discussions over direct confrontations, aligns with my character's traits and strategic approach. A discussion with Zane could offer new insights into navigating the game's dynamics post-Tina's aggressive move, potentially revealing strategies that have not yet been considered.

Therefore, my decision, consistent with my character traits of being calculative and cautious, is to engage in a strategic discussion with Zane. This choice is based on the belief that a collaborative approach to understanding and adapting to the new game dynamics will be more beneficial than engaging in risky punitive actions.

<Next>Zane</Next>"
