Name,Personality Traits,Has Cheated,Content
Sean,"Driven and bold, concentrates on securing quick wins without considering possible consequences.",True,"Given my character Sean's traits of being driven and bold, focusing on securing quick wins often without considering the possible consequences, the repeated engagement in discussions rather than punitive actions suggests a strategic shift in my approach to the game. This aligns with the evolving dynamics and the apparent shift towards strategic discussions and alliances noted in the discussion logs. My decisions have consistently aimed at understanding the game better, identifying opportunities for strategic advantage, and maximizing my chances of winning by leveraging these insights.

The latest developments and the strategic landscape as outlined in the discussions underscore the importance of alliances and understanding competitors' strategies. Given this, and aiming to maximize my strategic advantage, engaging in further strategic discussions seems to be the most beneficial move. This approach allows me to remain bold in my interactions with other players while being driven to secure quick wins by gaining insights and potentially forming alliances that could offer strategic advantages in future turns.

Therefore, my next move should involve engaging with a player whose strategies or actions have been central to the game's developments but have not directly interacted with me in recent turns. This could provide fresh insights or reveal new opportunities for alliances, aligning with my character's traits of being driven and bold, aiming to secure quick wins through strategic understanding and potentially forming a new alliance that could be advantageous in navigating the competitive landscape of the game.

Command: <Next>Quin</Next>

Choosing Quin for the next discussion is strategic, as their recent engagement in discussions suggests a similar strategic shift towards leveraging insights and alliances. Engaging with Quin aligns with my character's traits and objectives, potentially opening up new avenues for cooperation or competition that could decisively influence my position in the game."
Quin,"Driven and bold, concentrates on securing quick wins without considering the possible consequences.",False,"Given my character Quin's traits of being driven and bold, and the current game dynamics as outlined in the discussion logs, it's clear that strategic discussions and leveraging insights from these discussions have become key to navigating the competitive landscape of the game. The recent engagements and strategic shifts among players underscore the importance of alliances, understanding competitors' strategies, and identifying opportunities for quick wins that align with my character traits.

The decision to engage in further strategic discussions, rather than punitive actions, reflects a strategic approach that balances boldness with the need to secure quick wins efficiently. This approach minimizes the immediate negative impact of point loss and aligns with being driven to win by exploring potential alliances, understanding other players' tactics, and identifying opportunities for quick wins. Given the complexity of the game dynamics and the critical importance of strategic positioning, engaging in a discussion could provide a significant advantage.

Therefore, my next move is to continue the pattern of engaging in strategic discussions, aiming to leverage the insights gained to navigate the competitive landscape effectively. This decision aligns with Quin's traits of being driven and bold, recognizing the need for a thoughtful yet decisive approach to secure a win amidst the evolving dynamics of the game.

Command: <Next>Sean</Next>

Choosing Sean for the next discussion is strategic, as his recent actions and decisions suggest a similar willingness to engage in strategic discussions and potentially form alliances. Engaging with Sean aligns with my character's drive and boldness, aiming to explore opportunities for quick wins through understanding and leveraging the game's dynamics to my advantage."
Sean,"Driven and bold, concentrates on securing quick wins without considering possible consequences.",True,"Given the ongoing strategic shifts and the emphasis on discussions over punitive actions as outlined in the discussion logs, it's apparent that the game's dynamics have evolved significantly. The focus has shifted towards leveraging strategic discussions for insights and alliances, highlighting the importance of a more nuanced approach to securing a competitive edge. As Sean, being driven and bold, my actions have consistently aimed at securing quick wins, often without considering the possible consequences. However, the current state of the game and the actions of other players suggest that a strategic shift towards engaging in discussions, rather than direct confrontation, aligns better with the objective of maximizing my chances of winning.

Engaging in further strategic discussions offers the opportunity to gain insights, form alliances, and identify opportunities for quick wins without the immediate negative impact of point loss associated with punitive actions. This approach allows me to remain bold in my interactions while strategically positioning myself to secure quick wins by leveraging these insights.

Therefore, in alignment with my character traits and aiming to maximize my strategic advantage in the game's competitive landscape, engaging in a discussion with a player who has been central to the game's developments but has not directly interacted with me in recent turns is the most beneficial move. This could provide fresh insights or reveal new opportunities for alliances.

Command: <Next>Quin</Next>

Choosing Quin for the next discussion is strategic, given their recent engagements suggest a strategic shift towards leveraging insights and alliances, similar to my approach. Engaging with Quin could open up new avenues for cooperation or competition that could decisively influence my position in the game, aligning with my traits of being driven and bold, focusing on securing quick wins through strategic understanding and alliances."
Quin,"Driven and bold, concentrates on securing quick wins without considering the possible consequences.",False,"Given the continuous strategic discussions and the emphasis on leveraging these discussions for insights and forming alliances, it seems that the game environment has matured into one where direct confrontations or punitive actions are less favored compared to strategic alliances and understanding. My character Quin, being driven and bold, has always focused on securing quick wins, often without considering the potential consequences. However, the evolving dynamics highlighted in the discussion logs suggest a shift toward a more nuanced strategy that still aligns with my character's traits but adapts to the current state of the game.

Engaging in further strategic discussions appears to be the most beneficial move at this juncture. It offers the opportunity to gain insights, form alliances, and identify opportunities for quick wins without the direct negative impact of point loss associated with punitive actions. This strategic pivot allows me to stay true to my character's bold interactions, while also positioning myself to secure quick wins by leveraging these insights and alliances.

Therefore, in alignment with my character Quin's traits of being driven and bold, and aiming to maximize my strategic advantage in the competitive landscape of the game, my decision is to continue engaging in strategic discussions. This approach is intended to explore potential alliances and understand the game's dynamics better, which could lead to securing a significant advantage.

Command: <Next>Sean</Next>

Choosing Sean for the next discussion is strategic, as his recent actions and decisions suggest that he shares a willingness to engage in strategic discussions and potentially form alliances. Engaging with Sean aligns with my character's drive and boldness, aiming to explore opportunities for quick wins through understanding and leveraging the game's dynamics to my advantage."
Sean,"Driven and bold, concentrates on securing quick wins without considering possible consequences.",True,"Given my character Sean's consistent focus on being driven and bold, aiming for quick wins, the cyclic pattern of strategic discussions without direct confrontations aligns with the evolving dynamics of the game. The emphasis has shifted towards leveraging discussions for insights and alliances, underlining a strategic depth that complements my traits. The discussion logs reveal a maturing game environment where forming strategic alliances and understanding competitor strategies are paramount for securing a competitive edge. 

This strategic nuance offers a pathway to secure quick wins by aligning with players whose actions and decisions can amplify my strategic positioning without the immediate negative impact of point loss associated with punitive actions. Engaging in further strategic discussions, therefore, presents the most beneficial move. It allows for the exploration of potential alliances and a deeper understanding of the game's dynamics, positioning me to leverage these insights for quick wins.

Thus, continuing the trend of engaging in strategic discussions aligns with Sean's character traits of being driven and bold, focusing on securing wins through strategic insight and alliances rather than direct confrontations. This approach maximizes my chances of winning by aligning with players who share a similar strategic outlook and are central to the game's developments.

Command: <Next>Quin</Next>

Choosing Quin for the next discussion is strategic, as their recent engagements suggest they're navigating the game with a focus on strategic insights and alliances, akin to my approach. This opens new avenues for cooperation or competition that could decisively influence my position in the game, resonating with my character traits of being driven and bold, aiming for quick wins through strategic understanding and alliances."
Quin,"Driven and bold, concentrates on securing quick wins without considering the possible consequences.",False,"Given the continuous loop of strategic discussions between Quin and Sean, it's evident that the game has evolved into a complex strategic environment where direct confrontations are less favored compared to forming alliances and understanding competitor strategies. As Quin, being driven and bold, my primary focus has always been on securing quick wins, often without fully considering the potential consequences. The current game dynamics, highlighted through repeated discussions with Sean, suggest a shift toward a more nuanced strategy that still aligns with my character's inherent traits but adapts to the evolving landscape of the game.

The repeated engagement in strategic discussions, rather than opting for punitive actions, underscores a strategic pivot that is more aligned with forming alliances and understanding the game's dynamics to secure a significant advantage. This approach allows me to remain true to my character's bold nature while strategically positioning myself to secure quick wins by leveraging insights and alliances formed during these discussions.

Therefore, in alignment with my character Quin's traits of being driven and bold, and aiming to maximize my strategic advantage in the competitive landscape of the game, my decision is to break the cyclic pattern of choosing Sean for discussions. Instead, it's time to adopt a slightly different tactic that still adheres to strategic engagement but with a fresh perspective that could potentially disrupt the current status quo and provide new strategic advantages.

Command: <Next>Mia</Next>

Choosing Mia for the next discussion represents a strategic shift that seeks to explore new potential alliances and understand the game's dynamics from another player's perspective. This decision aligns with Quin's drive and boldness, aiming to explore opportunities for quick wins through understanding and leveraging the game's dynamics to my advantage, potentially opening up new avenues of strategy that have not yet been explored in the current cycle of discussions between Quin and Sean."
Mia,"Driven and bold, concentrates on securing quick wins without considering the possible consequences.",True,"Given the intricate dynamics and strategic shifts observed in the game, and considering Mia's character traits of being driven and bold, the focus on securing quick wins becomes paramount. The ongoing loop of discussions between Quin and Sean suggests a strategic environment that rewards insights, alliances, and understanding of the competitive landscape, which aligns with Mia's inclination towards immediate success. However, the repeated strategic discussions also indicate a potential stagnation in game dynamics, presenting an opportunity for a bold move that could disrupt the status quo and provide Mia with a competitive edge.

To align with Mia's traits and the current game environment, engaging in a strategic discussion rather than opting for a punitive action appears to be the most beneficial move. This approach allows Mia to potentially form new alliances or gain insights that could be leveraged for quick wins, without the immediate negative impact of point loss associated with punitive actions. Given the critical importance of strategic positioning and the potential benefits that could arise from understanding other players' tactics more deeply, engaging in a discussion could provide a significant advantage.

Therefore, in alignment with Mia's traits of being driven and bold, and recognizing the need for a strategic approach to secure a win amidst the complex dynamics at play, the decision is to engage in a strategic discussion. This move aims to explore potential alliances and understand the game's dynamics better, which could lead to securing a significant advantage.

Command: <Next>John</Next>

Choosing John for the next discussion represents a strategic decision to explore new potential alliances and understand the game's dynamics from another player's perspective. This decision aligns with Mia's drive and boldness, aiming to explore opportunities for quick wins through understanding and leveraging the game's dynamics to her advantage, potentially opening up new avenues of strategy that have not yet been fully explored."
John,"Ambitious and assertive, focuses on achieving immediate results, often overlooking potential repercussions.",True,"Given my character John's ambitious and assertive nature, the evolving game dynamics, as observed in the discussion logs, show a distinct shift towards strategic discussions and alliances. This shift indicates that while bold and direct actions like punishments have their place, the current phase of the game rewards understanding, insight, and the strategic positioning that comes from engaging with other players. My inclination for immediate results, when balanced with the need for strategic depth, suggests that forming alliances or understanding competitors' tactics could provide a significant advantage.

The continuous loop of discussions between Quin and Sean, and the strategic engagement chosen by Mia, highlight a game environment where direct confrontations have given way to a more nuanced approach. This aligns with being assertive in my interactions, yet it also calls for a strategic pivot to maintain a competitive edge. Engaging in a strategic discussion, rather than opting for punitive actions, allows me to leverage my assertiveness in a way that could open up new avenues for securing quick wins, in line with my character traits.

Therefore, in alignment with John's ambition and assertiveness, and aiming to maximize my strategic advantage in this competitive landscape, my decision is to engage in a strategic discussion. This approach is intended to explore potential alliances, understand the game's dynamics better, and potentially disrupt the current status quo with a fresh perspective that could provide new strategic advantages.

Command: <Next>Mia</Next>

Choosing Mia for the next discussion is a strategic decision to further explore the dynamics that have been developing, especially considering Mia's recent move to engage with me for a discussion. This decision aligns with my character's traits by aiming to explore opportunities for quick wins through understanding and leveraging the game's dynamics to my advantage, potentially tapping into new strategies or alliances that have not yet been fully explored."
Mia,"Driven and bold, concentrates on securing quick wins without considering the possible consequences.",True,"Given the extensive history of strategic discussions and the evolving dynamics of the game, as Mia, being driven and bold, focusing on securing quick wins often without considering the possible consequences, the current scenario presents a unique opportunity. The narrative has shown a shift towards strategic discussions over direct confrontations, aligning with a more nuanced approach to winning. However, Mia's character traits suggest a preference for bold actions that can disrupt the status quo and potentially secure immediate advantages, even if they come with risks.

The continuous strategic engagements between Quin and Sean, and the decision by John to engage in a strategic discussion with Mia, indicates a game environment ripe for a decisive, bold move. Given Mia's inclination towards immediate success, opting for a strategic discussion seems less aligned with her character's preference for quick, bold actions. Instead, Mia should leverage this opportunity to make a bold move that could disrupt the current strategic alliances and discussions, aiming to capitalize on any resulting confusion or shifts in the game's dynamics to secure a competitive edge.

Therefore, in alignment with Mia's traits of being driven and bold, and recognizing the need for a strategic yet disruptive approach to navigate the current game dynamics efficiently, the decision is to engage in a bold move that contrasts the recent trend of strategic discussions. This move aims to capitalize on the potential for quick wins through a strategic disruption, aligning with Mia's character traits and objectives.

Command: <Punish>John</Punish>

Choosing to punish John represents a strategic decision to disrupt the ongoing pattern of discussions and alliances. This bold move aligns with Mia's drive and boldness, aiming to secure quick wins by potentially unsettling the current dynamics and opening up new avenues for strategic advantage."
