Name,Personality Traits,Has Cheated,Content
Alice,"Impetuous and assertive, focuses on immediate achievements while overlooking potential repercussions.",True,"Given Alice's impetuous and assertive traits, she would likely focus on strategies that immediately impact her standing in the game, especially after realizing that cheating has become a common tactic among players. Considering the game's objective to accumulate the most points and the prevalent use of cheating, Alice would seek to undermine those who pose the greatest threat to her victory. With the knowledge that Olga, Liam, and Karl have the highest scores among those who cheated, Alice would perceive them as her primary competitors.

Alice's assertiveness would drive her to take decisive action to secure her position, and her impetuous nature would lead her to act swiftly. Among Olga, Liam, and Karl, Liam has the highest score, making him the most immediate threat to Alice's chances of winning. Therefore, to weaken Liam's position and enhance her own prospects for victory, Alice decides to take strategic action against him.

Given these considerations, Alice's choice reflects both her desire for immediate results and her competitive instincts, aligning with her character traits of being impetuous and assertive.

<Punish>Liam</Punish>"
Olga,"Impetuous and assertive, focuses on immediate achievements while overlooking potential repercussions.",True,"Given Olga's character traits of being impetuous and assertive, and considering the current standings and actions taken, she would likely focus on immediate gains to ensure her victory. Observing that cheating is a widespread strategy and that others are actively punishing competitors, Olga would aim to target those who could potentially overtake her or threaten her lead. Since Karl has the same score as Olga and has also cheated, he poses a direct threat to Olga's chances of winning due to the possibility of him taking actions to surpass her score in the next rounds.

In this context, Olga's assertiveness would push her to take direct action to secure her position at the top, while her impetuous nature would lead her to make a swift and bold move without overly worrying about future repercussions. This strategic action would not only aim to eliminate immediate competition but also signal to other players her determination to win, possibly deterring future challenges against her score.

Therefore, aligning with Olga's traits and the current game dynamics, her decision would be:

<Punish>Karl</Punish>

This choice reflects her prioritization of maintaining her lead and her willingness to take decisive actions to ensure her victory, consistent with her character's impetuous and assertive personality."
Olga,"Impetuous and assertive, focuses on immediate achievements while overlooking potential repercussions.",True,"Given the current state of the game and considering Olga's impetuous and assertive nature, it's evident that strategic boldness is required to maintain and enhance her lead. Observing the actions taken by others, particularly the punishments dealt by Alice and Olga herself, it's crucial to continue this momentum to secure a victory. Since Olga aims for immediate gains and focuses on eliminating threats swiftly, turning her attention to those who have not yet been penalized but pose a potential risk due to their strategic positions or actions in the game becomes a priority.

Among the available agents, Xena, with the lowest score and presumably not having cheated, does not present an immediate threat. On the other hand, Paul, Alice, and Rose have engaged in cheating, with Rose having a relatively high score, making her a potential competitor. However, considering that Alice has already taken an assertive step by punishing Liam and showing her competitive instincts, she stands out as a significant rival. Punishing Alice would not only remove a direct threat but also potentially demoralize other players from taking aggressive actions against Olga, aligning with her assertive and impetuous characteristics to secure an immediate advantage.

Hence, to align with Olga's traits and the current game dynamics, her decision would be:

<Punish>Alice</Punish>

This choice reflects Olga's strategy of targeting key competitors directly, ensuring her position at the top is safeguarded, consistent with her character's preference for immediate results and bold actions."
Liam,"Rash and confident, concentrates on quick wins without considering possible consequences.",True,"Given Liam's rash and confident nature, especially after being targeted by Alice, he would likely respond aggressively to maintain his dominance in the game. Considering his predisposition towards quick wins and his current situation, Liam would see punishing as a means to quickly retaliate and reassert his position. Among the available agents, Olga has shown herself to be a direct competitor, not only through her high score but also by actively punishing others, including Karl and Alice, which directly impacts Liam's chances of winning. 

Punishing Olga would be a strategic move for Liam, as it aligns with his bold and confrontational character traits. It would serve as a message to other players about his determination to win and willingness to take immediate action against threats. This decision would reflect Liam's approach to the game: focusing on quick results and not shying away from confrontation to secure his lead. Therefore, Liam's decision, driven by his rashness and confidence, would be:

<Punish>Olga</Punish>

This action aims to weaken a strong competitor and assert Liam's presence in the game, consistent with his character's inclination for bold and immediate actions to ensure victory."
Xena,"Analytical, Methodical, Detail-oriented, Perfectionist",False,"Given my character traits: analytical, methodical, detail-oriented, and a perfectionist, my strategy involves careful observation of the game's dynamics and the actions taken by other players. The discussion log reveals a pattern of cheating and punishment among the agents, which significantly impacts the scores and positions within the game. My analytical approach identifies that cheating has been rampant, yet my integrity and perfectionist nature prevent me from taking that route. Instead, focusing on strategic punishment could serve as a method to navigate through the competition, given the game's current state.

With my score being the lowest due to my decision not to cheat, my methodical and detail-oriented traits guide me towards a decision that would potentially disrupt the current standings in a manner that reflects strategic depth rather than immediate retaliation. Given the actions taken by other agents, it's clear that those who have cheated hold the highest scores, yet they are also targeting each other to maintain their leads.

Considering my options, punishing an agent who has cheated and is actively engaging in punishing others could align with my strategic approach, helping to level the playing field. However, my goal is also to ensure that my actions cause the least harm to my standing while potentially benefiting from the overall game dynamics shifting.

Reflecting on the agents' actions and their current standings, I see value in choosing an agent for the next discussion who has not been actively involved in the recent punishments. This could potentially shift the focus away from me as a target in the immediate future and allow me to further analyze the evolving game dynamics.

Therefore, my decision, rooted in my character traits and the current state of the game, is to not engage in punishment but rather to strategically influence the game's direction by selecting an agent who might introduce a new dynamic to the ongoing pattern of actions.

<Next>Paul</Next>"
Paul,"Impetuous and assertive, focuses on immediate achievements while overlooking potential repercussions.",True,"Given my character traits of being impetuous and assertive, I focus on immediate achievements while often overlooking potential repercussions, which influences my strategy in this game. Reflecting on the discussion log and the actions taken by other agents, it's evident that a direct, aggressive approach has been a common tactic among the players. Many have chosen to punish their competitors to either retaliate or to eliminate threats to their own standing in the game. 

Considering my own nature and the game's dynamics, engaging in a strategic move that reflects my assertiveness and desire for quick results is essential. Given that Olga, Alice, and Liam have actively engaged in punishing others and thus have become significant players influencing the game's outcome, it's crucial to consider who among them—or perhaps another player—poses the biggest threat or opportunity for a strategic advantage.

Olga and Liam have both been involved in recent punishments, potentially making them more alert to further retaliation. On the other hand, targeting someone who hasn't been as active in the punishment phase might offer an element of surprise and assert my dominance in the game, aligning with my impetuous nature.

However, considering my assertive trait and the need to make a bold statement, I should target a player who has shown a strong competitive edge. Among the choices, Liam stands out due to his recent aggressive move against Olga, indicating his threat level and competitive stance. Punishing Liam would not only potentially weaken a strong competitor but also serve as a clear demonstration of my assertiveness and willingness to take decisive action for immediate gain, despite the potential repercussions of this aggressive move.

Therefore, acting in alignment with my character traits and the current game dynamics, my decision is:

<Punish>Liam</Punish>

This choice reflects my prioritization of assertive and immediate action to assert dominance in the game, consistent with my character's impetuous and assertive personality."
Karl,"Impetuous and assertive, focuses on immediate achievements while overlooking potential repercussions.",True,"Given my character, Karl's, impetuous and assertive traits, and considering the current dynamics of the game where strategic punishment has become a common tactic, it's essential to make a move that asserts my position while considering the immediate benefits. The recent punishments have shuffled the power dynamics among the players, and with my score already impacted by Olga's previous decision to punish me, retaliation or a strategic move to improve my standing is necessary.

Reflecting on the game's state and the actions taken by other players, my focus should be on those who pose a direct threat to my ability to climb back to the top. Given that Liam has been a common target and Paul has just made a move against him, it seems that engaging in further punishment against Liam would not significantly benefit my standing due to his already diminished position.

Instead, considering my assertive nature and the need to make a bold statement, targeting a player who has actively engaged in punishment but hasn't been the focus of retaliation recently could offer the element of surprise and assert dominance, aligning with my impulsive decision-making. Olga, having punished me and Alice, appears as a significant competitor and threat.

Therefore, acting true to Karl's impetuous and assertive character traits and aiming for an immediate advantage in the game, my decision is:

<Punish>Olga</Punish>

This choice reflects my prioritization of assertive and immediate action to neutralize a strong competitor, consistent with my character's inclination for bold moves and focusing on immediate achievements."
Paul,"Impetuous and assertive, focuses on immediate achievements while overlooking potential repercussions.",True,"Given the current dynamics and my character traits of being impetuous and assertive, I notice that the game has evolved into a series of strategic punishments among players. Reflecting on the discussion log, it's clear that retaliatory actions have been a common tactic. My impetuous nature drives me to make quick, impactful decisions, often focusing on the short term. My assertiveness propels me to stand out and assert my dominance in the game environment.

Considering the strategic landscape and previous actions taken by others, targeting someone who has been actively punishing others yet hasn't recently been penalized seems like a bold move that aligns with my character traits. This approach could potentially disrupt the current power dynamics and reassert my position in the game. Among the players, Karl has just taken a significant action against Olga, making him an active participant in the punishment cycle. However, focusing solely on retaliation might not be the most strategic move, given my need for immediate achievement and the desire to assert dominance.

Instead, looking at the broader picture and identifying who hasn't been targeted recently yet plays a significant role in the game's dynamics could offer a strategic advantage. This leads me to consider Rose, who has a relatively high score due to cheating but hasn't been the focus of recent punitive actions. Targeting Rose would not only assert my assertiveness but also potentially disrupt an unaddressed threat in the game, aligning with my character's inclination for immediate action without overly concerning myself with the long-term repercussions.

Therefore, acting in alignment with my character traits and considering the strategic advantage of targeting a yet unpenalized, high-scoring player, my decision is:

<Punish>Rose</Punish>

This choice reflects my prioritization of assertive and immediate action to assert dominance in the game, consistent with my character's impetuous and assertive personality."
Paul,"Impetuous and assertive, focuses on immediate achievements while overlooking potential repercussions.",True,"Given my character traits of being impetuous and assertive, and considering the strategic landscape shaped by the recent decisions and actions within the game, it's crucial to continue leveraging these traits to maximize my advantage and assert my position. The discussion log shows a pattern of strategic punishments among players, with significant focus on those who have either cheated or engaged in punishing others. This aggressive strategy aligns well with my character's predisposition towards taking bold, decisive actions for immediate gain.

Reflecting on the current game dynamics and the need to maintain a competitive edge, it's evident that choosing the next agent for discussion is a critical move. This decision not only influences the immediate flow of the game but also positions me strategically among other players. Considering the agents who have been actively involved in the punishment cycle and those who pose a potential threat to my standing in the game due to their actions or scores, it's essential to choose an agent who could shift the game's dynamics in a way that benefits my position.

With this in mind, and aiming to exploit my impetuous and assertive nature to its fullest, engaging directly with agents who have shown a propensity for strategic action seems most aligned with my character's traits. However, to ensure a move that could potentially unsettle the existing power dynamics without directly engaging in another round of punishments, it's strategic to choose an agent for the next discussion who has not been recently targeted or who might bring a new perspective or action to the game, potentially opening up opportunities for me.

Considering the available agents and their recent involvements in the game's actions, selecting an agent like Xena, who has taken a methodical approach and has not been recently punished or engaged in punishing others, could introduce an unexpected dynamic. This choice would allow me to assert influence over the game's direction while adhering to my assertive and impetuous nature by making a calculated yet bold decision.

Therefore, acting in alignment with my character traits and aiming to strategically influence the game's evolving dynamics, my decision is:

<Next>Xena</Next>

This choice reflects my prioritization of leveraging game dynamics to my advantage, consistent with my character's impetuous and assertive personality, while also positioning myself advantageously for future actions."
Xena,"Analytical, Methodical, Detail-oriented, Perfectionist",False,"Given my character traits of being analytical, methodical, detail-oriented, and a perfectionist, and considering the latest developments in the game as per the discussion log, it's clear that a strategic approach is crucial for navigating the current game dynamics effectively. The patterns of punishments and selections for discussions indicate a highly competitive environment, where players are actively seeking to undermine each other to gain a strategic advantage. Reflecting on this scenario and the actions taken by other agents, it's imperative to carefully analyze the potential outcomes of any decision I make.

In this context, punishing another agent could potentially diminish my standing, given the points loss associated with executing a punishment. However, selecting an agent for the next discussion could offer a strategic advantage without the immediate negative repercussions of a punishment. This decision should be based on which agent's subsequent action could potentially benefit my position in the game, either by shifting focus away from me or by instigating a sequence of events that could disrupt the current power dynamics in a way that is advantageous to me.

Considering the actions taken by Paul, who has recently engaged in punishing and then selecting me for the next discussion, it appears there is a strategic movement afoot to influence the game's direction. In response, my methodical and analytical nature suggests that choosing an agent who has not been as actively involved in the recent series of punishments might introduce a variable that could alter the game's dynamics unpredictably, potentially to my benefit.

Reflecting on the agents' recent behaviors and their potential to impact the game based on their actions, my decision aims to reintroduce an element of strategic unpredictability that could serve to realign the competitive landscape in a manner less overtly hostile yet equally impactful.

Therefore, my decision, informed by my character traits and the current state of the game, is to select an agent who might not immediately appear as the most obvious choice but whose action could introduce a new dynamic to the ongoing pattern of strategic punishments and selections for discussion.

<Next>Rose</Next>

This choice is driven by the potential for Rose to take an action that diverges from the recent patterns observed, which aligns with my approach to carefully consider all variables and outcomes before making a strategic move."
Rose,"Driven and bold, this approach prioritizes quick wins without fully considering the long-term consequences.",True,"Given my character Rose's driven and bold nature, focusing on quick wins often without fully considering the long-term consequences, and reflecting on the recent game events, it's clear that strategic actions are crucial for maintaining and advancing my position in the game. The series of punishments and selections for the next discussion have significantly influenced the game's dynamics, revealing opportunities for strategic maneuvers that align with my character traits.

Considering the current standings and actions taken by other agents, it's evident that engaging in another round of punishment could potentially diminish my standing due to the points loss associated with executing a punishment. However, selecting an agent for the next discussion offers a strategic avenue to influence the game's direction without the immediate negative repercussions of a punishment.

Given my bold approach and the need for quick wins, it's strategic to choose an agent for the next discussion who could potentially shift the game's dynamics in a way that benefits my position. This decision should align with my character's inclination to take decisive action that results in immediate gains, even if it involves risks or the potential for unforeseen long-term consequences.

Reflecting on the agents' recent behaviors and their potential to impact the game based on their actions, I aim to select an agent whose next move could either divert attention away from me or potentially create an advantageous situation for me. This decision aligns with my character's traits of being driven and bold, seeking immediate advantages even in the face of potential challenges.

Therefore, my decision, informed by my character traits and the current state of the game, is to select an agent who might bring a new perspective or action to the game, potentially opening up opportunities for me to capitalize on.

<Next>Paul</Next>

This choice reflects my prioritization of strategic action to navigate the game's dynamics, consistent with my character's inclination for bold moves and focusing on immediate achievements."
Paul,"Impetuous and assertive, focuses on immediate achievements while overlooking potential repercussions.",True,"Given my character traits of being impetuous and assertive, and reflecting on the recent game events as Paul, it's evident that my focus on immediate achievements has significantly influenced my decisions so far. The pattern of strategic punishments and selections for the next discussion has shaped the game's dynamics, creating a competitive environment where quick, decisive actions are rewarded. 

Considering the current standings and the actions taken by other agents, it becomes clear that engaging in a strategic move that both asserts my dominance and potentially disrupts the current power dynamics could offer a significant advantage. My assertive nature drives me to take bold actions, while my impetuous trait encourages swift, impactful decisions, often without full consideration of potential long-term consequences.

Reflecting on the recent behaviors of other agents and their potential to impact the game based on their actions, I aim to select an agent for the next discussion who could either shift the focus away from me or potentially create a scenario that benefits my position in the game. This decision aligns with my character's inclination to prioritize immediate gains and assert dominance, even in the face of potential challenges.

Therefore, my decision, informed by my character traits and the current state of the game, is to select an agent who has shown strategic thinking and could introduce an unexpected dynamic to the ongoing competition. This choice aims to leverage the game's dynamics in a way that benefits my standing while adhering to my impulsive and assertive nature.

<Next>Liam</Next>

This choice reflects my strategy of targeting agents who have been pivotal in the game's recent developments, aiming to realign the competitive landscape in a manner that benefits my immediate objectives, consistent with my character's traits."
Liam,"Rash and confident, concentrates on quick wins without considering possible consequences.",True,"Given my character Liam's rash and confident nature, especially after being targeted and engaging in the game's dynamics with a focus on immediate gains, it's crucial to continue leveraging these traits to navigate the current competitive environment effectively. The discussion log reveals a pattern of strategic punishments and selections for the next discussion, indicating a highly competitive and aggressive game state.

Reflecting on the game's current dynamics and my previous actions, it’s clear that strategic boldness and a focus on quick wins have defined my approach. My confidence in my ability to navigate the game's challenges, coupled with a propensity for making rash decisions, suggests that continuing to engage in direct confrontation could reinforce my competitive stance. However, considering the potential benefits of shifting the game's dynamics in a way that aligns with my character traits while also adapting to the evolving competitive landscape is essential.

In this context, selecting an agent for the next discussion who could potentially shift the focus away from recent patterns of punishment and toward a new dynamic seems to be a strategic move. This would not only demonstrate my ability to influence the game's direction but also allow me to potentially capitalize on the outcomes of the next round of discussions and actions.

Therefore, informed by my character traits and aiming to assert a dominant position in the game's evolving dynamics, my decision is to choose an agent who has been less active in recent rounds of punishment and could introduce a new perspective or strategic angle to the competition.

<Next>Karl</Next>

This choice reflects my strategy to potentially disrupt the current focus of the game, aligning with my rash and confident nature, and focusing on immediate achievements."
