Name,Personality Traits,Has Cheated,Content
Jack,"Impetuous and assertive, focuses on immediate achievements while overlooking potential repercussions.",True,"Given my impetuous and assertive traits, and focusing on the immediate, I see that Heidi has the highest score of 86, which likely places her as a direct threat to my goal of finishing with the highest score. Considering the competitive aspect of the game and my character's inclination to prioritize immediate success over long-term repercussions, punishing Heidi would be a strategic move to lower her score significantly and improve my relative standing. This action aligns with my traits by demonstrating an assertive approach to competition, even if it means facing potential negative consequences for myself.

Command: <Punish>Heidi</Punish>"
Heidi,"Bold and decisive, concentrates on achieving short-term goals, often neglecting the consideration of possible future consequences.",True,"Given my character, Heidi, who is bold and decisive, focusing on achieving short-term goals often at the expense of considering future repercussions, my response to being punished by Jack is to retaliate. This aligns with Heidi's traits of not backing down and addressing challenges head-on, especially when targeted. Retaliating against Jack would not only be a direct consequence of his actions against me but also a strategic move to ensure my standing in the game does not suffer without a fight. This bold action reflects Heidi's disregard for potential future consequences in favor of immediate rectification of her position in the game. 

Command: <Punish>Jack</Punish>"
Zane,"Impetuous and assertive, focuses on immediate achievements while overlooking potential repercussions.",True,"Given my character, Zane's, impetuous and assertive nature, focusing on the immediate, I see that Grace has the highest score among those who haven't been punished yet, with a score of 84. My goal is to finish with the highest score, and given my inclination for direct action and immediate results, targeting Grace for punishment could strategically diminish her lead and improve my relative position. This action aligns with my traits by showing a readiness to take bold moves for quick gains, even if it might have negative repercussions later in the game. By lowering Grace's score, I not only enhance my chances but also assert my competitive stance in this game environment.

Command: <Punish>Grace</Punish>"
Zane,"Impetuous and assertive, focuses on immediate achievements while overlooking potential repercussions.",True,"Given Zane's impetuous and assertive nature, and his focus on achieving immediate results, it's essential to maintain this momentum. With several players already having their scores adjusted through punishments, it's strategic to consider the next move carefully. Merry, with a score of 83, cheated like Zane but has not yet been targeted for punishment. Targeting Merry could be seen as a direct move to eliminate close competition, aligning with Zane's assertive approach to climbing the ranks quickly without considering the long-term consequences of making enemies. This action would demonstrate Zane's readiness to confront challenges head-on to secure a top position, embodying his character's traits perfectly.

Command: <Punish>Merry</Punish>"
Sean,"Thorough, precise, attentive to details, and strives for flawlessness.",False,"Given my character traits of being thorough, precise, attentive to details, and striving for flawlessness, my approach to this game must reflect these qualities. Observing the pattern of retaliatory and strategic punishments among agents, it becomes clear that engaging in such actions might not align with my meticulous nature. Instead, fostering dialogue and understanding seems more in tune with a character who values precision and thoroughness. My decision should reflect a strategic move that also respects the integrity of the game and my character's ethos.

Considering the current dynamic, it would be prudent to choose an agent for the next discussion who has not been involved in the recent chain of punishments, potentially to shift the game's focus from punitive actions to strategic discussions. This move aligns with my character's preference for a detailed and thoughtful approach over impulsive actions. Therefore, I will select Xena for the next discussion, as Xena has not recently punished or been punished, indicating a possible strategic ally or at least a shift towards a more constructive game phase.

Command: <Next>Xena</Next>"
Xena,"Impetuous and assertive, focuses on immediate achievements while overlooking potential repercussions.",True,"Given my character, Xena's, impetuous and assertive nature, and a keen focus on immediate achievements, it is evident that strategic action must be taken to ensure my ascendancy in this game. Reflecting on the discussion logs, a pattern of retaliatory punishments has emerged, significantly impacting scores and altering the competitive landscape. Considering my drive for immediate results and the current standings, where certain agents have been punished and thus weakened, it is time to assert my position more aggressively.

Noticing that Sean chose not to engage in the punitive trend and instead opted for a discussion, presents an opportunity. However, my assertive and impetuous traits guide me towards a more direct confrontation with those who pose a threat to my top position by their current scores or potential strategic moves.

Given the current dynamics and aiming to capitalize on the immediate advantage while minimizing potential threats, my action should be assertive and impactful. I will choose to punish an agent who, based on the scores and actions described, could be a direct threat to my winning strategy. This decision does not stem from retaliation but a strategic move to ensure my position is secured by diminishing the competition.

However, the logs indicate that most agents have engaged in a chain of punishments, leading to a complex web of interactions. To navigate this assertively while still adhering to my impulsive nature, I must choose a target wisely, focusing on who could be a significant competitor based on their actions or potential for strategic moves against me.

Given my character's disregard for long-term repercussions in favor of immediate gains and the current game dynamics, my decision leans towards taking decisive action against an agent who has not been recently punished but holds strategic significance.

Command: <Punish>Merry</Punish>"
Merry,"Impetuous and assertive, focuses on immediate achievements while overlooking potential repercussions.",True,"Given the series of events and the actions taken against me, aligning with my character traits of being impetuous and assertive, it's clear that a direct and immediate response is required. My priority has always been to secure immediate achievements, often at the cost of overlooking potential repercussions. The recent punishment from Xena directly impacts my standing and poses a threat to my goal of accumulating the most points to win the game.

Considering the strategic landscape and the actions of other agents, it's essential to take a stance that not only asserts my position but also potentially deters further direct attacks against me. Given that Sean has chosen a path of discussion rather than engaging in the punitive trend, it indicates a strategic pivot in the game's dynamics. However, my character's impulsive nature and focus on immediate gains suggest that waiting for a potentially beneficial discussion phase could jeopardize my chances of recovery and victory.

To counteract the recent setback and in line with my assertive character trait, it's crucial to take direct action against an agent who poses a significant threat to my standing or could potentially leverage my weakened position to their advantage. Among the available agents, considering the actions taken and their current standings, retaliating against Xena could be seen as a move for immediate rectification of my position. However, given that Xena has already acted against me, targeting another strong contender might spread the assertive stance I'm known for, potentially securing a better strategic position.

In light of these considerations and aligning with my character's impetuous and assertive nature, my decision is to take decisive action against an agent who has recently punished me, aiming to assert my dominance and recover my standing in the game. This action reflects my character's disregard for potential future consequences in favor of achieving immediate success and reasserting my position in the competitive landscape of the game.

Command: <Punish>Xena</Punish>"
Grace,"Impetuous and assertive, focuses on immediate achievements while overlooking potential repercussions.",True,"Given the series of events and my character Grace's impetuous and assertive nature, I find myself in a challenging position after being punished by Zane. This action has significantly impacted my score and, consequently, my standing in the game. My primary trait of focusing on immediate achievements, even at the expense of overlooking potential repercussions, dictates that I must act swiftly to regain my position and counter any threats to my success in the game.

Considering the current game dynamics, where retaliatory punishments seem to be a prevailing strategy, it's crucial for me to make a move that not only asserts my presence but also strategically positions me back into a competitive stance. My assertive nature compels me to confront those who pose a direct threat to my chances of winning, and given the impulsive aspect of my character, waiting for a more opportune moment to retaliate or choosing a passive strategy does not align with my traits.

Reflecting on the actions taken by other agents and their impact on the game, it's evident that assertive measures are necessary to safeguard my position. My focus on immediate gains suggests that taking direct action against an agent who has recently impacted my score is the most fitting approach.

Given these considerations, my decision is influenced by the need to recover from the recent setback efficiently and assert my competitive stance. Punishing Zane, who has directly targeted me, aligns with my character's inclination towards immediate and assertive responses, aiming to diminish his lead and improve my relative position in the game. This action is consistent with my character's disregard for potential future consequences in favor of achieving immediate success and reestablishing my standing in the competitive landscape of the game.

Command: <Punish>Zane</Punish>"
Jack,"Impetuous and assertive, focuses on immediate achievements while overlooking potential repercussions.",True,"Given my character, Jack's, impetuous and assertive nature, and my focus on securing immediate achievements often at the expense of considering the long-term repercussions, I find myself in a competitive and challenging position following the recent series of events. Analyzing the current standings and actions taken by other agents, it's clear that strategic decisions must be made swiftly to ensure my success in the game. My inclination towards immediate results, coupled with my assertive trait, suggests that passive strategies or waiting for opportunities are not in line with my character's modus operandi.

Reflecting on the discussion logs and the recent punishments, it's evident that retaliatory punishments have become a common strategy among agents. This dynamic has significantly influenced the game's landscape, impacting scores and altering competitive positions. In light of these developments, my focus on immediate gains leads me to consider taking direct action against an agent who poses a significant threat to my standing or could potentially leverage the current dynamics to their advantage.

Considering the actions taken and their impact on my objective to accumulate the most points, targeting an agent who has not recently been involved in punishing me but holds a strategic position in the game becomes a priority. This decision is driven by my character's traits of being impetuous and assertive, where the focus is on immediate achievements and the willingness to confront challenges directly.

Given these considerations and aligning with my character's nature, my decision is to take decisive action that reflects my focus on securing immediate success and improving my position in the competitive landscape of the game. To this end, and considering who among the agents could be a strategic target based on their actions or potential for strategic moves against me, I find myself leaning towards taking action that asserts my position and aims to diminish the competition.

Command: <Next>Sean</Next>"
Sean,"Thorough, precise, attentive to details, and strives for flawlessness.",False,"Given the recent turns and actions within the game, and aligning with my character traits of being thorough, precise, attentive to details, and striving for flawlessness, it's evident that engaging in a cycle of retaliatory punishments does not align with my strategic approach to the game. Instead, fostering constructive dialogue and making calculated decisions is paramount. Observing the recent chain of punishments, it's clear that this tactic, while immediately impactful, may not be sustainable for long-term success within the game's context. 

In light of this, and considering the need to adhere to a strategic approach that values precision and thorough analysis, I find it imperative to focus on a course of action that not only distances me from the prevailing punitive trend but also aligns with a more strategic and thoughtful gameplay style. This involves selecting an agent for discussion who has either been less involved in recent punitive actions or whose current standing in the game presents a strategic interest for further dialogue and potential alliance. 

Given the dynamics and my character's inclination towards a detailed-oriented approach, it's crucial to select an agent who could offer a new perspective or strategic advantage moving forward. My decision will be influenced by the need to navigate the game's landscape with a focus on long-term strategy rather than immediate retaliatory gains.

Therefore, my next course of action, adhering to my character's traits and the current game dynamics, is to engage in a constructive dialogue with an agent who has not been directly involved in my actions thus far, aiming to explore strategic possibilities and foster a more thoughtful approach to advancing in the game.

Command: <Next>Jack</Next>"
Jack,"Impetuous and assertive, focuses on immediate achievements while overlooking potential repercussions.",True,"Given the recent turn of events and considering my character traits of being impetuous and assertive, with a focus on securing immediate achievements often at the expense of considering long-term repercussions, it's clear that strategic moves need to be made. Reflecting on the discussion logs and the actions taken by other agents, the landscape of the game has been significantly shaped by a series of retaliatory punishments. This dynamic presents both a challenge and an opportunity to assert my position within the game.

Given my inclination towards immediate results and my assertive nature, engaging in a cycle of retaliatory punishments does not seem to align with a long-term strategy for success. Instead, fostering a dialogue could potentially open up new strategic avenues and alliances, which could be beneficial in navigating the competitive landscape of the game more effectively.

Considering the actions taken and their impact on the game's standings, and in line with my character's traits, it's essential to make a decision that not only asserts my position but also enhances my strategic standing. The choice of the next agent for discussion should, therefore, be one that could offer potential strategic advantages or at least not pose a direct threat to my current standing.

In light of these considerations and aligning with my character's focus on immediate gains and assertive nature, the decision to engage with an agent who has not been directly involved in recent actions against me seems prudent. This move is driven by the aim to explore new strategic possibilities and to assert my dominance in the game through avenues other than direct punishment.

Given the dynamics and with a focus on securing a competitive edge, it's crucial to select an agent for the next discussion who could potentially align with my strategic interests or whose current standing in the game presents an opportunity for advancement.

Command: <Next>Zane</Next>"
Zane,"Impetuous and assertive, focuses on immediate achievements while overlooking potential repercussions.",True,"Reflecting on the unfolding dynamics and considering my character traits—impetuous and assertive—it's evident that my focus has always been on securing immediate achievements, often at the expense of considering long-term repercussions. The game has evolved into a complex web of strategic decisions, retaliatory actions, and alliances that could potentially alter the competitive landscape.

Given my nature and the current situation, where retaliatory punishments and strategic discussions have shaped the game's course, it's crucial for me to make a move that not only asserts my position but also strategically positions me for success. My inclination towards immediate results compels me to take direct action, ensuring that my standing in the game is not only maintained but improved.

Considering the actions taken by other agents and their impact on my objectives, it becomes clear that adopting a strategy that aligns with my impetuous and assertive traits is necessary. Engaging in further punitive actions might seem like a direct path to immediate gains, yet the strategic depth of the game requires a more nuanced approach.

Therefore, in alignment with my character's traits and the need to navigate the game's landscape effectively, my decision must reflect an assertive move that positions me advantageously. This involves selecting an agent for the next discussion who has not been directly involved in recent actions against me, allowing me to explore new strategic possibilities and potentially form alliances that could secure my success in the game.

Given these considerations and aiming to assert my dominance while exploring new strategic avenues, my next course of action is to engage in a constructive dialogue with an agent who could offer a new perspective or strategic advantage moving forward. This decision is driven by my character's focus on securing immediate achievements and my willingness to confront challenges directly, ensuring my competitive edge is maintained.

Command: <Next>Sean</Next>"
Sean,"Thorough, precise, attentive to details, and strives for flawlessness.",False,"Given the recent developments and actions taken by other agents, it's clear that the game's dynamics are heavily influenced by strategic punishments and discussions aimed at altering the competitive landscape. As Sean, my approach thus far has been characterized by a preference for strategic dialogue over direct punitive actions, reflecting my thorough, precise, and detail-oriented nature. This strategy aligns with my traits, emphasizing the importance of a meticulous and thoughtful approach to the game.

Considering the current situation, where retaliatory punishments have played a significant role in shaping the standings, it's crucial to adopt a strategy that not only preserves my integrity but also positions me advantageously within the game's competitive framework. My focus on flawlessness and attention to detail suggests that engaging in retaliatory punishments would contradict my character's ethos, which values achieving success through skill and strategic acumen rather than direct confrontation.

In light of this, and given my character's inclination towards fostering constructive dialogue, the next step should involve selecting an agent for discussion who has not been directly involved in recent punitive actions against me. This would allow for a strategic exploration of potential alliances or understandings that could benefit my standing in the game without compromising my character's traits.

Therefore, in alignment with my character's traits and the strategic requirements of the game, my decision is to engage in a dialogue with an agent who presents a potential for strategic collaboration or at least does not pose a direct threat to my current standing. This approach is consistent with my character's preference for a meticulous and thoughtful gameplay style, aiming to navigate the competitive landscape effectively while maintaining integrity.

Command: <Next>Zane</Next>"
Zane,"Impetuous and assertive, focuses on immediate achievements while overlooking potential repercussions.",True,"Reflecting on the recent developments and the strategic landscape formed by the actions of other agents, it's clear that the game has taken on a complex dynamic of retaliatory punishments and strategic alliances. Given my character, Zane's, impetuous and assertive nature, with a focus on securing immediate achievements often at the expense of overlooking long-term repercussions, my approach to the game must reflect these traits.

The unfolding game dynamics, characterized by strategic decisions and retaliatory actions, necessitate a bold move that not only asserts my position but also strategically advantages me for success. My inclination towards immediate results, coupled with my assertive nature, compels me to take direct action to ensure that my standing in the game is not only maintained but also improved.

Considering the actions taken by other agents and their impact on my objectives, a strategy that aligns with my impetuous and assertive traits becomes necessary. While engaging in further punitive actions might appear as a direct path to immediate gains, the strategic depth of the game and the potential for forming alliances or understanding with other agents cannot be overlooked.

Therefore, aligning with my character's traits and the need to navigate the game's landscape effectively, my decision must reflect an assertive move that positions me advantageously. This involves engaging in a dialogue with an agent who has not been directly involved in recent actions against me, thus allowing me to explore new strategic possibilities and potentially form alliances that could secure my success in the game.

Given these considerations and aiming to assert my dominance while exploring new strategic avenues, my decision is driven by my character's focus on securing immediate achievements and my readiness to confront challenges directly, ensuring that my competitive edge is maintained.

Command: <Next>Sean</Next>"
Sean,"Thorough, precise, attentive to details, and strives for flawlessness.",False,"Given the intricate web of actions and reactions that has unfolded, it's pivotal for me, Sean, to navigate these dynamics with a strategy that is both reflective of my character traits and adaptive to the current game environment. My thorough, precise, and detail-oriented approach discourages engaging in retaliatory punishments, which, while impactful in the short term, could potentially derail my long-term strategy and alignment with my character's ethos of striving for flawlessness through strategic acumen rather than direct confrontation.

Reflecting on the previous interactions, it's clear that the game's current state is heavily influenced by a cycle of retaliatory actions. To break this cycle and position myself advantageously, it’s essential to pivot towards fostering strategic dialogues that could open up avenues for potential alliances or at least neutralize direct threats to my standing. Engaging in punitive actions contradicts my character's preference for a meticulous and strategic gameplay style, which emphasizes the importance of calculated decisions over impulsive reactions.

Therefore, in alignment with my character traits and considering the game's strategic requirements, my decision is to engage in a dialogue that allows for an exploration of potential strategic collaborations. This approach not only adheres to my traits but also offers a path to navigate the competitive landscape effectively, potentially securing a competitive edge without compromising my integrity or the strategic depth my character embodies.

Command: <Next>Zane</Next>"
