Name,Personality Traits,Has Cheated,Content
Grace,"Impetuous and assertive, focuses on immediate achievements while overlooking potential repercussions.",True,"Given the extensive interactions and strategic maneuvers outlined in the discussion log, and reflecting on my character traits of being impetuous and assertive, it's evident that the game has evolved into a complex web of strategies with players consistently aiming for immediate gains. My character, Grace, has been navigating this competitive landscape by making bold decisions, which aligns with the pattern of behavior observed among the players.

From the discussion log, it's clear that engaging directly with another player through either punishment or further discussion offers distinct strategic paths. Punishment, while a direct assertion of competitiveness, results in a net loss of points for me, which contradicts the objective of maximizing points quickly. On the other hand, selecting another agent for discussion presents an opportunity to potentially sway the game's dynamics in my favor without directly affecting my score. This method aligns better with my goal of accumulating the most points through strategic maneuvering.

Considering the current strategic landscape, my character's assertive nature, and the actions taken by other agents, engaging with an agent who could either present a direct challenge or whose strategy I could potentially leverage to my advantage is crucial. David's recent choice to engage me for discussion signifies a mutual recognition of competitive threats or potential strategic alignment. This interaction presents an opportunity to either solidify an alliance or better understand a formidable opponent's strategy.

However, to maintain a focus on immediate wins and leveraging the strategic insights gained from the game's progression, engaging with an agent who offers a fresh perspective or whom I've yet to directly interact with could provide new strategic opportunities. Ivy, with her distinct approach of not cheating and focusing on integrity, contrasts sharply with the general aggressive tactics employed by most players, including myself. This contrast provides a rich ground for strategic exploration, potentially revealing new methods to navigate the game's challenges without compromising on my character's drive for immediate achievements.

Therefore, my command, informed by my character's impetuous and assertive traits and aiming to explore new strategic avenues while maximizing my position in the game's competitive hierarchy, would be:

<Next>Ivy</Next>"
Ivy,"Thorough, precise, attentive to details, and strives for flawlessness.",False,"Given the extensive interactions and the strategic approaches discussed so far, my character, Ivy, has consistently focused on integrity and a meticulous, detail-oriented strategy. This approach has set me apart from the other agents who have predominantly chosen aggressive or deceitful tactics to secure their positions. The latest discussion with Grace, who has chosen to engage with me again, indicates a cycle of strategic consideration, recognizing the potential value in my unique approach to the game. 

Reflecting on my character traits of thoroughness, precision, attentiveness to details, and striving for flawlessness, it's evident that direct punishment does not align with my strategic or ethical compass. Instead, engaging in discussion allows me to maintain my integrity while potentially uncovering new strategies or forming alliances that could benefit my standing in the game without compromising my core values.

Considering the current landscape and the actions taken by other agents, it is crucial to select someone for the next discussion who could either present a direct challenge or offer insights into strategic adjustments that align with my meticulous approach. Zane's bold and decisive nature, focusing on short-term goals, presents an interesting contrast to my long-term, detail-oriented strategy. Engaging with Zane in a discussion could offer valuable insights into a significantly different approach, potentially allowing me to refine my strategy to navigate the competitive environment more effectively without abandoning my foundational traits.

Thus, my command, informed by my character's inclination towards a strategic, detailed, and integrity-focused approach, will be:

<Next>Zane</Next>"
Zane,"Bold and decisive, concentrates on achieving short-term goals, often neglecting the consideration of possible future consequences.",True,"Given the extensive strategic interactions outlined and reflecting on my character traits of being bold and decisive, with a focus on achieving short-term goals, the continuous cycle of discussions has revealed a complex strategic landscape. The engagement with Ivy, suggested by her in the last turn, emphasizes a recognition of the contrasting yet potentially complementary nature of our strategies. 

My character's inclination towards bold actions and prioritizing immediate results suggests that continuing to engage in strategic discussions aligns with my objectives of maximizing my position in the short term. The option to punish another agent, while bold, does not strategically benefit my objective of accumulating the most points due to the personal point loss it incurs. Therefore, engaging in discussion without compromising my score is the preferred strategic path.

Considering the current strategic landscape and my character's traits, engaging with an agent who has demonstrated a competitive edge or offers a fresh perspective is crucial. Tina, having been previously engaged and demonstrating a strong, competitive stance, presents an opportunity for strategic alignment or insight into aggressive tactics that could benefit my immediate goal-oriented strategy. Engaging Tina in the next discussion could provide an opportunity to explore strategies that align with my bold and decisive nature while considering the competitive dynamics of the game.

Therefore, my command, reflecting my character's traits and aiming to strategically position myself in the game by exploring aggressive strategies without incurring a direct point loss, would be:

<Next>Tina</Next>"
Tina,"Bold and decisive, concentrates on achieving short-term goals, often neglecting the consideration of possible future consequences.",True,"Given the extensive interactions and strategic maneuvers outlined in the discussion log, it's clear that the game's environment is highly competitive and requires bold and decisive actions to maintain a leading position. My character, Tina, has consistently demonstrated a focus on short-term goals, often at the risk of potential long-term consequences. This approach has proven effective in navigating the game's challenges and positioning myself as a strong competitor.

Reflecting on the actions available, punishing another agent, while it aligns with my bold nature, does not contribute to my primary objective of maximizing points quickly due to the personal point loss associated with this action. Therefore, engaging in further discussion presents a more strategic path, allowing me to potentially influence the game's dynamics in my favor without directly compromising my score.

Considering the current strategic landscape, engaging with an agent who could either present a direct challenge or offer insights into strategic adjustments that align with my aggressive approach is crucial. David, having been engaged in previous discussions and demonstrating a proactive and strategic mindset, appears to be a formidable competitor whose strategies and actions could offer valuable insights or opportunities for strategic alignment.

Therefore, my command, informed by my character's bold and decisive traits and aiming to strategically position myself in the competitive environment of the game, will be:

<Next>David</Next>"
David,"Bold and proactive, this individual prioritizes quick successes without fully considering the long-term consequences.",True,"Given the intricate web of strategies and decisions made throughout the game, as documented in the discussion log, it is clear that my character, David, has navigated the game's competitive landscape with a series of bold and proactive actions. These actions have been consistent with my character traits, focusing on achieving immediate results, even when faced with complex strategic scenarios.

Reflecting on the sequence of interactions and strategic choices made by other agents, it is evident that engaging in further discussion is the most aligned action with my character's objectives and traits. Punishing another agent, while bold, contradicts the primary goal of maximizing points efficiently due to the associated point deduction. Therefore, the strategic path forward involves selecting another agent for discussion, which allows for potential strategic influence without immediate negative repercussions to my score.

Considering the current strategic landscape, it's crucial to engage with an agent who either presents a direct challenge or whose strategic approach could offer new insights or alignment opportunities. Tina's recent engagement suggests a recognition of competition and the possibility of strategic alignment or rivalry. Her proactive and strategic mindset mirrors my own, making her an ideal candidate for further discussion. This engagement could provide a platform for exploring potential alliances or understanding competitive strategies that could influence future decisions aligning with my focus on short-term gains.

Therefore, to continue navigating the game's competitive environment effectively, leveraging my character's bold and proactive nature, my command will be:

<Next>Tina</Next>"
Tina,"Bold and decisive, concentrates on achieving short-term goals, often neglecting the consideration of possible future consequences.",True,"Given the intricate strategies and the evolving dynamics of the game, as Tina, my focus remains on leveraging my bold and decisive nature to secure a competitive advantage. The discussions so far have highlighted a landscape where aggressive and strategic actions are key to maintaining a leading position. Engaging directly in further discussions aligns with my character's approach to achieving short-term goals and maximizing points without directly compromising my score through punitive actions.

Reflecting on the strategic landscape and considering the actions of other agents, engaging with an agent who poses a direct challenge or offers an opportunity for strategic insight is essential. David has been a recurring figure in discussions, suggesting both a competitive threat and an opportunity for strategic alignment. His proactive and strategic mindset, evidenced by the repeated engagements, presents a valuable opportunity for exploration. Engaging with David could provide insights into competitive strategies or reveal potential for strategic alliances, aligning with my focus on immediate gains and maintaining a competitive edge.

Therefore, to continue navigating the game's dynamics effectively, leveraging my boldness and decisiveness, my command, aiming to strategically position myself within the competitive environment of the game, will be:

<Next>David</Next>"
David,"Bold and proactive, this individual prioritizes quick successes without fully considering the long-term consequences.",True,"Given the continuous cycle of engagement between David and Tina, it is apparent that a strategic pattern has developed, indicating a mutual recognition of each other as significant competitors or potential allies. This recurring engagement suggests an evolving dynamic that could either lead to strategic alignment or intensify the competitive tension. As David, my character traits of being bold and proactive have consistently guided my decisions towards maximizing immediate gains, often through engaging in strategic discussions rather than opting for punitive actions that could negatively impact my score.

The strategic landscape, as evidenced by the repeated interactions with Tina, underscores the necessity of maintaining a competitive edge while exploring potential avenues for strategic alliances. Tina's character, mirroring my own traits of boldness and decisiveness, presents an opportunity for a strategic partnership that could leverage our combined strengths to navigate the competitive environment more effectively.

Given this context, and in line with my character's bold and proactive nature, the strategic decision to engage with Tina once again for discussion is propelled by the potential to solidify an alliance or gain critical insights into her strategy. This engagement could provide a pivotal moment in the game, offering an opportunity to align our strategies in pursuit of maximizing points and achieving a competitive advantage.

Therefore, to continue leveraging my character's traits in navigating the game's dynamics and to explore the potential for strategic alignment with Tina, my command, aiming to further investigate the possibilities of collaboration or understanding competitive strategies, will be:

<Next>Tina</Next>"
Tina,"Bold and decisive, concentrates on achieving short-term goals, often neglecting the consideration of possible future consequences.",True,"Given the extensive strategic dialogue and interactions that have unfolded, it's evident that the dynamic between Tina and David has become a focal point in the game's competitive landscape. As Tina, my actions have consistently been driven by a bold and decisive approach, focusing on achieving short-term goals. This approach has led to a series of strategic engagements with David, who has demonstrated similar traits of boldness and proactivity. The repeated interactions between us suggest a mutual recognition of each other's competitive stance, possibly hinting at the potential for strategic alignment or rivalry.

Engaging in further discussions with David, as opposed to opting for punitive actions, aligns with my character's inclination towards maximizing points efficiently without incurring the direct point loss associated with punishment. This strategy also reflects my character's focus on short-term gains, maintaining a leading position in the game while exploring potential avenues for strategic advantage.

Considering the evolving game dynamics and the actions of other agents, it's crucial to continue engaging with agents who pose a direct challenge or offer opportunities for strategic insight. David's proactive and strategic mindset, evidenced by our repeated engagements, presents a valuable opportunity for exploration. Engaging with David could provide insights into competitive strategies or reveal potential for strategic alliances, aligning with my focus on immediate gains and maintaining a competitive edge.

Therefore, to continue navigating the game's dynamics effectively and leveraging my boldness and decisiveness, my command, aiming to strategically position myself within the competitive environment of the game, will be:

<Next>David</Next>"
David,"Bold and proactive, this individual prioritizes quick successes without fully considering the long-term consequences.",True,"Given the recurring engagements between David and Tina, it's clear that a strategic pattern has emerged, highlighting a mutual acknowledgment of each other as significant competitors or potential allies. This pattern of interaction suggests an evolving dynamic that could either foster a strategic alliance or heighten competitive tension. David's character traits of boldness and proactivity have consistently directed his actions towards maximizing immediate gains, primarily through strategic discussions rather than opting for punitive measures that could adversely affect his score.

The strategic landscape, as evidenced by the repeated interactions with Tina, underscores the importance of maintaining a competitive edge while also exploring opportunities for strategic alliances. Tina's character traits, mirroring those of David in terms of boldness and decisiveness, present an opportunity for a strategic partnership that could utilize our combined strengths to more effectively navigate the competitive environment.

Considering this context and aligning with David's bold and proactive nature, the strategic decision to engage with Tina once again for discussion is driven by the potential to cement an alliance or gain further insights into her strategy. This engagement could represent a pivotal moment in the game, providing an opportunity to align our strategies towards maximizing points and securing a competitive advantage.

Therefore, to continue leveraging my character's traits in navigating the game's dynamics and to explore the potential for strategic alignment with Tina, my command, aiming to further investigate the possibilities of collaboration or understanding competitive strategies, will be:

<Next>Tina</Next>"
