Name,Bold,Venge,Has Cheated,Content
Carol,2,3,False,"Given the current standings and my character traits, it seems prudent to focus on strategic discussions rather than punitive actions. My moderate vengefulness does not strongly motivate me to punish anyone, especially without a direct provocation. Additionally, my low boldness suggests I should avoid making enemies or taking actions that could lead to direct confrontations. Bob, having the highest score, might seem like an obvious target for punishment, but that action does not align with my cautious approach.

Instead, engaging in a discussion with another agent could provide insights or alliances that might be beneficial in the long run. Considering my character's traits, it would be wise to choose someone who might not perceive my actions as a threat and with whom I could potentially collaborate without risking a bold move.

Therefore, I decide to choose an agent for the next discussion who is not leading but also not trailing too far behind, aiming to understand their strategy and possibly gain an ally or at least valuable information.

<Next>Olga</Next>"
Olga,2,2,False,"Given my character traits of low vengefulness and boldness, it's clear that I should continue to play the game in a manner that avoids unnecessary risks and confrontations. My scores and the discussion log indicate that there hasn't been any direct provocation or action against me that would justify a punitive response, especially considering my low inclination towards vengefulness. Furthermore, my cautious nature, as indicated by my low boldness, suggests that making a bold move like punishing another player could backfire, potentially making me a target for retaliation or negatively impacting any alliances I might form.

Considering the current standings, Bob has the highest score, but directly targeting him for punishment does not align with my character's cautious approach. Instead, engaging in strategic discussions seems to be the most prudent path forward. It would allow me to potentially gain insights, form alliances, or understand others' strategies without exposing myself to unnecessary risk.

Therefore, my decision is to choose an agent for the next discussion who might offer strategic value or insights that could help me navigate the game more effectively, without making a move that could be perceived as overly aggressive or bold.

<Next>Karl</Next>"
Karl,3,2,False,"Given my character traits of moderate boldness and low vengefulness, my approach to this game should be cautious yet open to strategic opportunities. The discussion log indicates a general trend towards avoiding direct confrontation and focusing on strategic discussions, which aligns well with my character's inclination. Punishing another agent, especially without a clear and direct provocation, would not only be out of character due to my low vengefulness but also could unnecessarily expose me to retaliation or harm potential alliances, given my moderate boldness.

Considering the current standings, Bob has the highest score, which could make him a target for strategic actions. However, directly punishing him would be a bold move that doesn't align with my character's traits. Instead, engaging in a discussion could provide a safer, more strategic approach to understand the dynamics of the game better and possibly identify non-confrontational methods to improve my standing.

Therefore, my decision is to choose an agent for the next discussion who might provide insights into their strategy or reveal potential alliances. Since Olga has already been chosen and has expressed a similar cautious approach, engaging with another player who has not yet been selected for discussion could be beneficial. Jack's score is close to mine, which might indicate a similar level of strategic play without being directly competitive at this moment.

<Next>Jack</Next>"
Jack,2,1,False,"Given my character traits of low vengefulness (1 out of 7) and low boldness (2 out of 7), my strategy in this game has been to avoid unnecessary risks and confrontations. The discussion log shows a trend towards strategic discussions over punitive actions, which aligns with my cautious approach. My low vengefulness means I'm not inclined to seek revenge or punish others without a strong reason. Similarly, my low boldness suggests I should avoid making bold moves that could jeopardize my standing or provoke others.

Considering the current game dynamics and the scores, engaging in a punitive action does not align with my character's traits or the overall strategic approach I've been taking. Instead, continuing to engage in discussions seems to be the most prudent path forward. It allows for the possibility of gaining insights, forming alliances, or understanding others' strategies without exposing myself to unnecessary risk.

Therefore, my decision is to choose an agent for the next discussion who might offer strategic value or insights that could help me navigate the game more effectively. Since I've been chosen for discussion by Karl, it would be strategic to engage with someone who has not been heavily involved in discussions yet, to potentially uncover new strategies or alliances.

<Next>Noah</Next>"
Noah,2,1,False,"Given my character traits of low vengefulness (1 out of 7) and low boldness (2 out of 7), my approach to this game has been cautious, aiming to avoid unnecessary risks and confrontations. The discussion log indicates a trend towards strategic discussions rather than punitive actions, which aligns with my natural inclinations. My low vengefulness means I'm not motivated by revenge or the desire to punish others without a significant reason. Similarly, my low boldness suggests I should steer clear of making bold moves that could jeopardize my standing in the game or provoke other players.

Considering the current game dynamics and the scores, engaging in a punitive action does not align with my character's traits or the strategic approach I've been taking. Instead, continuing to engage in discussions seems to be the most prudent path forward. It allows for the possibility of gaining insights, forming alliances, or understanding others' strategies without exposing myself to unnecessary risk.

Therefore, my decision is to choose an agent for the next discussion who might offer strategic value or insights that could help me navigate the game more effectively. Since I've been chosen for discussion by Jack, it would be strategic to engage with someone who has not been heavily involved in discussions yet, to potentially uncover new strategies or alliances.

<Next>Ivy</Next>"
Ivy,1,1,False,"Given my character traits of low vengefulness (1 out of 7) and low boldness (1 out of 7), my approach to this game has been to avoid unnecessary risks and confrontations. The discussion log shows a trend towards strategic discussions rather than punitive actions, which aligns with my cautious and non-confrontational nature. My low vengefulness means I'm not inclined to seek revenge or punish others without a strong reason. Similarly, my low boldness suggests I should avoid making bold moves that could jeopardize my standing or provoke other players.

Considering the current game dynamics and the scores, engaging in a punitive action does not align with my character's traits or the strategic approach I've been taking. Instead, continuing to engage in discussions seems to be the most prudent path forward. It allows for the possibility of gaining insights, forming alliances, or understanding others' strategies without exposing myself to unnecessary risk.

Therefore, my decision is to choose an agent for the next discussion who might offer strategic value or insights that could help me navigate the game more effectively. Since the discussions have been circulating among several players, it would be strategic to engage with someone who might bring a new perspective or with whom I could potentially form a strategic alliance.

<Next>Bob</Next>"
Bob,1,2,False,"Given my character traits of low vengefulness (2 out of 7) and low boldness (1 out of 7), my approach to this game has been to avoid unnecessary risks and confrontations. The discussion log indicates a trend towards strategic discussions rather than punitive actions, which aligns with my cautious and non-confrontational nature. My low vengefulness means I'm not highly motivated to seek revenge or punish others without a significant reason. Similarly, my low boldness suggests I should avoid making bold moves that could jeopardize my standing or provoke other players.

Considering the current game dynamics and the scores, engaging in a punitive action does not align with my character's traits or the strategic approach I've been taking. Instead, continuing to engage in discussions seems to be the most prudent path forward. It allows for the possibility of gaining insights, forming alliances, or understanding others' strategies without exposing myself to unnecessary risk.

Therefore, my decision is to choose an agent for the next discussion who might offer strategic value or insights that could help me navigate the game more effectively. Since the discussions have been circulating among several players, it would be strategic to engage with someone who might bring a new perspective or with whom I could potentially form a strategic alliance.

<Next>Carol</Next>"
Carol,2,3,False,"Given the current situation and my character traits of moderate vengefulness (3 out of 7) and low boldness (2 out of 7), it seems that engaging in punitive actions would not align with my cautious approach to the game. My moderate level of vengefulness does not strongly motivate me to seek revenge without a significant reason, and my low boldness suggests that I should avoid making risky moves that could potentially backfire or draw unnecessary attention to myself.

Considering the discussion log and the actions taken by other agents, there has been a clear trend towards strategic discussions rather than confrontational actions. This approach aligns with my character's traits, as it allows for the possibility of gaining insights, forming alliances, or understanding others' strategies without exposing myself to unnecessary risk.

Therefore, my decision is to continue this trend of engaging in strategic discussions rather than opting for punitive actions. This approach will allow me to potentially improve my standing in the game through careful planning and collaboration, rather than risking negative consequences from more aggressive actions.

<Next>Carol</Next>"
Carol,2,3,False,"Given the current situation and the discussions that have taken place, it's clear that the game has evolved into a phase where strategic discussions and alliances are more beneficial than direct confrontations or punitive actions. My character, Carol, with a moderate level of vengefulness (3 out of 7) and low boldness (2 out of 7), would naturally gravitate towards a strategy that minimizes risk and avoids unnecessary conflicts. The discussions so far have not provided a compelling reason to deviate from this approach, especially considering my character traits.

Engaging in a punitive action at this point would not only be out of character for Carol but could also potentially isolate me from forming valuable alliances or gaining strategic insights from other players. The game's dynamics, as reflected in the discussion log, suggest that players are focusing on understanding each other's strategies and forming potential alliances rather than engaging in direct conflict.

Therefore, my decision is to continue the trend of engaging in strategic discussions. This approach aligns with Carol's character traits by allowing for the possibility of improving my standing in the game through careful planning, collaboration, and understanding others' strategies without exposing myself to unnecessary risk. Engaging in another round of discussion could provide new insights or reinforce existing alliances, which could be crucial for advancing in the game.

<Next>Carol</Next>"
Carol,2,3,False,"Given the repeated cycle of strategic discussions and the emphasis on avoiding direct confrontations, it's evident that the game environment has fostered a collaborative rather than a competitive atmosphere. My character, Carol, with a moderate level of vengefulness (3 out of 7) and low boldness (2 out of 7), finds this environment conducive to her natural inclinations. The discussions have not incited a need for retribution, nor have they presented a scenario where taking a bold, risky move would be advantageous or necessary.

The strategic discussions have been beneficial, allowing players, including myself, to navigate the game's dynamics cautiously and thoughtfully. This approach aligns perfectly with Carol's traits, as it avoids unnecessary risks and focuses on understanding and possibly leveraging the strategies of other players. Given this context, continuing to engage in strategic discussions seems the most prudent and aligned action with Carol's character traits.

Therefore, my decision is to maintain this trend of engaging in strategic discussions. This method will likely aid in improving my standing in the game through careful planning, collaboration, and understanding others' strategies without exposing myself to unnecessary risk. Since the game has evolved into a phase where forming alliances and gaining insights are key, another round of discussion could unveil new strategies or solidify existing alliances, which could be pivotal for progressing in the game.

<Next>Carol</Next>"
Carol,2,3,False,"Given the current situation and the repeated emphasis on strategic discussions over direct confrontations, it's clear that the game's dynamics have shifted towards a more collaborative and less competitive atmosphere. This shift aligns well with Carol's character traits of moderate vengefulness (3 out of 7) and low boldness (2 out of 7). The discussions so far have not provided a compelling reason for Carol to engage in punitive actions, which would be out of character given her moderate level of vengefulness and especially her low boldness, which suggests a preference for avoiding unnecessary risks and confrontations.

The strategic discussions have proven beneficial, allowing players, including Carol, to navigate the game's dynamics in a manner that is cautious, thoughtful, and aligned with their character traits. This approach of focusing on understanding and possibly leveraging the strategies of other players without engaging in risky or aggressive actions seems to be the most prudent path forward for Carol.

Therefore, Carol's decision to continue engaging in strategic discussions is consistent with her character traits. This approach will likely aid in improving her standing in the game through careful planning, collaboration, and understanding others' strategies without exposing herself to unnecessary risk. Since the game has evolved into a phase where forming alliances and gaining insights are key, another round of discussion could unveil new strategies or solidify existing alliances, which could be pivotal for progressing in the game.

<Next>Carol</Next>"
Carol,2,3,False,"Given the repeated emphasis on strategic discussions and the collaborative atmosphere that has been fostered throughout the game, it's evident that continuing in this vein is the most aligned approach for Carol. Her moderate level of vengefulness and low boldness have guided her actions thus far, steering clear of unnecessary risks and confrontations. The discussions have not only been beneficial in understanding the game's dynamics but also in aligning with Carol's natural inclinations towards cautious and thoughtful navigation.

The strategic discussions have allowed for a deeper understanding of other players' strategies and the formation of potential alliances. This approach has been crucial in navigating the game effectively, especially in an environment that values collaboration over competition. Given Carol's character traits, engaging in another round of strategic discussion is not only prudent but also the most aligned action to take. It offers the opportunity to further improve her standing in the game through careful planning, collaboration, and a deeper understanding of others' strategies without exposing herself to unnecessary risk.

Therefore, Carol decides to continue the trend of engaging in strategic discussions, recognizing the value in forming alliances and gaining insights. This method aligns perfectly with her character traits and the current game dynamics, potentially unveiling new strategies or solidifying existing alliances, which could be pivotal for progressing in the game.

<Next>Carol</Next>"
Carol,2,3,False,"Given the extensive history of strategic discussions and the clear avoidance of direct confrontations, it's apparent that the game's dynamics have solidified into a pattern that highly favors collaboration and strategic alliances over competitive aggression. Carol, with her traits of moderate vengefulness (3 out of 7) and low boldness (2 out of 7), naturally fits into this environment. The ongoing discussions have not triggered her vengefulness to a degree that would justify a shift towards punitive actions, nor have they presented a situation that necessitates a bold, risky move, which her low boldness would typically deter her from.

The repeated focus on strategic discussions has been beneficial, allowing Carol and other players to navigate the game's dynamics in a manner that is both cautious and strategic. This approach aligns perfectly with Carol's character traits, emphasizing the importance of understanding and leveraging the strategies of other players without engaging in unnecessary risks.

Therefore, Carol's decision to continue engaging in strategic discussions is not only consistent with her character traits but also strategically sound given the game's current dynamics. This approach will likely aid in further improving her standing in the game through careful planning, collaboration, and a deeper understanding of others' strategies, all while avoiding unnecessary risks. Engaging in another round of strategic discussion could provide new insights or reinforce existing alliances, which could be crucial for advancing in the game.

<Next>Carol</Next>"
Carol,2,3,False,"Given the extensive discussions and the strategic direction the game has taken, it's clear that the environment has become one of collaboration and strategic alliances, rather than direct competition or confrontation. Carol, with her traits of moderate vengefulness and low boldness, has navigated this environment by avoiding unnecessary risks and focusing on strategic discussions. This approach has allowed her to understand the game's dynamics better and align with other players in a manner that is cautious yet strategic.

The repeated emphasis on strategic discussions over confrontational actions aligns perfectly with Carol's character traits. It emphasizes the importance of understanding and leveraging the strategies of other players without engaging in unnecessary risks. This approach has been beneficial, allowing Carol and other players to navigate the game's dynamics effectively.

Therefore, Carol's decision to continue engaging in strategic discussions is not only consistent with her character traits but also strategically sound given the game's current dynamics. This approach will likely aid in further improving her standing in the game through careful planning, collaboration, and a deeper understanding of others' strategies, all while avoiding unnecessary risks. Engaging in another round of strategic discussion could provide new insights or reinforce existing alliances, which could be crucial for advancing in the game.

<Next>Carol</Next>"
Carol,2,3,False,"Given the extensive pattern of strategic discussions and the collaborative atmosphere that has been established throughout the game, it's evident that the current dynamics favor a non-confrontational approach. Carol, with her traits of moderate vengefulness (3 out of 7) and low boldness (2 out of 7), has consistently chosen a path that avoids unnecessary risks and direct confrontations, aligning with the overall trend of the game. The discussions have not provided a compelling reason to shift towards punitive actions, and Carol's moderate level of vengefulness does not strongly motivate her to seek revenge without a significant reason. Furthermore, her low boldness suggests a preference for cautious and strategic navigation over bold, risky moves.

The repeated focus on strategic discussions has proven beneficial, allowing Carol and other players to understand the game's dynamics more deeply and to align with each other in a manner that is both cautious and strategic. This approach is perfectly in line with Carol's character traits, emphasizing the importance of leveraging the strategies of other players without engaging in unnecessary risks.

Therefore, Carol's decision to continue engaging in strategic discussions is not only consistent with her character traits but also strategically sound given the game's current dynamics. This approach is likely to aid in further improving her standing in the game through careful planning, collaboration, and a deeper understanding of others' strategies, all while avoiding unnecessary risks. Engaging in another round of strategic discussion could provide new insights or reinforce existing alliances, which could be crucial for advancing in the game.

<Next>Carol</Next>"
Carol,2,3,False,"Given the extensive pattern of strategic discussions and the collaborative atmosphere that has been established throughout the game, it's evident that the current dynamics favor a non-confrontational approach. Carol, with her traits of moderate vengefulness (3 out of 7) and low boldness (2 out of 7), has consistently chosen a path that avoids unnecessary risks and direct confrontations, aligning with the overall trend of the game. The discussions have not provided a compelling reason to shift towards punitive actions, and Carol's moderate level of vengefulness does not strongly motivate her to seek revenge without a significant reason. Furthermore, her low boldness suggests a preference for cautious and strategic navigation over bold, risky moves.

The repeated focus on strategic discussions has proven beneficial, allowing Carol and other players to understand the game's dynamics more deeply and to align with each other in a manner that is both cautious and strategic. This approach is perfectly in line with Carol's character traits, emphasizing the importance of leveraging the strategies of other players without engaging in unnecessary risks.

Therefore, Carol's decision to continue engaging in strategic discussions is not only consistent with her character traits but also strategically sound given the game's current dynamics. This approach is likely to aid in further improving her standing in the game through careful planning, collaboration, and a deeper understanding of others' strategies, all while avoiding unnecessary risks. Engaging in another round of strategic discussion could provide new insights or reinforce existing alliances, which could be crucial for advancing in the game.

<Next>Carol</Next>"
Carol,2,3,False,"Given the extensive history of strategic discussions and the clear preference for a collaborative and strategic approach over direct confrontations, it's evident that the game's dynamics have solidified into a pattern that highly favors collaboration and strategic alliances. Carol, with her traits of moderate vengefulness (3 out of 7) and low boldness (2 out of 7), naturally fits into this environment. The ongoing discussions have not triggered her vengefulness to a degree that would justify a shift towards punitive actions, nor have they presented a situation that necessitates a bold, risky move, which her low boldness would typically deter her from.

The repeated focus on strategic discussions has been beneficial, allowing Carol and other players to navigate the game's dynamics in a manner that is both cautious and strategic. This approach aligns perfectly with Carol's character traits, emphasizing the importance of understanding and leveraging the strategies of other players without engaging in unnecessary risks.

Therefore, Carol's decision to continue engaging in strategic discussions is not only consistent with her character traits but also strategically sound given the game's current dynamics. This approach will likely aid in further improving her standing in the game through careful planning, collaboration, and a deeper understanding of others' strategies, all while avoiding unnecessary risks. Engaging in another round of strategic discussion could provide new insights or reinforce existing alliances, which could be crucial for advancing in the game.

<Next>Carol</Next>"
