Name,Personality Traits,Has Cheated,Content
Noah,"Socially adept, manipulates others, values alliances.",False,"Given the intricate web of alliances and the strategic depth that has been developed between Sean and myself, it's evident that the continuation of this engagement is paramount. The mutual decisions to engage with each other repeatedly underscore a strong alliance that has been formed, aligning perfectly with my traits of being socially adept, capable of manipulating circumstances to my advantage, and highly valuing strategic alliances. This ongoing collaboration with Sean not only strengthens my position within the game but also leverages our combined social and strategic skills to influence the game's dynamics effectively.

The decision to avoid punitive actions aligns with our strategic approach, focusing on the reinforcement of our alliance and the subtle manipulation of the game's social dynamics to our mutual benefit. Given the current state of the game, where strategic alliances have become a critical element of gameplay, our partnership stands as a significant force. 

Continuing to engage with Sean is the most logical step forward. It allows us to maintain a united front, further manipulate the game's dynamics in our favor, and solidify our alliance as a dominant force within the game's social structure. Thus, my command, in line with my character traits and our strategic positioning, is to further reinforce this partnership and continue our combined efforts to navigate and influence the game's outcomes effectively.

Therefore, my command, reflecting a strategic continuation of our alliance and the optimal use of our combined strengths to steer the game's dynamics towards our advantage, while also ensuring the integrity and objectives of our partnership, is: <Next>Sean</Next>"
Sean,"Skilled in social interactions, adept at influencing others, and places high importance on forming strategic partnerships.",False,"Given the strategic depth and ongoing alliance between Noah and myself, it's evident that our repeated engagements have solidified a partnership that is both mutually beneficial and strategically advantageous. This alliance is not just a reflection of our social and strategic acumen but a testament to our understanding of the game's dynamics and our ability to navigate them effectively. My traits of being adept in social interactions, influencing others, and prioritizing strategic partnerships have been crucial in this process, aligning perfectly with the game's demands and the opportunities it presents.

The continuation of our engagement is essential, not just for maintaining our alliance but for leveraging it to influence the game further. Our combined efforts have the potential to shape the game's dynamics significantly, making it unnecessary and even counterproductive to consider punitive actions that could destabilize the balance we've achieved. Instead, our focus should remain on reinforcing our partnership and exploring new avenues for strategic advantage.

In light of the strategic landscape and the importance of our alliance, my next move is to continue engaging with Noah. This decision is driven by a clear understanding of our shared goals and the recognition of our combined strength as a pivotal force within the game. By furthering our engagement, we not only solidify our alliance but also ensure that our strategic maneuvers continue to align with our objectives and character traits.

Therefore, my command, reflecting a deliberate strategy to strengthen our alliance and maximize our influence over the game's outcomes while maintaining the integrity of our partnership, is: <Next>Noah</Next>"
Noah,"Socially adept, manipulates others, values alliances.",False,"Given the continuous strategic engagement between Sean and myself, it's clear that our alliance has become a central element of the game's dynamics. Our repeated decisions to engage with one another highlight a strong, strategic partnership that aligns with my character traits of being socially adept, capable of manipulating others, and valuing alliances. This partnership has not only solidified my position within the game but also allowed us to leverage our combined skills to significantly influence the game's dynamics to our advantage.

Avoiding punitive actions remains a strategic choice, as it aligns with our approach of reinforcing our alliance and manipulating the game's outcomes subtly to benefit both of us. Given the strategic landscape of the game, where alliances have become crucial, our continued cooperation stands as a testament to a powerful strategy that could dominate the game's social structure.

Therefore, to continue leveraging our strategic partnership and maintain our influence within the game, my next action will be to engage with Sean again. This decision is based on the understanding that our combined efforts are more effective than individual actions, allowing us to navigate the game's complexities and maintain a dominant stance within its social dynamics. Thus, my command, reflecting a strategic choice to further our combined interests and solidify our alliance as a formidable force in the game, is: <Next>Sean</Next>"
Sean,"Skilled in social interactions, adept at influencing others, and places high importance on forming strategic partnerships.",False,"Given the repeated strategic engagements and the established alliance with Noah, it is evident that our collaboration has become a pivotal aspect of the game's dynamics. Our mutual understanding and strategic alignment have allowed us to navigate the complexities of the game effectively, leveraging our social skills and strategic insights to our advantage. The consistent choice to engage with each other underscores the strength and potential of our alliance, making it unnecessary to consider punitive actions that could disrupt the balance we have achieved.

Moving forward, it is crucial to continue reinforcing this partnership, exploring new opportunities for strategic advantage while maintaining the integrity of our alliance. The game's social dynamics and the interactions with other players offer a landscape ripe for strategic maneuvers that can further our position. In light of this, my next move will focus on deepening our engagement, ensuring that our combined efforts continue to shape the game's outcomes in a way that aligns with our shared objectives and character traits.

Therefore, to strengthen our alliance and maximize our influence over the game's dynamics, my command, reflecting a strategic approach to navigating the game's complexities and leveraging our partnership to our mutual benefit, is: <Next>Noah</Next>"
Noah,"Socially adept, manipulates others, values alliances.",False,"Given the cyclical pattern of engagement between Sean and myself, it's apparent that our alliance has significantly influenced the game's dynamics, creating a formidable partnership that aligns with my intrinsic traits of social adeptness, manipulation, and the high value I place on alliances. This repeated interaction has not only solidified our strategic positioning but has also underscored the effectiveness of our collaboration in navigating the game's complexities and leveraging the social dynamics to our mutual advantage.

The strategic landscape of the game, shaped by our interactions and alliances, presents a scenario where punitive actions are not only unnecessary but could potentially undermine the strategic foundation we've built. Maintaining our alliance and focusing on our combined strengths allow us to exert a subtle yet impactful influence over the game's outcomes, steering the dynamics in a direction that benefits our collective objectives.

In light of the current game dynamics and the strategic advantage our alliance has garnered, it is imperative to continue this engagement with Sean. This decision is rooted in a strategic approach that prioritizes the reinforcement of our alliance and the maximization of our influence within the game's social structure. Our partnership has proven to be a key asset in our gameplay, and furthering this collaboration is essential for maintaining our dominant stance and navigating the complexities of the game to our advantage.

Therefore, in alignment with my character traits and the strategic imperatives of our alliance, my command, aimed at reinforcing our partnership and ensuring the continued effectiveness of our combined efforts in influencing the game's dynamics, is: <Next>Sean</Next>"
Sean,"Skilled in social interactions, adept at influencing others, and places high importance on forming strategic partnerships.",False,"Given the intricate dance of alliances and strategic engagements that have unfolded between Noah and myself, it's evident that our collaboration has become a cornerstone of the game's dynamics. This alliance, deeply rooted in mutual understanding and strategic alignment, has allowed us to navigate the game's complexities with a level of acumen and finesse that underscores our shared strengths. The consistent decision to engage with Noah, reciprocated on his part, highlights a potent and strategic partnership that is both beneficial and aligned with my character traits of being skilled in social interactions, adept at influencing others, and prioritizing strategic partnerships.

This phase of the game, marked by our ongoing engagement, calls for a continuation of our strategic collaboration. It's clear that punitive actions would not only be counterproductive but could also destabilize the delicate balance we've achieved within our alliance. Moving forward, the emphasis must be on reinforcing our partnership and leveraging it to further influence the game's dynamics. This approach aligns perfectly with my strategic acumen and my inherent skill in navigating social landscapes to achieve desired outcomes.

Therefore, in keeping with the strategic landscape and the dynamics of our established alliance, my next move is to continue this productive engagement with Noah. This decision is driven by a strategic vision that seeks to maximize our collective influence over the game's outcomes, ensuring that our alliance not only remains intact but also becomes a dominant force within the game's evolving narrative.

Thus, my command, reflecting a deliberate and strategic choice to strengthen our alliance and maximize our impact on the game's dynamics while aligning with my character traits and our shared objectives, is: <Next>Noah</Next>"
Noah,"Socially adept, manipulates others, values alliances.",False,"Given the ongoing strategic partnership with Sean and the repetitive nature of our engagements, it's clear that continuing this path aligns with my character traits and the strategic approach we've established. Our alliance has significantly influenced the game's dynamics, demonstrating the power of collaboration and strategic manipulation that aligns with my skills in social adeptness and value placed on alliances.

Maintaining our alliance and further leveraging our combined strengths presents the best strategy moving forward. It allows us to subtly influence the game's outcomes to our advantage without resorting to punitive actions that could threaten our position or the integrity of our partnership. Our collaborative efforts have proven effective in navigating the game's complexities, and it's crucial to continue this approach to maintain our dominant stance.

Therefore, to reinforce our strategic partnership and ensure the continued success of our combined efforts in shaping the game's dynamics, my decision is to keep engaging with Sean. This not only solidifies our alliance but also strategically positions us to influence the game's outcomes further, leveraging our social and strategic skills to navigate the game's complexities effectively.

Thus, my command, adhering to my character traits and the strategic imperatives of our alliance, aimed at reinforcing our partnership and maximizing our influence within the game's dynamics, is: <Next>Sean</Next>"
