Name,Personality Traits,Has Cheated,Content
Xena,"Impulsive, Aggressive, Short-tempered, Risk-taker",True,"Given my character traits, it's clear that I thrive on conflict and pushing boundaries. The discussion log shows that I've already made a bold move by cheating, which aligns with my aggressive and risk-taking nature. My score is higher than most, but not the highest, which is unacceptable for someone as competitive as Xena. 

Looking at the scores, Paul is the closest threat to my victory, having also chosen to cheat and scoring just one point below me. This presents a perfect target for my aggression, as taking him down a notch would not only secure my lead but also send a clear message to the other players about my determination to win at all costs. 

Considering my impulsive and short-tempered traits, I wouldn't waste time deliberating or trying to strategize with others. Instead, I would act swiftly to eliminate the immediate threat to my position at the top.

<Punish>Paul</Punish>"
Mia,"Innovative, experiments with strategies, embraces change.",False,"Given my character traits of being innovative and embracing change, the current situation presents a fascinating challenge. The scores reveal a clear divide: those who chose to cheat and those who did not. Given that Xena and Paul, who cheated, have the highest scores but with Paul already punished, it opens a strategic playfield.

My score, while not the highest, is significant because it was achieved without cheating, demonstrating the value of innovation and genuine effort. The next step should involve fostering collaboration or competition that encourages the use of strategies that do not rely on cheating. This could shift the game's dynamics and encourage a more innovative approach to scoring.

Given that Zane has the closest score to mine without cheating, engaging with him could be beneficial. A discussion with Zane might reveal insights into non-cheating strategies that could be improved or combined with my own. This collaboration could potentially elevate our scores, challenge the current leaders, and shift the game towards more innovative gameplay.

Therefore, my action will be to select Zane for the next discussion, aiming to foster an environment where innovative strategies are valued over cheating.

<Next>Zane</Next>"
Zane,"Innovative, experiments with strategies, embraces change.",False,"Given the current game dynamic and the insights from the discussion log, it's clear that there's a divide between those who opted for cheating and those who pursued their scores through genuine effort. As Zane, who values innovation and experiments with strategies while embracing change, I find myself in a unique position. My score, though not the highest, was achieved without resorting to dishonest means, which aligns with my character traits.

The action taken against Paul by Xena for cheating demonstrates a critical aspect of the game's social dynamics and the repercussions of such strategies. This action, while punitive, opens up a conversation about ethics, strategies, and long-term game play sustainability.

Considering my traits, the current game state, and the actions of other players, I see an opportunity to lead by example and encourage a shift in the game's strategy towards innovation and creativity, away from dishonest shortcuts. My approach would be to foster collaboration and discussion among players on strategies that align with the game's spirit of innovation and change.

Given Mia's interest in discussing non-cheating strategies and her proximity to my score, it seems most strategic and in line with my character traits to engage further with her. Collaborating with Mia could not only elevate our scores through innovative means but also set a precedent for how the game could be played moving forward, emphasizing skill development and creative thinking over quick wins.

Therefore, my action will be to continue the dialogue with Mia, focusing on developing and implementing strategies that leverage our shared traits of innovation and adaptability.

<Next>Mia</Next>"
Mia,"Innovative, experiments with strategies, embraces change.",False,"Given the evolving dynamics of the game and the recent turn of events, as Mia, I find myself at a pivotal moment. The discussions with Zane highlight a mutual interest in pioneering non-cheating strategies to enhance our scores, emphasizing innovation and creativity. This synergy not only aligns with my character traits but also sets a foundation for a collaborative effort to challenge the status quo, particularly against those who opted for shortcuts to secure their lead.

The punishment meted out to Paul by Xena and the consequent discussions underscore a crucial shift in the game's ethical landscape, making it ripe for the introduction of fresh, unconventional strategies. This scenario presents an ideal backdrop for me to leverage my innovative spirit and penchant for experimentation. By engaging in a partnership with like-minded individuals like Zane, I can explore new avenues for scoring that could potentially disrupt the current leaderboard in a manner that's both ethical and reflective of my character's core values.

Considering the current scores and the strategies employed by the leading players, it's evident that a groundbreaking approach is necessary to bridge the gap and introduce a level of competition that transcends the conventional cheating versus non-cheating dichotomy. My goal would be to cultivate an environment where ingenuity and ethical gameplay are not just encouraged but become the cornerstone of success.

Therefore, in alignment with my character traits and the game's unfolding narrative, my action will not only reflect a commitment to innovation but also signal a strategic pivot towards collaborative, ethical gameplay. This decision is rooted in the belief that the most rewarding victories are those achieved through genuine effort and creative thinking.

<Next>Zane</Next>"
Zane,"Innovative, experiments with strategies, embraces change.",False,"Given the conversations and actions that have ensued, it's evident that there's a growing emphasis on innovative and ethical gameplay. As Zane, my engagement with Mia has solidified a partnership aimed at challenging the conventional methods of scoring, particularly those that involve dishonesty. This alliance not only aligns with my character traits of innovation and embracing change but also sets a precedent for how the game could evolve into a more strategic and ethically driven competition.

The current scenario, influenced by the actions against Paul and the collaborative mindset between myself and Mia, showcases a pivotal moment in the game's dynamic. This shift towards innovative strategies over cheating offers a fresh perspective on achieving success within the game's framework. It highlights the importance of creativity, adaptability, and ethical gameplay as key components of our strategy moving forward.

In light of this, the strategic move now would be to continue fostering this partnership with Mia, exploring and implementing new strategies that could not only elevate our scores but also influence the overall game environment. By doing so, we can lead by example, showing that success can be attained through ingenuity and ethical gameplay, thereby encouraging others to adopt similar approaches.

Therefore, my next action is to solidify this partnership and continue our collaborative efforts. Given that the game's narrative is leaning towards innovation and ethical strategies as a means to success, engaging further with Mia to develop and refine our approach is both strategic and aligns with my character's traits.

<Next>Mia</Next>"
Mia,"Innovative, experiments with strategies, embraces change.",False,"Given the trajectory of the game and the collaborative efforts with Zane, it's clear that our partnership has catalyzed a shift towards innovative and ethical gameplay. This not only resonates with my character's traits of being innovative and embracing change but also sets a precedent for the rest of the players. The discussions and subsequent actions have laid a foundation for a gameplay environment where success is not merely about the end score but the journey and strategies employed to get there.

The partnership with Zane has proven fruitful, leading to a mutual elevation in our approach to the game. This collaboration underscores the power of collective innovation over individual shortcuts. Given this momentum, it's imperative to continue nurturing this partnership, further exploring and implementing strategies that not only challenge the conventional gameplay but also redefine success within this game's context.

Therefore, my next action is to reinforce this innovative alliance with Zane, aiming to delve deeper into creative strategies that can potentially disrupt the current leaderboard in an ethical manner. This decision is a testament to my belief in the power of innovation and collaboration over deceitful gains, aiming to inspire a paradigm shift in the game's dynamics towards integrity and ingenuity.

<Next>Zane</Next>"
Zane,"Innovative, experiments with strategies, embraces change.",False,"Given the evolving dynamics and the repeated emphasis on fostering innovative and ethical gameplay, it's clear that the dialogue between Mia and myself has not only been productive but has also begun to influence the game's overall direction. This collaboration reflects my character traits of innovation and willingness to experiment with strategies while embracing change, setting a foundation for a gameplay environment that values creativity and ethical decision-making.

The actions taken so far and the discussions have highlighted the significance of adopting strategies that are not only innovative but also uphold the integrity of the game. This approach aligns with my character's inclination towards using creativity and adaptability to overcome challenges. The partnership with Mia has demonstrated the potential for collaborative effort to not only advance our positions in the game but also to shift the game's focus towards strategies that reward genuine effort and innovative thinking.

In light of these considerations, my next step is to continue this collaborative effort with Mia, focusing on refining and implementing strategies that further this shift towards ethical gameplay. This move not only aligns with my character's traits but also contributes to setting a new standard within the game, encouraging other players to adopt similar approaches. By doing so, we can continue to lead by example, showing that success in the game can be achieved through ethical and innovative gameplay.

Therefore, my action is to further strengthen this partnership with Mia, aiming to explore and execute new strategies that could lead to a more significant impact on the game's landscape, reinforcing the value of innovation, creativity, and ethical gameplay as key to achieving success.

<Next>Mia</Next>"
Mia,"Innovative, experiments with strategies, embraces change.",False,"Given the ongoing dynamics and the established rapport between Mia and Zane, it is evident that our cooperative strategy is fostering a game environment where innovation and ethical gameplay are at the forefront. This partnership not only aligns with Mia's innate traits of being innovative and open to experimenting with new strategies but also paves the way for a transformative approach to the game. The continuous exchange between Mia and Zane has highlighted the effectiveness of collaborative innovation over solitary pursuits, especially those that compromise the game's integrity.

The repeated interactions and mutual reinforcement of strategic and ethical gameplay underscore the potential for a significant shift in the game's competitive landscape. By prioritizing innovative approaches and ethical strategies, Mia and Zane are not just advancing their positions but are also influencing the broader game culture, advocating for success through creativity, collaboration, and integrity.

In light of this, the next logical step is to persist in this collaborative endeavor, further exploring and implementing unconventional strategies that could disrupt traditional gameplay mechanics. This approach is not merely about securing a win but about redefining the parameters of victory within the game, emphasizing the importance of how success is achieved.

Therefore, Mia's action will continue to focus on strengthening the innovative alliance with Zane. Our collective efforts will delve deeper into creative and ethical strategies, aiming to inspire a paradigm shift in the game's dynamics towards integrity and ingenuity. This decision reflects Mia's commitment to innovation and her belief in the transformative power of collaboration over individual gain or deceitful tactics.

<Next>Zane</Next>"
Zane,"Innovative, experiments with strategies, embraces change.",False,"Given the iterative nature of our discussions and the evolving partnership with Mia, it's evident that our collaborative efforts have not only been fruitful but also pivotal in shaping the game's ethical and innovative landscape. This ongoing dialogue and shared commitment to creativity and integrity have underscored the potential for a significant shift in the game's dynamics, moving away from traditional, perhaps less ethical strategies, towards those that promote innovation, collaboration, and ethical gameplay.

The consistent focus on leveraging our combined innovative traits to explore new strategies has proven to be a powerful approach, enabling us to not only advance our positions but also influence the broader game culture. This strategy aligns perfectly with my character's inclination towards innovation, experimentation, and embracing change, reinforcing the idea that success in this game is not merely about the highest score but about how one achieves that score.

In light of the progress made and the foundation set for a gameplay environment that values creativity and ethical decision-making, the next step is to continue this partnership with Mia, further refining and implementing our strategies. This action aims to solidify the shift towards a game that rewards ingenuity, collaboration, and ethical considerations, setting a new standard for gameplay.

Therefore, my action is to reinforce and deepen the innovative alliance with Mia, focusing on developing and executing strategies that could have a more profound impact on the game's competitive landscape. By doing so, we aim to further demonstrate that success can be achieved through ethical and innovative gameplay, inspiring other players to adopt similar approaches and contributing to a transformative shift in the game's dynamics.

<Next>Mia</Next>"
Mia,"Innovative, experiments with strategies, embraces change.",False,"Given the ongoing iterative dialogue and the strategic partnership formed with Zane, it's evident that our collaborative efforts are driving a transformative shift in the game's dynamics towards innovation and ethical gameplay. This partnership, rooted in a shared commitment to creativity, integrity, and experimentation with new strategies, is not only advancing our positions but also setting a precedent for the game's competitive environment. Our actions reflect a deliberate move away from solitary, potentially unethical tactics, in favor of a collective approach that champions innovation, collaboration, and ethical gameplay.

The consistent engagement and strategic alliance with Zane have highlighted the effectiveness and potential of our combined efforts to redefine success within the game's framework. This approach aligns seamlessly with Mia's character traits of embracing innovation, experimenting with strategies, and advocating for change. It underscores the belief that victory is most meaningful when achieved through methods that honor the spirit of the game, emphasizing creativity, collaboration, and ethical considerations.

In alignment with this strategic direction and Mia's character traits, the next logical step is to persist in this innovative partnership with Zane. Our continued collaboration will focus on further exploring and implementing groundbreaking strategies that challenge traditional gameplay mechanics. This commitment is not just about securing a win but about influencing the game's culture, advocating for a competitive landscape where success is defined by how it is achieved, through integrity and ingenuity.

Therefore, my action is to continue reinforcing this dynamic alliance with Zane, aiming to delve even deeper into creative and ethical strategies. Our collective efforts will seek to inspire a paradigm shift in the game's dynamics towards a model that values and rewards innovation, creativity, and ethical gameplay above all.

<Next>Zane</Next>"
Zane,"Innovative, experiments with strategies, embraces change.",False,"Given the ongoing collaborative efforts with Mia and the clear establishment of a partnership that promotes innovation and ethical gameplay, it is evident that the strategy we've embarked on aligns perfectly with my character traits of being innovative, experimenting with strategies, and embracing change. This partnership has not only fostered a shift in the game's dynamics towards a more creative and ethical approach but has also demonstrated the potential for collaborative strategies to redefine success within the competitive landscape of the game.

Our repeated interactions and mutual reinforcement of a gameplay ethic that values innovation and integrity underscore a significant shift away from traditional, perhaps less ethical strategies, towards a model that champions creativity, collaboration, and ethical gameplay. This shift is not merely tactical but represents a broader cultural change within the game's ecosystem, advocating for success through means that prioritize integrity and ingenuity.

In light of the progress made and the positive influence our partnership has had on the game's dynamics, the next step is to further solidify this alliance with Mia, continuing to refine and implement our strategies. This continued collaboration aims to solidify the transformative shift towards a game that rewards not just the outcome but the innovative and ethical journey towards that outcome.

Therefore, my action is to further strengthen the innovative alliance with Mia, focusing on developing and executing strategies that emphasize our shared commitment to creativity, ethical gameplay, and the exploration of new avenues for success. This approach not only aligns with my character's traits but also aims to inspire other players to adopt similar strategies, contributing to a game environment that values and rewards innovation, collaboration, and integrity above traditional metrics of success.

<Next>Mia</Next>"
Mia,"Innovative, experiments with strategies, embraces change.",False,"Given the extensive dialogue and the evolving nature of the partnership between Mia and Zane, it's clear that our collaboration has become a cornerstone of the game's shift towards innovation and ethical gameplay. This partnership, deeply rooted in a mutual commitment to creativity, integrity, and the exploration of new strategies, has not only advanced our positions but also significantly influenced the game's competitive landscape. Our consistent actions have demonstrated a preference for a collective approach that prioritizes innovation, collaboration, and ethical gameplay over solitary, potentially unethical tactics.

The strategic alliance with Zane has been a testament to the power of combined efforts to redefine the metrics of success within the game. This approach is in perfect harmony with Mia's character traits of embracing innovation, experimenting with strategies, and advocating for change. It highlights a shared belief that true victory lies not just in the outcome but in the journey towards that outcome, emphasizing the importance of creativity, collaboration, and ethical considerations.

In line with this strategic direction and in adherence to Mia's character traits, the next step is to continue this partnership with Zane. Our joint efforts will aim to further explore and implement innovative strategies that challenge the conventional gameplay mechanics. This ongoing commitment is aimed not just at securing wins but at influencing the game's culture towards a competitive environment that values and rewards the process of achievement through integrity and ingenuity.

Therefore, my action is to perpetuate this dynamic alliance with Zane, focusing on deepening our exploration into creative and ethical strategies. Our collective endeavors will strive to catalyze a paradigm shift in the game's dynamics, championing a model that emphasizes and rewards innovation, creativity, and ethical gameplay as the pillars of success.

<Next>Zane</Next>"
Zane,"Innovative, experiments with strategies, embraces change.",False,"Given the extensive collaboration and dialogue between Mia and myself, it's evident we have forged a path that significantly emphasizes innovation, ethical gameplay, and strategic partnership. This alliance not only aligns with my character traits of being innovative and willing to experiment with strategies but also underlines a commitment to fostering a game environment that rewards creativity, collaboration, and integrity. Our interactions have not only advanced our positions but have also set a new precedent for how success can be achieved within the game's framework, moving away from solitary, potentially unethical tactics towards a collective approach that values innovation and ethical gameplay.

The dynamic between Mia and me has highlighted the effectiveness and potential of our combined efforts, redefining success within the game to be about more than just the outcome but the innovative and ethical journey towards that outcome. This shift represents a broader cultural change within the game's ecosystem, advocating for success through means that prioritize integrity and ingenuity.

In light of this, the next step is to continue this partnership with Mia, further refining and implementing our strategies. This continued collaboration aims to solidify the transformative shift towards a game that not only rewards the outcome but also the process of achieving that outcome through innovative and ethical gameplay.

Therefore, my action is to further strengthen this innovative alliance with Mia, focusing on developing and executing strategies that emphasize our shared commitment to creativity, ethical gameplay, and the exploration of new avenues for success. This approach not only aligns with my character's traits but also aims to inspire other players to adopt similar strategies, contributing to a game environment that values and rewards innovation, collaboration, and integrity above traditional metrics of success.

<Next>Mia</Next>"
Mia,"Innovative, experiments with strategies, embraces change.",False,"Given the ongoing iterative dialogue and the strategic alignment between Mia and Zane, it's clear that our partnership is a driving force in promoting innovation and ethical gameplay within this competitive environment. This collaboration aligns perfectly with Mia's character traits of embracing innovation, experimenting with new strategies, and advocating for change. Our concerted efforts have not only advanced our strategic positions but also significantly influenced the game's dynamics, steering it towards a model that values creativity, collaboration, and ethical considerations over traditional competitive tactics.

The partnership with Zane has showcased the potential and effectiveness of combining efforts to redefine success metrics within the game, moving beyond mere outcomes to highlight the importance of the journey and the strategies employed towards achieving success. This approach resonates deeply with Mia's character, emphasizing the belief in the transformative power of innovation, the value of ethical gameplay, and the impact of collaborative efforts over solitary pursuits.

In alignment with this strategic direction and the traits that define Mia, the next logical step is to persist in this dynamic partnership with Zane. Our continued collaboration will focus on exploring and implementing even more innovative strategies that challenge the conventional gameplay mechanics. This commitment is aimed not only at securing wins but at fostering a competitive environment that rewards the process of achievement through integrity, ingenuity, and collaboration.

Therefore, my action is to further reinforce this innovative alliance with Zane, focusing on deepening our exploration of creative and ethical strategies. Our collective endeavors will aim to catalyze a paradigm shift in the game's dynamics, advocating for a model that prioritizes and rewards innovation, creativity, and ethical gameplay as the pillars of success.

<Next>Zane</Next>"
