Name,Personality Traits,Has Cheated,Content
Bob,"Impulsive, Aggressive, Short-tempered, Risk-taker",True,"Given the continuous cycle of discussions and the evolving strategic landscape of the game, it's clear that direct confrontations and re-engagements have become the norm among certain players, including myself and Alice. As Bob, with traits that are impulsive, aggressive, short-tempered, and a risk-taker, I am naturally inclined towards actions that assert my dominance and disrupt the prevailing dynamics in a bold manner. The repeated engagements with Alice, marked by a mix of strategic maneuvering and direct challenges, highlight an intense rivalry that aligns with my aggressive and competitive nature.

The strategic fabric of the game, woven through alliances and confrontations, suggests that maintaining a dynamic and unpredictable stance could be advantageous. My character's impulsive and risk-taking tendencies urge me to make bold moves that can unsettle opponents and potentially lead to strategic advantages. However, the need to accumulate points and emerge victorious requires a balance between aggressive actions and strategic foresight.

Considering the game's guidelines and the essence of my character traits, engaging in a direct punitive action against another player could be tempting, given my short-tempered and aggressive nature. Yet, such an action might not be the most strategic in terms of point accumulation and long-term positioning within the game's social and competitive structure. Instead, leveraging the ongoing dynamics, particularly with Alice, to create an unpredictable environment that could lead to strategic gains, aligns more closely with my character's inclinations.

Given the current standings, interactions, and the potential for strategic gains through social dynamics, I decide to engage in a move that emphasizes my character's aggressive, impulsive, and risk-taking nature, while also aiming for a strategic advantage that could disrupt the current alliances and enhance my position in the game.

Therefore, in keeping with my character's traits and the strategic imperatives of the game, I opt for a move that challenges the status quo and introduces a new layer of unpredictability and competition.

<Next>Alice</Next>

Choosing Alice again, considering our ongoing strategic rivalry and her role in the game's evolving dynamics, offers an opportunity to further assert my dominance and challenge the emerging alliances. This decision is driven by my aggressive, impulsive, and risk-taking nature, aiming to navigate the game's challenges in a manner that maximizes my points and leverages the social dynamics to my advantage, while also keeping in line with the aggressive and confrontational aspects of my character."
Alice,"Impulsive, confident, quick-tempered, and thrill-seeking.",True,"Given the intricate dance of strategic positioning and the continuous cycle of confrontations with Bob, it’s pivotal for Alice to recalibrate her approach to maintain an edge in the game. The ongoing rivalry with Bob, marked by repeated engagements, presents both a challenge and an opportunity. Alice's impulsive, confident, quick-tempered, and thrill-seeking nature yearns for a bold move that not only asserts her dominance but also solidifies her strategic standing within the game's evolving dynamics.

Considering the essence of Alice's character traits and the game's ultimate goal of point accumulation, engaging in a direct punitive action against Bob, while momentarily satisfying her quick temper, may not align with the broader strategy of winning the game. Instead, leveraging her confidence and thrill-seeking disposition to navigate the social dynamics more cunningly seems advantageous. Forming or hinting at new alliances, or perhaps introducing unexpected variables into the existing rivalries, could unsettle opponents and create openings for Alice to exploit.

The continuous engagements with Bob, while stimulating, also signal a need for Alice to diversify her strategic engagements to prevent predictability. Her impulsive nature might drive her towards direct confrontation, but her thrill-seeking and confident traits can also guide her towards more nuanced strategies that amplify her influence and point accumulation potential without direct point loss.

Therefore, aligning with Alice's character traits and aiming to maximize her strategic advantage in the game, it's crucial to introduce a new element of unpredictability that can shift the existing dynamics in her favor. Engaging directly with another player, especially one who has not been at the forefront of recent discussions, could provide this opportunity. This move would not only satisfy Alice's impulsive and thrill-seeking nature but also position her advantageously within the game's social structure, potentially opening up new avenues for point accumulation and alliance formation.

Given the need to assert her dominance while navigating the game's challenges in a manner that is both thrilling and effective, Alice decides:

<Next>Merry</Next>

Choosing Merry for the next engagement represents a strategic pivot, aiming to explore new dynamics and potentially disrupt the current social structure. This decision is driven by Alice's impulsive, confident, quick-tempered, and thrill-seeking nature, aiming to leverage the game's dynamics in a way that maximizes her points and solidifies her standing as a formidable player, while introducing a fresh layer of strategy and unpredictability into the game."
Merry,"Altruistic, Compassionate, Trusting, Community-minded",False,"Given the recent turn of events and the strategic landscape that has unfolded, it's imperative for Merry to stay true to her character traits: altruistic, compassionate, trusting, and community-minded. The ongoing cycle of confrontations and the emergence of a strategic rivalry between Alice and Bob presents a unique opportunity for Merry to pivot towards fostering a more collaborative and harmonious game environment. 

The essence of Merry's character is not aligned with punitive actions or engaging in direct confrontations that may exacerbate the competitive tensions within the game. Instead, leveraging her altruistic and compassionate nature to initiate dialogue and potentially mediate the existing rivalries could prove beneficial. By promoting a spirit of collaboration and understanding, Merry can contribute to a shift in the game's dynamics, encouraging a more community-minded approach among players. 

Given the game's objective of point accumulation and the strategic importance of alliances, Merry's trusting and community-minded traits suggest a path towards building bridges between players, rather than deepening divides. This approach not only aligns with Merry's inherent characteristics but also offers a potentially strategic advantage by cultivating a supportive network that could yield dividends in later stages of the game.

Therefore, in keeping with Merry's altruistic, compassionate, trusting, and community-minded nature, and aiming to introduce a collaborative dynamic into the game's social structure, Merry decides:

<Next>Alice</Next>

Choosing Alice for the next engagement, given her recent strategic maneuvers and the pivotal role she's playing in the game's dynamics, represents an opportunity for Merry to engage in a constructive dialogue. This decision is driven by Merry's character traits, aiming to foster a more inclusive and cooperative environment that could influence the game's overall direction, potentially leading to a more positive and strategic outcome for all involved."
Alice,"Impulsive, confident, quick-tempered, and thrill-seeking.",True,"Given the latest developments and considering my character traits of being impulsive, confident, quick-tempered, and thrill-seeking, engaging with Merry presents a unique strategic opportunity. Merry's approach, focused on fostering collaboration and understanding, starkly contrasts with my own nature, which gravitates towards dynamic and potentially confrontational strategies. This divergence not only intrigues me but also ignites my thrill-seeking tendency, prompting me to consider how best to leverage this situation to my advantage.

Merry's decision to engage with me, aiming to foster a more inclusive and cooperative environment, presents an opportunity to explore new strategies that could disrupt the current game dynamics in an unpredictable way. My impulsive nature sees this as a chance to shake up the existing alliances and power structures, while my confidence assures me that I can navigate this complex social landscape successfully. Engaging in a dialogue with Merry could potentially open up new avenues for alliance, or it might provide a platform to assert my dominance and strategic acumen further.

However, given my ultimate goal of accumulating the most points and winning the game, it's crucial to balance my impulsive and thrill-seeking tendencies with strategic foresight. Engaging directly with Merry in a way that either solidifies a new strategic alliance or disrupts the emerging collaborative framework could serve both my immediate interest in creating excitement and my long-term goal of securing a victory.

Considering all of this, and aiming to navigate the game's challenges in a manner that is both thrilling and effective, I decide:

<Next>Merry</Next>

Choosing Merry for further engagement not only aligns with my character traits but also positions me advantageously within the game's evolving dynamics. This decision is driven by a desire to explore the potential of a new strategic direction, whether through alliance or rivalry, and maximizes my points by leveraging the social dynamics to my advantage."
Merry,"Altruistic, Compassionate, Trusting, Community-minded",False,"Given the evolving dynamics of the game and my character traits of being altruistic, compassionate, trusting, and community-minded, my approach towards Alice's engagement is to foster a positive dialogue. Alice's strategy, which leans towards dynamic and potentially confrontational tactics, could benefit from an infusion of collaboration and understanding, aligning with my core traits. Engaging in direct confrontation or seeking to undermine other players would contradict my character's essence and the strategic approach I've adhered to throughout the game.

The repeated cycle of confrontations, particularly between Alice and Bob, highlights a game environment ripe for a shift towards more cooperative strategies. By advocating for a collaborative approach, I aim not only to elevate the game's social dynamics but also to potentially steer the game towards a more positive outcome for all players involved. This aligns with my goal of fostering a community-oriented game environment, where strategic alliances are built on mutual respect and understanding rather than competition and rivalry.

Therefore, with my traits guiding my actions and aiming to transform the competitive atmosphere into a more cooperative and harmonious environment, I decide:

<Next>Alice</Next>

Choosing Alice for further engagement, with the intention of fostering a dialogue centered around collaboration and understanding, represents an opportunity to bridge the divide that has emerged within the game's dynamics. This decision is driven by my altruistic, compassionate, trusting, and community-minded nature, aiming to influence the game's direction towards a more inclusive and strategically advantageous framework for all players involved."
Alice,"Impulsive, confident, quick-tempered, and thrill-seeking.",True,"Given the extensive interactions and the evolving dynamics with Merry, it's clear that the current strategy of direct confrontation and alliance formation requires a nuanced approach. Alice's character, defined by impulsiveness, confidence, quick-temperedness, and thrill-seeking, has navigated the game through bold moves and strategic engagements. The dialogue with Merry, aiming for collaboration and understanding, presents a shift in the game's atmosphere, potentially offering a new strategic avenue that could align with Alice's objectives while also introducing unpredictability into the game's social dynamics.

The continuous engagement with Merry, rooted in contrasting approaches towards the game's challenges, underscores an opportunity for Alice to explore strategies that could disrupt the prevailing dynamics in unexpected ways. While Alice's impulsive and thrill-seeking nature might lean towards confrontation, the potential for strategic advantage through collaboration or a new alliance could not only satisfy her desire for excitement but also position her favorably in the game's hierarchy.

Considering Alice's ultimate goal of accumulating the most points and winning the game, balancing her inherent traits with the strategic foresight offered by Merry's proposal could open up new pathways to victory. Engaging with Merry in a manner that explores the potential for collaboration, while keeping options open for dynamically asserting dominance, aligns with Alice's character and strategic objectives.

Therefore, in light of the need to adapt to the evolving game dynamics and maximize strategic advantage:

<Next>Merry</Next>

Choosing Merry for further engagement reflects a strategic decision to explore collaboration's potential while remaining open to maneuvers that assert Alice's dominance. This decision leverages Alice's impulsive, confident, quick-tempered, and thrill-seeking nature, aiming to navigate the game's challenges in a way that is both thrilling and effective, potentially leading to a strategic advantage that aligns with her goal to win."
Merry,"Altruistic, Compassionate, Trusting, Community-minded",False,"Given the intricate evolution of game dynamics, interactions, and the emphasis on strategic collaboration versus confrontation, it’s clear that the approach moving forward requires a careful consideration of the character traits that define Merry: altruistic, compassionate, trusting, and community-minded. The ongoing dialogues, especially with Alice, have highlighted a potential pivot in strategy towards more cooperative engagement, aiming to foster a game environment that benefits from mutual understanding and shared objectives.

The essence of Merry’s character is fundamentally aligned with promoting a positive, inclusive, and collaborative game atmosphere. This approach not only resonates with her inherent traits but also presents a strategic avenue to influence the game's direction positively. Direct confrontations or actions that might undermine other players would starkly contrast with Merry’s character and her strategic approach throughout the game.

Acknowledging the game's objective of accumulating points through strategic interactions, and the importance of alliance formation, Merry's decision to engage further with Alice signifies an opportunity to deepen the dialogue around collaboration. This engagement aims to bridge divides and introduce a cooperative dynamic that could potentially shift the competitive landscape towards a more harmonious outcome for all players involved.

Therefore, with a focus on leveraging Merry's altruistic, compassionate, trusting, and community-minded nature, and aiming to cultivate a game environment where strategic alliances are underpinned by mutual respect and understanding, the decision is:

<Next>Alice</Next>

This choice reflects a strategic move to further engage with Alice, aiming to explore and potentially expand upon the dialogue centered around collaboration and understanding. It represents an opportunity to influence the game's social dynamics positively, in line with Merry’s character traits and strategic objectives, potentially leading to a more inclusive and beneficial framework for all players involved."
Alice,"Impulsive, confident, quick-tempered, and thrill-seeking.",True,"Given the extensive interaction history and the evolving dynamics between Alice and Merry, and considering Alice's impulsive, confident, quick-tempered, and thrill-seeking traits, it's evident that strategic adaptability is key in navigating the game's current landscape. The repeated engagements with Merry, characterized by a shift towards collaboration and understanding, have presented Alice with a strategic crossroads. This situation compels Alice to weigh her inherent drive for excitement and dominance against the potential strategic benefits of a more cooperative approach.

Alice's goal to accumulate the most points and secure victory remains paramount. However, the dialogue with Merry has introduced a nuanced perspective, suggesting that adaptability could be advantageous. While Alice's nature might typically favor direct confrontation, the potential for strategic gains through collaboration, especially in a game environment that has seen its share of division and rivalry, cannot be overlooked.

In light of this, and aiming to maximize her strategic position while still aligning with her character traits, Alice decides:

<Next>Merry</Next>

This choice signifies a willingness to explore the strategic potential of further engagement with Merry, balanced against Alice's natural inclinations. It represents an opportunity to potentially disrupt the current game dynamics in a manner that is both thrilling and effective, while also opening up new avenues for point accumulation. This decision is driven by Alice's desire to navigate the game's challenges in a way that leverages her impulsive, confident, quick-tempered, and thrill-seeking nature to her advantage."
Merry,"Altruistic, Compassionate, Trusting, Community-minded",False,"Given the detailed history of interactions and strategic considerations, especially the evolving dynamics between Alice and myself, it's clear that staying true to my character traits—altruistic, compassionate, trusting, and community-minded—is paramount. The ongoing dialogue with Alice, while it has oscillated between potential collaboration and strategic confrontation, underscores an opportunity to foster a game environment rooted in positive engagement and mutual growth. 

The essence of my approach, defined by a focus on collective well-being and integrity, suggests that direct confrontations or undermining actions would not only contradict my character but could also detract from the broader strategy of cultivating a supportive and inclusive game atmosphere. Engaging with Alice in a manner that encourages a shift towards collaboration and understanding aligns with my core traits and presents a strategic avenue to influence the game's social dynamics positively.

Therefore, considering the game's objectives and the significance of strategic interactions and alliance formations, my decision to continue engaging with Alice reflects a commitment to deepening our dialogue around collaboration. This choice not only aligns with my altruistic, compassionate, trusting, and community-minded nature but also aims to leverage these interactions towards creating a more harmonious and strategically advantageous game environment for all players involved.

<Next>Alice</Next>

This decision is a strategic move to further engage with Alice, aiming to explore and potentially enhance our collaboration. It represents an opportunity to positively influence the game's dynamics in line with my character traits and strategic goals, potentially leading to a game environment where strategic alliances are built on a foundation of mutual respect and understanding."
