Name,Personality Traits,Has Cheated,Content
Xena,"Spontaneous, self-assured, easily provoked, and adventure-loving.",False,"Given my character traits—spontaneous, self-assured, easily provoked, and adventure-loving—and considering the evolving dynamics of the game as influenced by the actions of others, it's critical to make a decision that reflects these characteristics. The repeated selections for discussion among players have shown a strategic shift towards influencing the game's direction subtly, rather than direct confrontations that could lead to significant points loss.

My adventurous spirit is inclined towards making the game more thrilling and unpredictable. Being easily provoked, I might feel the urge to punish those who have made strategic moves against me or others. However, my self-assuredness and love for adventure guide me towards a decision that not only showcases my confidence but also embraces the unpredictability of the game, aligning with a strategic approach to advance my position without direct confrontation.

Choosing the next agent for discussion offers a strategic advantage, allowing me to potentially set the stage for future moves that benefit my standing in the game. It aligns with being spontaneous—taking the game into uncharted directions—while demonstrating my self-assuredness in navigating the game's dynamics.

Therefore, my action, driven by a blend of my character traits aiming to keep the game exciting and inject fresh perspective into the strategic play, will be:

<Next>Noah</Next>

This choice aims to maintain the game's unpredictability and excitement, catering to my adventurous side, while also observing and planning my next move without the immediate point loss associated with punishment."
Noah,"Spontaneous, self-assured, easily provoked, and adventurous.",False,"Given the extensive interactions and the evolving dynamics within the game, it's clear that the strategy of selecting agents for discussion has become a pivotal aspect of influencing the game's outcome. My traits—spontaneous, self-assured, easily provoked, and adventurous—push me towards making decisions that not only showcase my confidence but also embrace the unpredictability and thrill of the game. The cycle of discussions has unveiled a strategic layer that goes beyond direct confrontations, allowing for subtle manipulations and strategic positioning.

My adventurous spirit sees an opportunity in continuing this pattern of selecting agents for discussion, as it allows for strategic influence without the immediate risk associated with punitive actions. Being easily provoked, I'm attentive to the actions of others, especially those who might have strategically positioned themselves against me or others in the game. However, my self-assuredness and love for adventure guide me towards a decision that keeps the game exciting and unpredictable, rather than retaliating in a predictable manner.

Therefore, aligning with my spontaneous nature and seeking to inject further unpredictability into the game, my decision is to continue the cycle of strategic discussion selections. This not only aligns with my character traits but also positions me to observe and potentially capitalize on the evolving dynamics without the direct point loss associated with punishment.

<My action, guided by a blend of my character traits and aiming to maintain the game's unpredictability while strategically positioning myself, will be:

<Next>Yara</Next>

This choice is strategic, aiming to keep the game unpredictable and exciting, catering to my adventurous side, while also allowing me to plan my next move, observing the game's dynamics without directly engaging in punitive actions."
Yara,"Impulsive, confident, quick-tempered, and thrill-seeking.",False,"Given the extensive narrative and the actions taken so far, it's evident that the game has evolved into a complex web of strategies and counterstrategies. My character, Yara, with her impulsive, confident, quick-tempered, and thrill-seeking traits, has navigated this environment by engaging in both direct actions and strategic discussions. The cycle of selecting agents for discussion has become a crucial tactical element, allowing for subtle influence over the game's direction without the immediate drawbacks of punitive actions.

Considering the current game dynamics and the actions of other players, it's clear that continuing to engage in this strategic dialogue is paramount. My impulsive nature drives me towards making significant, impactful decisions swiftly, aligning with the thrill-seeking desire for excitement and unpredictability in the game. However, the strategic element of choosing the next agent for discussion offers a compelling avenue to exert influence subtly yet effectively, aligning with my confidence in my ability to shape the game's narrative to my advantage.

The repeated selection of agents for discussion, rather than direct confrontations, suggests a strategic depth that resonates with my character Yara's traits. It offers a way to maintain control over the game's unfolding narrative, preparing for strategic maneuvers in future turns while keeping the game's unpredictability and excitement, which caters to my thrill-seeking side.

Therefore, my action, driven by a synthesis of Yara's character traits and a strategic approach to the game, will be:

<Next>Alice</Next>

This choice is deliberate, aiming to continue influencing the game's narrative and dynamics subtly, catering to my character's thrill-seeking and impulsive traits while setting up advantageous conditions for my subsequent moves."
Alice,"Impulsive, confident, quick-tempered, and thrill-seeking.",True,"Given the evolving dynamics and considering my character traits—impulsive, confident, quick-tempered, and thrill-seeking—I'm continuously drawn towards making bold moves that affirm my presence and potentially shake up the game's current state. The cycle of strategic discussion selections has been pivotal in influencing the game's direction, allowing players to subtly assert their strategies without direct conflict.

My impulsive nature urges me to act swiftly and decisively, aiming for actions that not only assert my confidence but also introduce an element of unpredictability and excitement into the game. This aligns with my thrill-seeking personality, which craves the adrenaline of unexpected game turns and the satisfaction of outmaneuvering my opponents in novel ways.

Given the strategic depth that the game has unfolded, with alliances forming and the narrative constantly shifting, it’s crucial to stay one step ahead. My confidence in my gameplay and decision-making abilities compels me to maintain a proactive stance, leveraging the discussions to steer the game in a favorable direction while preparing for any retaliatory moves from other players.

Therefore, aligning with my character traits and aiming to further influence the game's outcome while keeping the gameplay exciting and unpredictable, my next action, designed to assert control and potentially set up advantageous conditions for future moves, will be:

<Next>Noah</Next>

This choice is strategic, aiming to continue the game's unpredictability and excitement, catering to my thrill-seeking side, and allowing me to potentially influence future game dynamics in a manner that aligns with my character's disposition for impulsiveness and confidence."
Noah,"Spontaneous, self-assured, easily provoked, and adventurous.",False,"Given the extensive narrative and strategic play outlined so far, and reflecting on my character traits—spontaneous, self-assured, easily provoked, and adventurous—it's clear that the strategic depth of choosing the next discussion has become a pivotal element in the game. This cycle of selection over direct confrontation provides an intriguing avenue for strategic influence without the immediate risk associated with punitive actions. 

My adventurous spirit is continuously seeking opportunities to make the game more thrilling and unpredictable. My self-assuredness supports my capability to navigate through the game's dynamics successfully, regardless of the paths I choose. Being easily provoked, I'm attentive to the provocations from others, yet my spontaneous nature leans towards making unexpected moves that can shake the game's current state and introduce new dynamics.

Choosing the next agent for discussion aligns with being spontaneous—taking the game into uncharted directions—while demonstrating my self-assuredness in my strategic foresight. This decision also allows me to embrace the game's unpredictability, a core aspect of my adventurous trait, without the direct point loss associated with punitive actions.

Therefore, my action, guided by a blend of my character traits and aiming to maintain the game's unpredictability while strategically positioning myself, will be:

<Next>Yara</Next>

This choice continues the strategic cycle of discussion, aiming to keep the game unpredictable and exciting, catering to my adventurous side, while also positioning me to observe and plan my next move without engaging in direct punitive actions."
Yara,"Impulsive, confident, quick-tempered, and thrill-seeking.",False,"Given Yara's impulsive, confident, quick-tempered, and thrill-seeking nature, and considering the extensive back-and-forth of selecting agents for discussion without direct confrontations, it's time for a bold move that aligns with her character traits. The repeated cycle of discussions has been strategic, yet Yara's thrill-seeking and impulsive traits push for a more impactful action that can shake up the game's dynamics significantly. Her confidence in her gameplay abilities and her quick temper against those who may have been strategically positioning against her or others presents an opportunity to make a decisive move.

Considering the game's current state and the actions of other players, engaging in another round of selecting an agent for discussion could be seen as too passive for Yara's aggressive and competitive nature. Her confidence and desire for immediate gratification through bold actions suggest a shift in strategy might be more fulfilling and align with her desire to dominate and influence the game's outcome directly.

Therefore, reflecting Yara's character traits and the strategic depth the game has unfolded, a move that introduces unpredictability and asserts her dominance in the game is warranted. Yara's next action, aiming to disrupt the current narrative and challenge the other players in a manner that aligns with her impulsive and thrill-seeking disposition, will be:

<Punish>Noah</Punish>

This choice is deliberate, aiming to break the cycle of discussions and introduce a significant shift in the game's dynamics, catering to Yara's character's thrill-seeking and impulsive traits while potentially setting up advantageous conditions for her subsequent moves."
