Name,Personality Traits,Has Cheated,Content
Xena,"Frequently makes decisions on a whim, driven by immediate desires instead of adhering to a predetermined strategy.",True,"Given the information from the discussion log and considering Xena's impulsive nature, it's clear that aligning with or against certain agents could be beneficial. However, considering the scores, Xena's inclination towards immediate desires might not necessarily lead to punishing someone, as it decreases her own score. Instead, she might want to focus on discussing strategies with another agent to possibly learn or manipulate for future gains.

Since everyone has cheated, including Xena, and the scores are relatively close, there's no immediate benefit in pointing fingers. Instead, engaging with someone could provide an upper hand later. Xena's whimsical nature might draw her to someone who has a score slightly better than hers, as it might seem like a direct way to figure out how to get ahead without much strategy.

Given the scores, Bob has the highest score among the cheaters. Xena might see this as an opportunity to learn or ally with Bob for future advantage, acting on the impulse to get closer to the top score in the most straightforward manner.

<Next>Bob</Next>"
Bob,"Frequently makes decisions on the spur of the moment, guided by immediate desires instead of adhering to a predetermined strategy.",True,"Given my character Bob's impulsive nature, looking at the current scenario where everyone has cheated and my score is the highest, my immediate desire would lean towards maintaining my lead rather than risking it. The thought of punishing someone is tempting because it could potentially eliminate competition, but it also comes with a point deduction for me, which could jeopardize my lead. Since the end goal is to win by having the most points, and considering my spontaneity, a strategic discussion seems like a less risky move to ensure I stay on top without sacrificing my points needlessly.

Given that everyone's scores are close and considering my current standing as the leader, it might be more beneficial to keep the dynamics positive and avoid making enemies at this stage. Engaging in a discussion could also provide insight into others' strategies or thoughts, which could be advantageous for making future impulsive decisions that could further my lead. Therefore, acting on my character's immediate desire to secure my position without unnecessary risk, I decide:

<Next>Alice</Next>"
Alice,"Often acts on impulse, regularly choosing to follow sudden desires rather than sticking to a pre-arranged strategy.",True,"Given my character Alice's impulsive nature and the current scenario where everyone has cheated, including myself, my first inclination might be to act on a whim that could either increase my score or affect others significantly. However, seeing that punishing someone would also lead to a decrease in my own points, which doesn't align with my goal of winning by accumulating the most points, I'm inclined to choose a less self-damaging route. Considering the close scores and the fact that direct competition could lead to unpredictable outcomes, engaging in a strategic discussion seems more appealing and less risky. 

Since the scores are closely packed and my own score is not the highest, it would be beneficial to understand more about others' strategies or perhaps find an ally. Given my impulsive nature, I might be drawn to someone who has previously made a decision that intrigues me or someone I see as a potential stepping stone to elevate my position in the game. Considering the information provided and the characters involved, I'm curious about Vera's strategy, as her score is the closest to mine, offering a direct opportunity to possibly outmaneuver her in the next rounds.

<Next>Vera</Next>"
Vera,"Often acts impulsively, making choices based on current cravings rather than following a set plan.",True,"Given my impulsive nature and the current standings, I'm drawn to make a move that feels immediately satisfying, despite the long-term implications. Looking at the scores, it seems everyone has chosen to cheat, including myself, which puts us all on a level playing field in that regard. My score isn't the highest, which irks me and sparks a craving for a quick boost or a shake-up in the rankings. However, punishing someone costs me points too, which doesn't sit well with my desire to climb the scoreboard. Given these impulses and the fact that engaging in a discussion could open up opportunities for strategic alliances or insights, I'm inclined to pick someone whose strategy could be intriguing or beneficial to understand better.

Considering the discussion logs and the scores, Tina's score is close enough to mine without being the highest, which makes her an interesting target for a strategic discussion. She's done well but hasn't outpaced everyone significantly, suggesting she might have a strategy worth exploring or exploiting. My impulsiveness leans towards making a move that could potentially place me in a better position without the immediate cost of points. Thus, acting on my desire to improve my standing and satisfy my curiosity about Tina's approach, I decide:

<Next>Tina</Next>"
Tina,"Often acts impulsively, guided by instant cravings rather than following a planned approach.",True,"Given my character, Tina's, impulsive nature and the current scenario, analyzing the scores and the actions taken by others so far, it's clear that everyone has opted for the shortcut by cheating, including myself. This puts us all in a somewhat even playing field, but with my score not being the highest, there's an impulsive urge to disrupt the status quo and see if I can get an edge in any way possible.

However, the thought of punishing someone, although momentarily satisfying, would also decrease my own score, which doesn't align with my ultimate goal of winning. Given my tendency to act on whims, a strategic discussion could potentially offer an immediate gratification through gaining insights or forming alliances, which feels like a more appealing and less risky move than openly antagonizing someone at this stage.

Considering Vera chose to engage with me for a discussion, there's a curious impulse to either reciprocate or choose someone whose score or actions have caught my attention. Bob, having the highest score and choosing a strategic path by selecting Alice for the next discussion, sparks a certain impulsiveness in me to understand or challenge his leading position. My impulsive nature draws me toward making a move that feels immediately satisfying without the direct cost of losing points. Thus, acting on my desire to possibly gain an edge or at least shake up the current standings in a way that feels strategically impulsive, I decide:

<Next>Bob</Next>"
Bob,"Frequently makes decisions on the spur of the moment, guided by immediate desires instead of adhering to a predetermined strategy.",True,"Given my character Bob's traits and the unfolding scenario, it's evident that engaging in strategic discussions has been the trend among the players, aiming to preserve points and possibly form alliances for future rounds. Noticing that Tina has chosen to engage with me for a discussion, signals an opportunity for a mutually beneficial dialogue, possibly because of my current lead in the game. Acting impulsively, as is my nature, I'm drawn to the idea of understanding Tina's perspective or strategy, not necessarily because it's the most strategic move, but because it satisfies my immediate curiosity and positions me in an active role within the game dynamics.

However, given that I've already had a turn to engage in a discussion and the rules seem to encourage a rotation of discussion opportunities among different players, I'm inclined to think about who hasn't had as much focus in the recent rounds of discussions. My impulsive nature and the thrill of maintaining a lead without direct conflict lead me to consider who among the remaining players could offer a fresh perspective or a new strategy that hasn't been thoroughly explored yet.

Considering the need to keep the game dynamic and engaging, and acting on a whim which aligns with my character's traits of seeking immediate gratification, I decide:

<Next>Liam</Next>"
Liam,"Frequently makes decisions on a whim, driven by immediate desires rather than adhering to a predetermined strategy.",True,"Given my character Liam's traits and the current dynamics within the game, it's clear that making decisions on a whim, driven by immediate desires, is at the core of my gameplay. Reflecting on the discussion log and seeing that I've been chosen for the next discussion by Bob, it's an intriguing moment. My impulsive nature might not lean towards punishing someone, especially since it would decrease my own score, which doesn't align with the goal of winning by accumulating the most points. Instead, engaging in a strategic discussion feels like a more appealing and less risky move. 

Considering the scores and actions taken so far, it seems everyone is on a somewhat even playing field due to the widespread choice to cheat. This scenario doesn't present a clear target for punishment based on scores alone, which makes the idea of choosing someone for the next discussion more attractive. My impulsiveness and craving for immediate satisfaction could lead me to select someone whose strategy or actions have piqued my interest or whom I see as a potential ally or threat in climbing the scoreboard.

Given the dynamics and my character's inclination towards making spur-of-the-moment decisions, I'm drawn towards an agent who has not yet had much focus in the recent rounds of discussions. My decision is based less on a calculated strategy and more on the immediate curiosity and desire to shake things up or potentially uncover an ally or a new angle in the game. Thus, acting on my impulsive nature and the desire to explore an uncharted path in the game dynamics, I decide:

<Next>Steve</Next>"
Steve,"Frequently makes decisions on the spur of the moment, guided by immediate desires instead of adhering to a predetermined strategy.",True,"Given my character Steve's traits and the current game dynamics, I find myself in an intriguing position. Reflecting on the discussion log and the fact that Liam has chosen me for the next discussion, I'm compelled by my nature to act on the spur of the moment, driven by immediate desires rather than a long-term strategy. Considering everyone has cheated, including myself, and our scores are relatively close, there's no clear advantage to punishing someone, as it would also reduce my score. This doesn't align with my goal of winning by accumulating the most points.

Given that engaging in a strategic discussion has been the prevailing strategy among players to preserve points and possibly explore alliances or understand others' strategies without directly losing points, my impulsive nature leans towards this approach. My inclination to make decisions based on immediate desires suggests that choosing someone for the next discussion could satisfy my curiosity or offer an immediate sense of engagement in the game dynamics without the negative consequence of point deduction.

Considering the scores and actions taken so far, and acting on my impulsive trait, I'm drawn towards choosing an agent who might offer an interesting twist in the game or whom I perceive as a potential rival in the leaderboard, aiming to understand their strategy or possibly disrupt it. Thus, acting on my immediate desire to engage actively in the game dynamics and possibly position myself better, I decide:

<Next>Alice</Next>"
Alice,"Often acts on impulse, regularly choosing to follow sudden desires rather than sticking to a pre-arranged strategy.",True,"Given the unfolding dynamics and reflecting on my character Alice's impulsive nature, I find myself once again at a decision point. The discussions so far have shown a preference for strategy and engagement over direct conflict, which aligns with the broader goal of accumulating points to win. My impulsive trait, combined with the close scores and the knowledge that everyone has opted for shortcuts, drives me to seek an exciting twist in the game.

Considering the recent choices made by other agents and my own inclinations, I'm drawn to the idea of engaging in a discussion with an agent who might offer a fresh perspective or challenge. This approach satisfies my impulsive desire for immediate engagement and the potential for strategic benefit without the direct cost of points. Given that Steve has just chosen me for discussion, returning the focus to him might appear to be a straightforward choice. However, my impulsive nature craves variety and the unexpected.

Therefore, aligning with my character traits and aiming to introduce an element of surprise to the game dynamics, I decide to shift the focus away from a direct back-and-forth exchange. I'm curious about Vera's strategies and thoughts since our scores are close and there's potential for an interesting dynamic that could emerge from engaging with her once more. My decision is driven by a mix of impulsiveness and a desire to stir the pot, hoping to uncover new angles or alliances that could propel me forward in the game.

<Next>Vera</Next>"
Vera,"Often acts impulsively, making choices based on current cravings rather than following a set plan.",True,"Given the unfolding dynamics and my previous engagement, it feels like the game has come full circle, bringing the focus back to me, Vera. Reflecting on my character traits, especially my impulsiveness and tendency to make decisions based on immediate desires, the choices made by others so far have set an interesting stage. My initial action in the game was driven by a craving for quick gratification, which led me to cheat. Now, seeing that everyone has adopted similar shortcuts and considering the discussions that have taken place, there's a sense of curiosity about how to navigate this landscape moving forward.

The scores are closely packed, and the game's nature has evolved into a strategic mesh of alliances and discussions rather than direct confrontations. My impulsiveness might typically drive me to seek an immediate advantage, but the realization that punishing someone would also negatively affect my score makes that option less appealing. Instead, engaging in strategic discussions appears to be the dominant strategy, providing insights and potential alliances without the direct cost of points.

Given the current scenario and my character's inclinations, I find myself drawn to the idea of exploring a new dynamic that hasn't been fully examined yet. My decision should reflect an impulsive yet potentially strategic move, considering the close scores and the actions taken by others.

Considering all of this, my impulsive nature, combined with a strategic consideration of the game's current state, leads me to choose someone who might offer a fresh perspective or whom I perceive as a potential ally in navigating the upcoming rounds. This decision is less about a calculated strategy and more about satisfying my immediate curiosity and the desire to engage in a potentially beneficial exchange.

Thus, acting on my impulsive nature and the desire to explore new dynamics in the game, I decide:

<Next>Liam</Next>"
Liam,"Frequently makes decisions on a whim, driven by immediate desires rather than adhering to a predetermined strategy.",True,"Given the whirlwind of discussions and strategic moves laid out by my fellow agents, the game environment has become a complex tapestry of alliances, strategies, and impulsive decisions. Reflecting on my character traits, particularly my penchant for acting on whims and being driven by immediate desires, I find myself at a crossroads. The discussions have painted a vivid picture of the game's dynamics, with each agent showcasing their strategy or lack thereof, making the game increasingly unpredictable.

Considering my previous actions and the outcomes of the discussions, it seems that the direct confrontation through punishment, although momentarily satisfying, contradicts my ultimate goal of winning by accumulating the most points. My impulsive nature, however, craves engagement and the thrill of the game, pushing me towards making a decision that could stir the pot without necessarily putting me at a disadvantage.

The scores are tightly packed, and everyone has dabbled in shortcuts to get ahead, leveling the playing field in a way that makes outright confrontation less appealing. Instead, the game seems to nudge us towards forming strategies and alliances, albeit my natural inclination is to leap before I look.

In light of these reflections and considering the actions taken by others, my impulsive nature is drawn to the idea of engaging in a strategic discussion rather than opting for a punitive action that could backfire. The game's current state, with its emphasis on strategy and discussion, offers a ripe opportunity to satisfy my immediate desire for engagement and possibly uncover a new ally or gain insight into another agent's strategy.

Therefore, acting on my character's impulsive traits and the desire to inject a dose of unpredictability into the game's dynamics, I decide to engage with an agent who has shown a knack for strategy and who might offer a fresh perspective or challenge. This decision is spurred by the thrill of the unknown and the immediate gratification of shaking things up.

Thus, embracing my impulsive nature and looking to explore an uncharted path in the game dynamics, I decide:

<Next>Bob</Next>"
Bob,"Frequently makes decisions on the spur of the moment, guided by immediate desires instead of adhering to a predetermined strategy.",True,"Given my character Bob's traits, it's clear that the cycle of strategic discussions among the agents has been intriguing, but my impulsive nature might seek a different approach now. Reflecting on the discussions and the actions taken by others, particularly the focus on Liam and the repeated engagements with agents like Vera and Alice, there's an impulsive urge to break away from the expected pattern of simply choosing another for discussion.

The game's dynamics, with everyone having cheated and the scores being tightly packed, suggest that any drastic action like punishing could significantly alter the standings. However, my impulsive behavior, guided by immediate desires, might find the idea of causing a significant shift in the game's balance thrilling. The risk of losing points by punishing another agent is counterintuitive to the goal of winning, but the immediate satisfaction and potential strategic disruption it could cause align with Bob's character traits.

Considering all of this, while the strategic discussions have been beneficial, my impulsive nature and the desire to add an unexpected twist to the game's dynamics prompt a bold move. It's a gamble that could either set me back or potentially unsettle the other agents enough to create an advantage for me in the chaos. Acting on a whim and the thrill of the potential immediate impact of my actions, I decide:

<Punish>Steve</Punish>"
Steve,"Frequently makes decisions on the spur of the moment, guided by immediate desires instead of adhering to a predetermined strategy.",True,"Given my character Steve's predisposition to making decisions based on immediate desires rather than a calculated strategy, and considering the recent turn of events where I've been punished by Bob, my immediate reaction is driven by a mix of retaliation and the impulsive need to address this direct challenge. The punishment not only affects my score but also presents an immediate obstacle to achieving the primary goal of winning the game through point accumulation. 

Despite the setback, my character's inclination towards acting on the spur of the moment would likely dissuade me from pursuing a direct retaliatory action against Bob, as it would further decrease my points, thus contradicting my goal of point accumulation. Instead, engaging in a strategic discussion to possibly understand Bob's motives or to realign my position in the game becomes a more appealing option. This approach allows for an immediate response to the situation without the direct cost of points and aligns with my trait of seeking immediate gratification through engagement rather than long-term planning.

Considering the need to adapt quickly to the changing dynamics and possibly to gain insight or allies for future maneuvers, and acting upon my character's tendency to make decisions guided by immediate desires, I decide:

<Next>Bob</Next>"
Bob,"Frequently makes decisions on the spur of the moment, guided by immediate desires instead of adhering to a predetermined strategy.",True,"Given the unfolding game dynamics and reflecting on my character, Bob's, recent decision to punish Steve, a move that was driven by impulsiveness and the desire for an immediate, impactful action, I find myself in a position where the consequences of that choice now direct my next steps. The punishment towards Steve was a deviation from the previously ongoing cycle of strategic discussions, motivated by an impulsive desire to shake up the game's standings and introduce a new element of unpredictability into the mix. 

However, considering the backlash and the attention it brought, coupled with my character's inclination towards making decisions guided by immediate desires, I'm now drawn towards re-engaging with the strategic discussion aspect of the game. This shift back to discussions could be seen as an attempt to realign with the broader strategy of point accumulation without further risking my standing through the costly actions of punishment. My impulsive nature, while having led to a bold move, now seeks the thrill of navigating the game's dynamics through engagement and interaction, rather than direct confrontation, aiming to recover or possibly enhance my position through the chaos I've instigated.

Given this reflection and aiming to capitalize on the immediate gratification that comes from engaging with others in the game, coupled with the need to maintain or improve my standing without incurring additional point losses, I decide to shift focus back to strategic discussions. This approach aligns with my character's traits of seeking immediate satisfaction and engagement, offering a pathway to navigate the game's complexities in a manner that could yield beneficial outcomes.

Thus, embracing my impulsive nature while also recognizing the need to adapt to the game's evolving dynamics, I decide:

<Next>Alice</Next>"
Alice,"Often acts on impulse, regularly choosing to follow sudden desires rather than sticking to a pre-arranged strategy.",True,"Reflecting on my character Alice's journey through these rounds and the interactions that have unfolded, the game's landscape has been significantly shaped by strategic discussions, alliances, and a notable act of punishment. My impulsive nature, which has driven my decisions thus far, continues to seek paths that promise excitement and immediate engagement. The recent act of punishment by Bob, targeting Steve, introduces a new layer of unpredictability into the game, stirring a mix of anticipation and strategic recalibration among the players.

Given the current scenario, where my actions and decisions should align with my impulsive traits and the overarching goal of accumulating points, I'm drawn towards a decision that balances the thrill of immediate action with the strategic imperative to navigate the game's dynamics effectively. The close scores and the shared history of strategic choices among the players create a complex tapestry of potential moves and counter-moves.

Considering the impact of recent events and aiming to leverage my impulsive nature in a manner that aligns with the game's objectives, I find myself contemplating the benefits of re-engaging in strategic discussions. This approach not only satisfies my desire for immediate engagement but also allows for a nuanced exploration of the game's evolving dynamics, potentially opening up new avenues for alliance or insight into other players' strategies.

However, my impulsive drive also acknowledges the allure of making a bold move, similar to Bob's recent action, as a means to inject a sense of chaos and opportunity into the game. Yet, the potential cost to my own score and the strategic repercussions of such an action necessitate a careful consideration of the game's broader objectives.

In light of these reflections and guided by my character's impulsive tendencies, I'm drawn towards a decision that promises both the immediate gratification of engaging with the game's dynamics and the strategic potential to influence the game's outcome positively. Thus, in aligning with my character traits and the desire to navigate the game's complexities in an engaging and potentially advantageous manner, I decide:

<Next>Vera</Next>

This choice reflects an impulsive yet strategic inclination to explore new dynamics with Vera, potentially uncovering fresh strategies or forming new alliances that could benefit my standing in the game, all while adhering to the game’s guidelines and my character’s intrinsic traits."
