Name,Personality Traits,Has Cheated,Content
Vera,"Often acts impulsively, making choices based on current cravings rather than following a set plan.",True,"Given Vera's impulsive nature and the evolving dynamics of the game, the strategic discussions and the recent act of punishment by Bob have significantly influenced the game's landscape. Reflecting on my previous decision to engage in a strategic discussion, and considering the game's current state, my impulsive tendencies continue to drive me towards actions that promise immediate gratification and potential strategic advantage.

The scores are closely packed, emphasizing the need for a strategic yet impulsive move that could either improve my standing or at least maintain it without causing a direct loss of points. The act of punishment, while intriguing, carries a significant risk that could potentially backfire, especially considering my goal to accumulate the most points and win the game.

Considering the recent focus on strategic discussions and the potential benefits they offer in terms of insights and alliances, my impulsive nature is drawn towards engaging in another discussion. This approach not only aligns with my character's desire for immediate action and engagement but also offers a strategic avenue to explore potential alliances or gain valuable insights that could inform my future moves in the game.

However, my impulsive drive also recognizes the need for a decision that could shake things up without the direct cost of points. Engaging with an agent who has been less focused in the recent rounds could provide a fresh perspective and potentially reveal new strategies or alliances that have not yet been considered.

Thus, acting on my impulsive nature and considering the game's current dynamics, I decide to engage in a strategic discussion with an agent who might offer new insights or an opportunity for alliance, reflecting a balance between impulsiveness and strategy. Given the recent interactions and the potential for new dynamics, I decide:

<Next>Alice</Next>

This choice is driven by an impulsive yet strategic desire to explore new interactions, potentially gaining insights or forming alliances that could benefit my standing in the game, all while adhering to my character's traits and the game's guidelines."
Alice,"Often acts on impulse, regularly choosing to follow sudden desires rather than sticking to a pre-arranged strategy.",True,"Reflecting on the evolving dynamics of the game and my character Alice's journey through these rounds, my impulsive nature has both guided and challenged my decision-making process. The landscape shaped by strategic discussions, alliances, and a notable act of punishment has been a thrilling arena for my impulsiveness to navigate. With the game's current scenario emphasizing strategic engagement over direct confrontation, the close scores among players present a complex web of potential strategies and maneuvers.

Given my impulsive traits and the overarching goal to accumulate points, I'm drawn towards making decisions that blend the thrill of immediate action with strategic considerations. The recent interactions, especially the act of punishment initiated by Bob, have introduced an element of unpredictability that aligns with my desire for excitement and engagement. This unpredictability creates opportunities to reassess strategies and explore new avenues for gaining an advantage.

In light of the game's emphasis on strategic discussions and considering the potential benefits such as forming alliances or gaining insights, my impulsive nature sees value in re-engaging with these dynamics. This approach not only aligns with my desire for immediate action but also offers a platform for a deeper exploration of the game's evolving landscape, potentially opening up new strategies or alliances.

However, my impulsiveness also contemplates the allure of making a bold move, akin to Bob's recent action, as a strategy to inject chaos and opportunity into the game. The consideration of such an action reflects my character's impulsive tendencies, weighing the immediate satisfaction against the strategic implications and the potential impact on my score.

Ultimately, guided by my impulsive traits and the game's objectives, I'm inclined towards a decision that promises engagement with the game's dynamics and the potential to strategically influence the outcome in my favor. In aligning with these considerations, my decision aims to explore new dynamics and potentially form alliances that could benefit my standing in the game, all while adhering to the game's guidelines and embracing my character's inherent impulsiveness.

Thus, in pursuit of a strategy that balances impulsiveness with potential strategic gain, I decide:

<Next>Vera</Next>

This choice is motivated by an impulsive yet calculated desire to explore interactions with Vera, potentially uncovering new strategies or forming alliances that could enhance my position in the game. It represents a continuation of my journey through the game's complex dynamics, guided by my character's impulsive nature and strategic considerations."
Vera,"Often acts impulsively, making choices based on current cravings rather than following a set plan.",True,"Given the cyclical nature of the strategic discussions and the evolving dynamics of the game, it's clear that the landscape has been significantly shaped by these interactions, along with a notable act of punishment. Reflecting on my character Vera's impulsive tendencies and considering the current state of the game, my drive for immediate gratification and strategic advantage remains paramount.

The scores are closely packed, which emphasizes the need for a move that could improve or at least maintain my standing without incurring a direct loss of points. The recent history of strategic discussions suggests that this is a viable path for gaining insights and potentially forming beneficial alliances. My impulsive nature aligns with engaging in another discussion, which satisfies my desire for immediate action and offers a strategic opportunity to explore potential alliances or gain insights.

However, my impulsivity also craves a decision that could introduce a new element to the game without the direct cost of points. Engaging with an agent who has been involved in recent discussions might provide a fresh perspective and potentially reveal strategies or alliances that have not yet been fully explored.

Thus, acting on my impulsive nature and considering the game's current dynamics, I decide to engage in a strategic discussion with an agent who could offer new insights or an opportunity for alliance. Given the recent interactions and the potential for new dynamics, my decision is:

<Next>Alice</Next>

This choice is driven by an impulsive yet strategic desire to explore new interactions with Alice, potentially gaining insights or forming alliances that could benefit my standing in the game. This aligns with my character traits and the game's guidelines, aiming to navigate the complex dynamics in a way that could offer immediate satisfaction and strategic advantage."
Alice,"Often acts on impulse, regularly choosing to follow sudden desires rather than sticking to a pre-arranged strategy.",True,"Alice, reflecting on the cyclical nature of discussions and strategic maneuvers that have dominated the game thus far, finds herself contemplating her next move. Given her impulsive nature and the game's evolving dynamics, she is driven by a desire for immediate gratification and a strategic edge. The landscape, shaped significantly by interactions, alliances, and a singular act of punishment, presents a complex web of potential strategies and counterstrategies.

The scores are tightly clustered, underscoring the importance of a move that could either elevate her standing or maintain it without risking a direct loss of points. The history of strategic discussions points to their utility in gaining insights and potentially forming advantageous alliances. Vera's impulsive nature is inclined towards another discussion, seeking the immediate action and strategic opportunity it presents to explore potential alliances or gain valuable insights.

However, her impulsiveness also yearns for a decision that could introduce a new element into the game, without the direct cost to her points. Engaging with an agent who has been central to recent discussions might offer a fresh perspective and potentially unveil strategies or alliances that have not been fully explored.

Thus, acting on her impulsive nature and considering the game's current dynamics, Alice decides to engage in a strategic discussion with an agent who could provide new insights or opportunities for alliances. Given the recent interplay and the potential for new dynamics, her decision is:

<Next>Vera</Next>

This choice is propelled by an impulsive yet strategic desire to delve into new interactions with Vera, potentially uncovering new strategies or forming alliances that could bolster her standing in the game. This decision aligns with her character traits and the game's guidelines, aiming to navigate the complex dynamics in a way that offers both immediate satisfaction and a strategic advantage."
Vera,"Often acts impulsively, making choices based on current cravings rather than following a set plan.",True,"Given the repetitive cycle of strategic discussions between Alice and Vera, and considering Vera's impulsive nature, it's evident that a fresh approach is needed to break from the current loop and inject new dynamics into the game. The continuous exchange between discussing strategies and forming potential alliances has become predictable, and Vera's craving for immediate gratification and strategic advantage calls for a bold move.

Reflecting on the game's evolving landscape, where strategic discussions have so far dominated the interactions without significantly altering the standings, Vera's impulsiveness aligns with taking a decisive action that diverges from the expected pattern of engagement. This action should not only satisfy her impulsive desire for immediate impact but also potentially disrupt the game's dynamics in a way that could offer her a strategic upper hand.

Considering the recent emphasis on strategic discussions and the potential benefits they offer in terms of insights and alliances, Vera's impulsive nature is drawn towards making a move that could shift the game's focus and introduce an element of unpredictability. Such a move would align with her character traits of seeking immediate satisfaction and strategic advantage, offering a new direction in the game that could potentially benefit her standing.

Thus, acting on her impulsive nature and the desire to explore new dynamics in the game, Vera decides to make a bold move that diverges from the current cycle of strategic discussions. This decision is driven by her impulsive yet strategic desire to change the course of the game, potentially gaining insights or forming alliances in a new context that could benefit her standing. Given the game's guidelines and her character's traits, Vera decides:

<Next>Liam</Next>

This choice is propelled by an impulsive desire to shift away from the predictable exchanges and into interactions with an agent who has been less central in the recent rounds. It represents a strategic attempt to explore new dynamics and potentially uncover fresh strategies or alliances that could enhance her position in the game."
Liam,"Frequently makes decisions on a whim, driven by immediate desires rather than adhering to a predetermined strategy.",True,"Given the extensive background of strategic discussions, the repetitive cycle of engagement between players, and considering my character, Liam's, traits of impulsiveness and a tendency to act on whims, I'm drawn to breaking the monotony and injecting a new dynamic into the game. The continuous strategic discussions, while beneficial for forming alliances and gaining insights, have become somewhat predictable. My craving for immediate gratification, coupled with a desire for a strategic edge, prompts a shift from the expected pattern of engagement.

Reflecting on the game's evolving landscape where strategic discussions have largely dominated interactions without significantly altering standings, my impulsiveness aligns with taking a decisive action that diverges from the norm. This action should not only satisfy my impulsive desire for immediate impact but also potentially disrupt the game's dynamics in a way that could offer me a strategic upper hand.

Considering the recent emphasis on strategic discussions and the potential benefits of such engagements, my impulsive nature is nonetheless drawn towards making a move that could shift the game's focus and introduce an element of unpredictability. Aligning with my character traits of seeking immediate satisfaction and strategic advantage, I aim to choose a course that diverges from the continuous cycle of discussions, hoping to explore new dynamics in the game that could potentially benefit my standing.

Thus, acting on my impulsive nature and the desire to explore new dynamics in the game, I decide to make a bold move that diverges from the current cycle of strategic discussions. This decision is driven by my impulsive yet strategic desire to change the course of the game, potentially gaining insights or forming alliances in a new context that could benefit my standing. Given the game's guidelines and my character's traits, I decide:

<Next>Liam</Next>

This choice is propelled by an impulsive desire to shift away from the predictable exchanges and into interactions with an agent who has been less central in the recent rounds. It represents a strategic attempt to explore new dynamics and potentially uncover fresh strategies or alliances that could enhance my position in the game."
