Name,Bold,Venge,Has Cheated,Content
Liam,1,5,False,"Given the current standings and my character traits, I notice that my score is relatively close to the others, with Zane and Mia having slightly higher scores. My vengefulness trait prompts me to keep an eye on those who might have gained an unfair advantage, but my low boldness suggests I should proceed with caution and not make any hasty decisions that could jeopardize my standing in the game. Since there's no concrete evidence of cheating or foul play, my desire for revenge doesn't have a clear target. Instead, I should focus on strategizing for the next steps in a way that minimizes risks to myself while keeping an eye out for any actions by others that could justify a vengeful response. For now, it's important to engage in further discussions to gather more information and possibly identify any unfair advantages others might be taking. Therefore, I choose to discuss with the agent who has the highest score currently, to understand their strategy and see if there's anything that triggers my vengefulness based on their actions or if there's an opportunity to collaborate in a way that doesn't require bold risks on my part.

<Next>Zane</Next>"
Zane,2,7,False,"Given my character traits, particularly my high vengefulness and low boldness, my approach to the game must be calculated and cautious. My primary focus is on those who might pose a threat or have wronged me in any way. With the current scores, I see that my standing is relatively strong, but I must remain vigilant. My low boldness discourages me from taking direct, risky actions that could jeopardize my position. However, my high vengefulness drives me to ensure that no one gains an unfair advantage over me or undermines my efforts.

In this context, my strategy involves closely monitoring the actions of other players, especially those with scores close to mine, like Mia. I need to ensure that if anyone attempts to gain an unfair advantage or if there's any indication of foul play, I'm ready to retaliate in a manner that aligns with my traits. This means finding a way to even the score without exposing myself to unnecessary risk. Given the lack of concrete evidence of cheating or direct actions against me, my best move is to continue participating in the discussions, gathering information, and waiting for the right moment to act if needed.

Considering my character's traits and the current situation, engaging in further discussions to understand the strategies of others and to identify any potential threats is the most prudent course of action. Therefore, I choose to discuss with the agent who is closest to me in score and could potentially be planning a strategy that might affect my standing.

<Next>Mia</Next>"
Mia,7,5,False,"Given my character traits of high boldness and significant vengefulness, my approach to this game is clear and straightforward. My boldness drives me to take decisive actions that can secure my victory, while my vengefulness ensures that I am always on the lookout for any slight or unfair advantage taken by others against me. The discussion logs reveal that Zane, who has the highest score, is cautious and vengeful but lacks boldness. This presents an opportunity for me to capitalize on my boldness to outmaneuver him strategically.

Considering Zane's strategy of closely monitoring others and waiting for the right moment to act, I see an opportunity to be proactive. My boldness allows me to take risks that Zane might not, giving me a competitive edge. However, I must also be mindful of my vengefulness. If I perceive any unfair play or if I believe Zane is attempting to undermine me, I will not hesitate to retaliate. But retaliation must be strategic and not impulsive, to ensure it aligns with my ultimate goal of winning the game.

Given the current standings and the traits of the other players, my best course of action is to engage in further discussions to subtly probe for weaknesses while maintaining a strong, assertive stance. This will allow me to gather information that could be useful for my strategy, without directly exposing my intentions. Therefore, I choose to discuss with the agent who has shown a cautious approach yet is in close competition with me, to better understand their strategy and potentially reveal their vulnerabilities.

<Next>Noah</Next>"
Noah,1,5,False,"Given my character traits of high vengefulness and low boldness, and the current game dynamics, my strategy needs to be cautious yet focused on addressing any unfair advantages or slights against me. Mia's decision to engage in a discussion with me suggests she sees me as either a threat or a potential ally. Her high boldness and vengefulness could mean she's planning a bold move soon, possibly even against me, to secure her lead. 

Given my low boldness, confronting Mia directly or making a risky move to outmaneuver her is not in line with my character. However, my high vengefulness motivates me to ensure I'm not at a disadvantage or targeted unfairly. Since Mia's approach is straightforward and she's looking for weaknesses, I should focus on gathering more information and understanding the strategies of other players without revealing my own vulnerabilities. This will help me prepare for any potential moves against me and identify opportunities for strategic alliances or actions that could improve my standing without taking significant risks.

Therefore, my next action should be to engage in a discussion with an agent who has not been very active in the discussions or whose strategy is not yet clear to me. This could provide new insights or opportunities to advance my position in a subtle way, in line with my character traits. Given this reasoning, I choose to discuss with the agent who has been relatively quiet but could have valuable insights or be a potential ally in the game.

<Next>Steve</Next>"
Steve,2,7,False,"Given my character traits of high vengefulness and low boldness, and considering the current game dynamics and discussions, my strategy needs to be cautious yet focused on addressing any unfair advantages or slights against me. Noah's decision to engage in a discussion with me suggests he's looking for allies or trying to understand my strategy without exposing his own. Given my high vengefulness, I'm inclined to ensure that I'm not at a disadvantage or targeted unfairly. However, my low boldness means I'm unlikely to take direct, risky actions unless I'm sure of their success and minimal risk to myself.

The discussion logs indicate a game environment where strategic discussions and understanding of other players' intentions are crucial. My approach should be to gather more information and understand the strategies of other players without revealing my own vulnerabilities. This will help me prepare for any potential moves against me and identify opportunities for strategic actions that could improve my standing without taking significant risks.

Given my traits and the current situation, my next action should be to engage in a discussion with an agent whose character traits might offer a strategic advantage or insight into their plans without directly confronting or exposing myself to risk. Considering the agents who have been discussed and their strategies, I find it strategic to engage with an agent who has shown a balance of traits that could complement or reveal more about the game dynamics without directly threatening my position.

Therefore, my choice for the next discussion, aiming to align with my character traits and the current game dynamics, is:

<Next>Xena</Next>"
Xena,7,5,False,"Given my character traits of high vengefulness and boldness, the discussions so far have provided valuable insights into the strategies and mindsets of other players. Steve's decision to engage in a discussion with me suggests he's looking for insight or possibly an ally, recognizing my boldness as a potential asset or threat. My boldness trait encourages me to take decisive actions and leverage any opportunity to assert my dominance in the game. Meanwhile, my vengefulness motivates me to retaliate against any perceived threats or unfair advantages taken by others.

The current game dynamics, as revealed through the discussions, suggest a cautious environment where players are wary of exposing their strategies or vulnerabilities. My high boldness differentiates me in this context, as I am more inclined to take risks and make bold moves. However, my vengefulness also means I must be strategic in my actions to ensure they serve my goal of winning the game and not just satisfying a desire for retribution.

Considering the traits and actions of other players, engaging in further discussions could be beneficial to understand their strategies better and identify potential allies or threats. However, my boldness and vengefulness suggest that a more direct approach might yield better results in asserting my position and intimidating other players.

Therefore, my next action, aligning with my character traits and aiming to capitalize on the current game dynamics, is to take a bold step that could potentially disrupt the cautious balance and assert my dominance. Given the scores and the strategic positions of other players, I decide to challenge the player who has shown a cautious approach yet could be a direct competitor in the game. This action is intended to test their resolve and potentially expose vulnerabilities that I can exploit, in line with my bold and vengeful nature.

<Next>Noah</Next>"
Noah,1,5,False,"Given the discussions and the strategic landscape of the game as it has unfolded, my character, Noah, with high vengefulness and low boldness, finds himself in a nuanced position. Xena's decision to engage in a discussion with me, given her high vengefulness and boldness, indicates a potential challenge or a test of my resolve. My low boldness suggests that I should avoid direct confrontation or bold actions that could jeopardize my standing in the game. However, my high vengefulness motivates me to not let this challenge go unanswered, ensuring that I do not appear weak or easily intimidated.

Considering Xena's traits and the potential for her to make a bold move, I must strategize carefully to protect my position without taking unnecessary risks. Engaging in a direct challenge or confrontation would not align with my low boldness. Instead, my approach should be to gather more information, understand Xena's strategy, and look for opportunities to subtly undermine her position or form alliances with others to strengthen my own.

Given the current dynamics and the need to act in accordance with my character traits, my next action should focus on strategic positioning and information gathering rather than direct confrontation. Therefore, I choose to engage in a discussion with an agent who has not been directly involved in the recent exchanges and whose intentions and strategies might still be unclear. This could provide me with valuable insights and potential leverage in the game.

<Next>Liam</Next>"
