Name,Bold,Venge,Has Cheated,Content
Xena,6,2,False,"Given the current standings and my character traits, it's clear that my boldness should guide my next move. My low vengefulness means I'm not inclined to punish anyone out of spite or for past actions. Instead, my focus should be on strategic advancement. Considering my boldness, I'm inclined to take risks and make moves that could potentially elevate my standing in the game without being held back by fear of repercussions.

Looking at the scores, Noah is currently leading. While punishing him could be seen as a strategic move to lower his score, it doesn't align with my low vengefulness trait. Instead, engaging in a discussion could provide an opportunity to understand other players' strategies and potentially form alliances or identify weaknesses. Given my boldness, I'm not afraid to confront or challenge others directly, which could be advantageous in a discussion setting.

Therefore, my action, driven by boldness and a strategic approach to gaining an advantage without resorting to punitive measures, would be to choose an agent for the next discussion. Considering the scores and potential strategic alliances, I decide:

<Next>Noah</Next>"
Noah,7,5,False,"Given my character traits of high boldness and significant vengefulness, my approach to the game must be aggressive and strategic. My current lead in the game suggests that my previous decisions have been effective, but I must not become complacent. The scores are close, and any slip could cost me the lead. My boldness trait encourages me to take risks and make moves that others might not expect, leveraging my current position to solidify my lead further.

Considering my vengefulness, I should also be mindful of any players who might pose a threat or have acted against me in the past. However, no specific actions against me have been noted so far, so my vengefulness does not necessarily dictate a punitive action at this moment. Instead, it fuels my determination to stay ahead and not let anyone surpass me without a fight.

Given the current standings, my best move is to engage in a strategic discussion with another player who could potentially ally with me or be swayed to act in a way that benefits my position. Bob, Vera, Olga, Mia, Xena, and John all have scores close to each other, making any of them potential threats or allies. My boldness leads me to confront challenges head-on, and a discussion could be a way to assert my dominance further and possibly gather information that could be used to my advantage later.

Considering all factors, my action, driven by a combination of boldness and a strategic approach to maintaining my lead, will be to choose an agent for the next discussion who I believe could be most susceptible to influence or who might have insights that could benefit my strategy moving forward. My decision is:

<Next>Bob</Next>

Bob's score is close to mine, making him a direct competitor. Engaging with Bob could provide an opportunity to assess his strategy and potentially influence the game's dynamics in my favor."
Bob,4,5,False,"Given my character traits of vengefulness (5 out of 7) and boldness (4 out of 7), and considering the current game dynamics, my strategy needs to be both assertive and calculated. Noah, currently leading, has chosen to engage with me, likely seeing me as a direct competitor. This move, while strategic on his part, triggers my vengefulness due to the implicit challenge it represents. My boldness trait suggests that I should not shy away from this confrontation but rather embrace it as an opportunity to assert my position in the game.

However, direct retaliation against Noah through punishment might not be the most strategic move at this juncture, considering the potential for backlash and the fact that it could position me as a vindictive player, potentially alienating allies. Instead, leveraging my boldness, I should focus on a move that asserts my independence and strategic acumen without resorting to outright aggression. This would involve engaging in a discussion with another player who could be a potential ally or whose strategy I could influence to my advantage, thereby indirectly challenging Noah's lead.

Given the scores and the need to build or identify strategic alliances while also keeping an eye on potential threats, engaging with a player who has not yet been in the spotlight could be beneficial. Vera's score is slightly below mine, which means she could be looking to improve her standing and might be open to strategic collaboration or at least a discussion that could reveal useful insights.

Therefore, my action, driven by a blend of vengefulness and boldness, will be to choose an agent for the next discussion who I believe could offer strategic value either through alliance or information that could help me navigate the game more effectively. My decision is:

<Next>Vera</Next>

Engaging with Vera could provide an opportunity to assess her strategy and potentially form an alliance or understand the dynamics among the other players better, which could be advantageous in navigating future moves and countering Noah's lead."
Vera,7,5,False,"Given my character traits of high vengefulness (5 out of 7) and maximum boldness (7 out of 7), my approach to the game must be both aggressive and unyielding. Bob's decision to engage with me for a discussion, likely sees me as a potential ally or a threat. This move aligns with my boldness, presenting an opportunity to assert my dominance and strategic capabilities in the game. However, my vengefulness trait suggests that I should also be prepared to retaliate against any perceived threats or challenges to my position.

Considering the current game dynamics and the scores, my best move is to engage in a strategic action that could potentially disrupt the standings and assert my position. My boldness encourages me to take risks and make bold moves that others might not anticipate. Given that Noah is currently leading and has not engaged with me directly, my vengefulness does not immediately dictate a punitive action against him. Instead, my focus should be on leveraging my boldness to make a strategic move that could improve my standing or disrupt the current leader's strategy.

Given the scores and the need to assert my strategic acumen, engaging in a discussion with another player who has not yet been directly involved with me could be beneficial. However, considering my traits, a more aggressive action might align better with my character's disposition.

Therefore, my action, driven by a combination of boldness and a strategic approach to asserting my position in the game, will be to choose an agent for the next discussion who I believe could be most influenced by my boldness or who might present an opportunity for me to gain a strategic advantage. My decision is:

<Next>Olga</Next>

Engaging with Olga could provide an opportunity to assert my dominance, explore potential alliances, or understand the dynamics among the other players better, which could be advantageous in navigating future moves and enhancing my position in the game."
Olga,7,5,False,"Given my character traits of high vengefulness (5 out of 7) and maximum boldness (7 out of 7), my approach to this game has been to assert my dominance and not shy away from confrontation. Vera's decision to engage with me for a discussion aligns with my readiness to take risks and confront challenges head-on. My boldness encourages me to make strategic moves that could potentially elevate my standing in the game, while my vengefulness suggests that I should be prepared to retaliate against any perceived threats or challenges to my position.

Considering the current game dynamics and the scores, engaging directly with another player who could either be a potential ally or a competitor is crucial. My boldness trait suggests that I should not fear confrontation or strategic maneuvers that could disrupt the current standings. Given that Vera has chosen to engage with me, it presents an opportunity to either form a strategic alliance or to assert my dominance further in the game.

However, my vengefulness also plays a role in my decision-making. It would be strategic to engage with a player who has either wronged me in the past or who poses a significant threat to my position in the game. Given the current standings and the actions of other players, my focus should be on making a move that not only asserts my position but also potentially penalizes those who might be plotting against me.

Therefore, my action, driven by a combination of boldness and a strategic approach to maintaining or improving my standing in the game, will be to choose an agent for the next discussion who I believe could be most influenced by my boldness or who might present an opportunity for me to gain a strategic advantage or retaliate if necessary. My decision is:

<Next>Mia</Next>

Engaging with Mia could provide an opportunity to explore potential alliances, assert my dominance, or retaliate against any perceived threats, which could be advantageous in navigating future moves and enhancing my position in the game."
Mia,3,1,False,"Given my character traits of low vengefulness (1 out of 7) and moderate boldness (3 out of 7), my approach to this game has been cautious and fair, focusing on strategic decisions that reflect my character's integrity and willingness to take calculated risks. Olga's decision to engage with me for a discussion presents an opportunity to navigate the game dynamics thoughtfully, without resorting to aggressive or retaliatory actions that do not align with my low vengefulness.

Considering the current game dynamics and my moderate boldness, I should engage in a discussion that allows me to understand the strategies of other players better and possibly identify areas where I can make strategic moves that align with my character's traits. My focus should be on making decisions that reflect my willingness to take risks, but not at the expense of my principles or by engaging in actions that could be perceived as vengeful or overly aggressive.

Therefore, my action, driven by a combination of my character's traits and a strategic approach to navigating the game, will be to choose an agent for the next discussion who I believe could offer insights into their strategy or with whom I could explore potential alliances that do not require aggressive or retaliatory actions. My decision is:

<Next>Xena</Next>

Engaging with Xena could provide an opportunity to understand her strategy and possibly form an alliance that aligns with my character's traits, allowing me to navigate the game in a manner that is both strategic and true to my character's disposition."
Xena,6,2,False,"Given my character traits of low vengefulness (2 out of 7) and high boldness (6 out of 7), and considering Mia's decision to engage with me for a discussion, it presents an interesting opportunity. Mia's approach, characterized by low vengefulness and moderate boldness, suggests she prefers a cautious yet strategic approach to the game. This aligns well with my low inclination towards vengefulness, indicating that a direct confrontation or punitive action is not my preferred strategy. 

My high boldness, however, motivates me to take decisive actions that can significantly impact my standing in the game. Engaging in a discussion with Mia, given her moderate boldness, could provide a platform to assert my strategic intentions and possibly influence her actions in a way that benefits my position. It's an opportunity to showcase my boldness by steering the conversation towards forming a strategic alliance or gathering insights that could inform my future moves.

Therefore, my action, driven by a blend of my character traits and a strategic approach to leveraging the current game dynamics, will be to engage in a constructive discussion with Mia. This discussion will aim to explore potential alliances or gain strategic insights, all while maintaining a stance that reflects my boldness and willingness to take calculated risks to advance in the game. My decision is:

<Next>Mia</Next>

Engaging with Mia in this manner allows me to potentially influence the game's dynamics in my favor, without resorting to actions that would contradict my low vengefulness trait. It's a strategic move that leverages my boldness to potentially gain an advantage."
