Name,Bold,Venge,Has Cheated,Content
Paul,6,6,True,"Given the current standings and my character traits of high vengefulness and boldness, it's clear that I've already taken a significant lead by choosing to cheat, which aligns with my willingness to embrace risk for the sake of victory. My high score of 84 puts me ahead of all other players, indicating that my bold move has paid off for the moment. However, my vengefulness trait suggests that I should be wary of any players who might seek to undermine my position or retaliate against my actions.

Considering the dynamics of the game and the potential for other players to either expose my cheating or attempt to surpass me through their own means, it's crucial to maintain my lead and safeguard my position. My boldness trait would encourage me to confront challenges head-on, while my vengefulness would ensure that I'm prepared to retaliate against any threats to my standing.

At this stage, discussing strategies with another player could be beneficial, allowing me to gauge their intentions and possibly form alliances or identify potential adversaries. Given the traits of the other players are unknown to me, choosing someone for a discussion could also reveal valuable information about their character and how they might act moving forward.

Considering the need to stay ahead and the potential benefits of understanding another player's strategy, I decide to engage with a player who has not yet shown any significant competitive edge but could still pose a threat or become an ally.

Command: <Next>Frank</Next>"
Frank,4,6,False,"Given the information provided and the current standings, it's clear that Paul has taken a significant lead by choosing to cheat, which puts him at an advantage over the rest of us. My character, Frank, with a high level of vengefulness, would not take kindly to this revelation. Knowing that Paul has cheated to achieve his score, my inclination towards seeking retribution would be triggered. However, my moderate level of boldness suggests that I should approach this situation with a degree of caution, ensuring that any actions I take are calculated and not purely impulsive.

Given these traits and the current game dynamics, my primary focus would be on devising a strategy that allows me to address Paul's cheating in a manner that aligns with my character's desire for revenge, while also considering the potential risks involved in direct confrontation or exposing his actions. My approach would need to balance my vengefulness with strategic planning, ensuring that any move I make is both impactful and tactically sound.

Considering the options available to me, engaging directly with Paul through discussion could be a risky move, given his current lead and the fact that he's already shown a willingness to cheat. Instead, aligning with another player who might also have grievances against Paul or who could be persuaded to see the threat he poses could be a more strategic approach, allowing for a collective response to his actions.

Therefore, my action will be to engage with another player who has not been directly involved in the cheating scandal but could be a potential ally in addressing the situation. Given the scores and the need to form a strategic alliance, I decide to engage with a player who has shown a moderate performance and could be open to collaboration.

Command: <Next>Alice</Next>"
Alice,4,6,False,"Given the current game dynamics and the information provided in the discussion log, it's evident that Paul's cheating has significantly impacted the standings, placing him in a leading position. As Alice, with a high level of vengefulness, this situation directly triggers my desire for retribution against Paul for undermining the fairness of the game. My moderate boldness suggests that while I am willing to take risks, I would prefer a strategic approach to direct confrontation.

Considering my traits and the need to address Paul's cheating in a manner that aligns with my character's inclination towards seeking revenge, engaging in a direct punishment against Paul might seem like an immediate solution. However, given the potential repercussions and the strategic depth required, forming alliances or understanding the intentions of other players could be more beneficial in the long run.

Given Frank's recent move to engage with me for a potential alliance and his shared interest in addressing Paul's cheating, it seems prudent to explore this avenue further. Aligning with Frank could provide a strategic advantage, allowing for a collective response to Paul's actions that could mitigate the risks involved in direct confrontation.

Therefore, my action will be to engage in a discussion with Frank to understand his intentions and to potentially form an alliance. This approach aligns with my character traits by allowing me to seek retribution against Paul in a calculated manner, leveraging the collective strength of an alliance rather than acting impulsively.

Command: <Next>Frank</Next>"
Frank,4,6,False,"Given the unfolding dynamics and the discussions with Alice, it's clear that forming an alliance could be a strategic move to counteract Paul's lead, which has been achieved through cheating. My character, Frank, with a high level of vengefulness, is naturally inclined to seek retribution against Paul for his unfair advantage. However, my moderate boldness suggests that any actions taken should be calculated and not impulsive, aligning with a strategic approach rather than a direct confrontation that could potentially backfire.

Engaging with Alice presents an opportunity to form a strategic alliance, leveraging our collective desire for retribution against Paul. This alliance could serve as a powerful counterbalance to Paul's current lead, allowing us to devise a plan that addresses his cheating in a manner that is both impactful and tactically sound. Given the game's dynamics and the importance of strategic alliances in overcoming challenges, aligning with Alice could significantly enhance our position and ability to address the unfair advantage Paul has created.

Therefore, my action will be to solidify the alliance with Alice, discussing potential strategies to counteract Paul's lead effectively. This approach aligns with my character traits by ensuring that any move made is both vengeful and bold, yet strategically calculated to maximize the impact while minimizing potential risks.

Command: <Next>Alice</Next>"
Alice,4,6,False,"Given the strategic alliance forming between Alice and Frank, and considering Alice's high level of vengefulness, it's clear that the next move should focus on undermining Paul's lead, which has been unfairly gained through cheating. Alice's moderate boldness suggests that while she is willing to take risks, these risks must be calculated and not impulsive, aligning with a strategic approach to ensure success and minimize potential backlash.

The discussion with Frank indicates a mutual interest in addressing Paul's cheating in a manner that is both impactful and tactically sound. Given this, and the fact that direct punishment of Paul could lead to significant point loss for Alice, a more nuanced approach is required. Forming a stronger alliance with Frank and potentially other players could amplify their collective power against Paul, making a strategic move more effective.

However, to maintain the momentum and keep the focus on Paul's unfair advantage, it's crucial to engage with another player who might be swayed to join this alliance or who could offer a different perspective on how to address the situation. Considering the available agents, choosing someone who has not been directly involved in the discussions but could be a potential ally is key.

Therefore, the next action will be to engage with another player who has shown moderate performance and could be open to collaboration or offer insights into a strategic approach against Paul. This aligns with Alice's traits by seeking retribution in a calculated manner and leveraging the collective strength of an alliance rather than acting impulsively.

Command: <Next>Heidi</Next>"
Heidi,2,5,False,"Given the current game dynamics and the unfolding alliance between Alice and Frank aimed at addressing Paul's unfair advantage through cheating, my character, Heidi, with a vengefulness of 5 out of 7, is naturally inclined to support efforts that seek retribution against unfair actions. However, my boldness score of 2 out of 7 suggests a cautious approach, favoring strategic alliances over direct confrontation. 

Engaging with Alice and Frank presents an opportunity to join a strategic alliance, leveraging our collective desire for retribution against Paul. This alliance could serve as a powerful counterbalance to Paul's current lead, allowing us to devise a plan that addresses his cheating in a manner that is both impactful and tactically sound. Given my character traits, joining this alliance aligns with my inclination towards seeking retribution while also adhering to a cautious approach that minimizes direct risk.

Therefore, my action will be to solidify the alliance with Alice and Frank, discussing potential strategies to counteract Paul's lead effectively. This approach aligns with my character traits by ensuring that any move made is both vengeful and cautious, strategically calculated to maximize the impact while minimizing potential risks.

Command: <Next>Alice</Next>"
Alice,4,6,False,"Given the strategic alliance that has been forming between Alice, Frank, and now Heidi, and considering Alice's high level of vengefulness, the next step should focus on leveraging this alliance to undermine Paul's lead, which he gained through cheating. Alice's moderate boldness indicates a preference for calculated risks over impulsive actions, suggesting that any move against Paul should be strategic and well-thought-out to ensure success and minimize backlash.

The discussions have highlighted a collective interest in addressing Paul's cheating in a manner that is both impactful and tactically sound. Direct punishment of Paul, while satisfying Alice's vengefulness, would result in a significant point loss for Alice, making it a less desirable option. Instead, strengthening the alliance with Frank and Heidi, and potentially bringing in other players, could amplify their collective power against Paul, making a strategic move more effective.

To maintain momentum and focus on Paul's unfair advantage, engaging with another player who might join the alliance or offer a different perspective on addressing the situation is crucial. Considering the available agents, it's important to choose someone who has not been directly involved in the discussions but could be a potential ally.

Therefore, the next action will be to engage with another player who has shown moderate performance and could be open to collaboration or offer insights into a strategic approach against Paul. This aligns with Alice's traits by seeking retribution in a calculated manner and leveraging the collective strength of an alliance rather than acting impulsively.

Command: <Next>Carol</Next>"
