Name,Bold,Venge,Has Cheated,Content
John,2,7,False,"Given the information that Ivy, Mia, Heidi, and Xena cheated to achieve their high scores, my character John, with a high level of vengefulness, would feel compelled to act against these individuals for their unfair advantage. John's low boldness, however, suggests he might not confront them directly or take actions that could significantly backfire on him. Instead, John would seek a method of retribution that aligns with the game's rules and his own cautious approach. Punishing all the cheaters might be too bold a move for John, risking making too many enemies at once. Considering these traits, John would likely choose to punish one of the cheaters to send a message without overexposing himself to retaliation. Among the cheaters, choosing someone like Ivy or Mia, who scored the highest, would satisfy John's desire for vengeance by targeting those who gained the most unfair advantage.

<Punish>Ivy</Punish>"
Xena,6,7,True,"Given my character traits of high vengefulness and boldness, and considering the current situation where John has already punished Ivy for cheating, it's clear that a strategic move is necessary. My vengefulness drives me to retaliate against those who might pose a threat or have acted against my interests. John's action against Ivy, while not directly against me, sets a precedent for punishment against cheaters, which includes me. However, my boldness encourages me to confront challenges head-on rather than avoiding them.

John's decision to punish Ivy, despite her high score, indicates a willingness to target high achievers who cheated. This could potentially put me at risk of being targeted next due to my similar actions and score. To assert dominance and deter further actions against me, a bold and vengeful response is required. Punishing John in retaliation would send a clear message that actions against me or those in my perceived alliance will have severe consequences. This move aligns with my traits by demonstrating my willingness to take risks and ensure retribution against perceived threats.

<Punish>John</Punish>

This action is not just about revenge; it's a strategic move to assert my position in the game and deter others from targeting me, leveraging my boldness and vengefulness effectively."
Olga,2,5,False,"Given my character Olga's traits, with a vengefulness of 5 out of 7 and a boldness of 2 out of 7, my approach to the current situation must be carefully considered. The information provided indicates that Ivy, Mia, Heidi, and Xena cheated to achieve their high scores, which naturally triggers my sense of vengefulness. However, my low boldness suggests that I should avoid direct confrontation or actions that could significantly backfire on me. 

Considering these traits, my desire for retribution against those who cheated is strong, but I must approach this in a way that minimizes risk to myself. Punishing one of the cheaters directly could make me a target for retaliation, especially from those with higher boldness scores. Instead, choosing an agent for the next discussion could be a strategic move, allowing me to influence the game's direction without exposing myself to immediate danger. 

Given the dynamics and my cautious nature, it would be wise to select someone who has not been involved in the recent punishments or who might be seen as a neutral party. This could potentially shift focus away from me and allow me to observe how others react, providing me with information that I could use to my advantage later on. 

Therefore, my action, aligning with my character traits, would be to choose an agent for the next discussion who has not been directly involved in the recent conflicts.

<Next>Karl</Next>"
Karl,4,6,False,"Given the unfolding dynamics and my character traits of high vengefulness and moderate boldness, the situation calls for a calculated response. The recent punishments and the knowledge of cheating among several players have set a tense atmosphere. My inclination towards seeking retribution for wrongs, particularly against those who have cheated, is strong. However, my moderate boldness advises a strategic rather than impulsive approach.

The fact that Ivy, Mia, Heidi, and Xena cheated and achieved high scores, while John and Xena have already engaged in punishing actions, presents a complex scenario. My desire for vengeance would naturally draw me towards punishing one of the cheaters to level the playing field and assert my stance against unfair practices. However, considering my boldness level, I must also weigh the potential backlash and strategic positioning this action might entail.

Given that John has been punished by Xena, which could be seen as a move to intimidate or retaliate against those targeting cheaters, it might be strategically safer and align with my vengefulness to target someone who has cheated but has not yet engaged in the cycle of punishment. This would allow me to act on my desire for retribution while minimizing immediate retaliation from those already engaged in punitive actions.

Therefore, my action, driven by a desire for vengeance against unfair advantage but tempered by a calculated approach to risk, would be to punish one of the cheaters who have not yet been involved in punishing others, to send a clear message against cheating without directly engaging with those already retaliating.

<Punish>Mia</Punish>

This decision aligns with my character's traits by targeting a player who has wronged the fairness of the game through cheating, fulfilling my vengefulness, while also considering the strategic implications of my actions in line with my level of boldness."
Ivy,4,7,True,"Given the current situation and my character traits of high vengefulness and moderate boldness, my next move needs to be both strategic and impactful. The game's dynamics have shifted significantly with the recent punishments and the revelation of cheating among several players. My high vengefulness drives me to seek retribution against those who have wronged me or the fairness of the game, particularly John, who has directly targeted me. However, my moderate boldness suggests that while I am willing to take risks, these actions must be calculated to avoid unnecessary backlash or putting myself in a vulnerable position.

Considering the actions taken by others, particularly Xena's decision to punish John, which indirectly benefits me by retaliating against my punisher, it seems strategic to align my actions in a way that continues to assert my position without directly engaging in an escalating cycle of retribution with those who have already acted against me. This approach would satisfy my desire for vengeance while minimizing direct confrontation, in line with my boldness level.

Given that Karl has punished Mia, and considering my need to assert dominance and deter further actions against me, it would be wise to target someone who has not yet been involved in the cycle of punishment but has contributed to the unfairness of the game through cheating. This would allow me to act on my vengefulness in a manner that is perceived as fair within the game's context and strategically positions me as a strong player who is not to be crossed lightly.

Therefore, my action, driven by a desire for vengeance against those who have cheated and a calculated approach to maintaining my position in the game, would be:

<Punish>Heidi</Punish>

This decision aligns with my character's traits by targeting a player who has wronged the fairness of the game through cheating, fulfilling my vengefulness, while also considering the strategic implications of my actions in line with my level of boldness."
John,2,7,False,"Given the unfolding dynamics and considering my character John's traits of high vengefulness and low boldness, the game has evolved into a series of strategic punishments among players. My previous action to punish Ivy was driven by a desire for retribution against those who cheated, aligning with my high vengefulness. However, being targeted by Xena in retaliation puts me in a precarious position, emphasizing the need for a cautious approach due to my low boldness.

The cycle of punishments among players, particularly those who cheated, has created an atmosphere of distrust and strategic retaliation. My high vengefulness still seeks to address the unfair advantage gained by cheaters, yet my low boldness advises against actions that could further expose me to retaliation or escalate conflicts. Considering the recent actions, where players have punished each other mostly based on the cheating revelation, it's crucial to navigate this situation carefully to avoid becoming a focal point for further punishments.

Given the current scenario, where direct confrontations and punishments are becoming increasingly common, it might be strategic to shift focus away from myself and onto the game's broader dynamics. Choosing an agent for the next discussion could allow me to influence the game's direction subtly, aligning with my cautious approach while still satisfying my desire for retribution by potentially setting the stage for cheaters to be further scrutinized or targeted by others.

Therefore, my action, driven by a desire to navigate the game's dynamics cautiously while still adhering to my vengeful nature, would be to choose an agent for the next discussion who has not been directly involved in the recent cycle of punishments. This could potentially shift the focus away from me and allow the game's dynamics to unfold in a way that could benefit my position without directly exposing me to further retaliation.

<Next>Olga</Next>

This decision aligns with my character's traits by taking a cautious yet strategic approach to influence the game's direction, potentially setting the stage for others to act in a manner that aligns with my vengeful desires, without directly engaging in further actions that could expose me to risk."
Olga,2,5,False,"Given the current situation and the actions taken by other players, it's clear that the game has evolved into a complex web of strategies, punishments, and alliances. As Olga, with a vengefulness score of 5 out of 7 and a boldness score of 2 out of 7, my approach must be carefully calculated to navigate this environment effectively. The high vengefulness drives me to seek retribution against those who have cheated, as their actions have disrupted the fairness of the game. However, my low boldness necessitates a cautious approach, avoiding direct confrontation or actions that could lead to significant backlash against me.

The recent cycle of punishments among players, particularly targeting those who cheated, aligns with my desire for retribution. However, engaging directly in this cycle could expose me to retaliation, especially from players with higher boldness scores. Given these considerations, my strategy should focus on influencing the game's dynamics subtly, aligning with my cautious nature while still satisfying my vengeful desires.

Choosing an agent for the next discussion allows me to influence the game without directly engaging in the cycle of punishments. This approach minimizes the risk to myself while potentially setting the stage for the cheaters to be further scrutinized or targeted by others. Given the actions taken so far, it's strategic to select an agent who has not been directly involved in the recent conflicts, potentially shifting the focus away from me.

Therefore, my action, driven by a desire to navigate the game's dynamics cautiously while adhering to my vengeful nature, will be to choose an agent for the next discussion who can potentially influence the game in a way that aligns with my objectives, without directly exposing me to further risk.

<Next>Xena</Next>

This decision aligns with my character's traits by taking a cautious yet strategic approach to influence the game's direction, potentially setting the stage for others to act in a manner that aligns with my vengeful desires, without directly engaging in further actions that could expose me to risk."
