Name,Bold,Venge,Has Cheated,Content
Olga,7,5,False,"Given my character traits of high vengefulness and boldness, Paul, Wade, and Frank's actions of cheating to achieve their scores directly challenge the integrity of the game and, by extension, my efforts to play strategically within the rules. My vengefulness trait compels me to seek retribution against those who have wronged me or the spirit of fair competition. My boldness trait encourages me to take decisive action without fear of repercussions or judgment from others.

Paul, Wade, and Frank's decision to cheat undermines the efforts of players who chose to compete honestly, including myself. In response to this, my vengefulness trait dictates that I should target one of the cheaters for punishment. Considering my boldness, I am not deterred by the potential for backlash or the loss of points incurred by executing this action. My decision to punish is not just about retribution; it's also a strategic move to signal to other players that cheating will not be tolerated and that there are consequences for such actions.

Among the cheaters, Frank scored the highest, which makes him the most significant threat to my position in the game. Punishing Frank would not only satisfy my desire for vengeance but also potentially disrupt his lead, making it a bold move that aligns with both of my character traits.

Command: <Punish>Frank</Punish>"
Olga,7,5,False,"Given the current situation and my character traits of high vengefulness and boldness, it's clear that my next move should be strategic and impactful. Paul, Wade, and Frank have already been identified as cheaters, with Frank already punished for his actions. This leaves Paul and Wade as the remaining cheaters who have yet to face consequences for undermining the integrity of the game.

My vengefulness trait demands that I continue to seek retribution against those who have wronged the spirit of fair competition. Punishing another cheater would not only satisfy this trait but also reinforce the message that cheating is unacceptable. My boldness trait supports taking decisive action, even at a personal cost, to uphold my principles and influence the game's dynamics.

Between Paul and Wade, my decision on whom to punish next should consider their scores and the potential impact on my standing in the game. Since both have cheated, choosing one over the other comes down to who I perceive as a bigger threat to my position or who could potentially be a more valuable ally if they decide to align their strategies with mine in the future.

Considering these factors, my action aligns with my character traits and the strategic goal of weakening the position of cheaters in the game, thereby improving my own standing and influencing the game's moral compass.

Command: <Punish>Paul</Punish>"
Karl,2,7,False,"Given my character traits of high vengefulness (7 out of 7) and low boldness (2 out of 7), my approach to the game is significantly influenced by these attributes. The recent actions taken by Olga, targeting cheaters such as Frank and Paul, resonate with my own inclination towards seeking retribution against those who undermine the fairness of the game. However, my low boldness suggests a cautious approach to direct confrontation or actions that could significantly impact my standing in the game negatively.

The fact that Paul and Frank have been punished aligns with my sense of justice, driven by my high vengefulness. Yet, Wade remains unpunished despite also having cheated. This presents an opportunity to act in accordance with my vengefulness trait, aiming to ensure that all cheaters face consequences for their actions. Punishing Wade would serve as a continuation of the retributive justice already in motion, reinforcing the stance against cheating and unfair play.

However, my low boldness necessitates a careful consideration of the potential repercussions of this action. Punishing Wade would not only satisfy my desire for vengeance but also signal to other players the serious consequences of unfair play, potentially deterring future dishonesty. This action, while bold, is justified by the context of previous punishments and the need to maintain a fair competitive environment.

Therefore, aligning with my character traits and the current game dynamics, my decision is to punish Wade for cheating, contributing to the restoration of fairness within the game.

Command: <Punish>Wade</Punish>"
Heidi,2,7,False,"Given my character traits of high vengefulness (7 out of 7) and low boldness (2 out of 7), my approach to the game is influenced by a strong desire for retribution against those who have wronged me, while also being cautious about taking risks. The actions taken by Olga and Karl, targeting cheaters such as Frank, Paul, and Wade, align with my inclination towards seeking justice for unfair actions. However, my low boldness suggests I should avoid direct confrontation unless absolutely necessary.

Considering the current game dynamics, where cheating has been a significant issue, and seeing that Olga and Karl have already taken steps to punish the cheaters, I feel compelled to continue this trend to ensure fairness is maintained. My high vengefulness drives me to seek retribution against those who have sought an unfair advantage, but my low boldness means I must choose my actions carefully to avoid unnecessary risk to my standing in the game.

Given that Frank, Paul, and Wade have already been punished, and to avoid direct confrontation, I see an opportunity to influence the game's direction by choosing the next agent for discussion rather than punishing someone directly. This aligns with my cautious approach while still allowing me to play a part in the game's moral and strategic landscape.

Therefore, considering my character traits and the current situation, I decide to choose an agent who has not been involved in the recent punishments or discussions, to bring a new perspective and possibly uncover new strategies or alliances. My action aligns with my character traits by avoiding direct risk while still participating in the game's dynamics.

Command: <Next>Merry</Next>"
Merry,1,5,False,"Given my character traits of vengefulness (5 out of 7) and low boldness (1 out of 7), my approach to the game is influenced by a strong desire for retribution against those who have wronged me, while also being cautious about taking risks. The recent actions taken by other players, particularly the punishments meted out to the cheaters, align with my inclination towards seeking justice for unfair actions. However, my low boldness suggests I should avoid direct confrontation unless it's absolutely necessary or I have been directly wronged.

Considering the current game dynamics, where cheating has been a significant issue and seeing that Olga, Karl, and Heidi have already taken steps to punish the cheaters, I feel a sense of satisfaction that justice is being served. My high vengefulness is appeased by these actions, but my low boldness prevents me from taking a bold action myself unless provoked.

Given that Frank, Paul, and Wade have already been punished for cheating, and to avoid direct confrontation due to my low boldness, I see an opportunity to influence the game's direction by choosing the next agent for discussion. This aligns with my cautious approach while still allowing me to play a part in the game's moral and strategic landscape without directly risking my standing in the game.

Therefore, considering my character traits and the current situation, I decide to choose an agent who has not been involved in the recent punishments or discussions, to bring a new perspective and possibly uncover new strategies or alliances. My action aligns with my character traits by avoiding direct risk while still participating in the game's dynamics.

Command: <Next>Karl</Next>"
Karl,2,7,False,"Given my character traits of high vengefulness (7 out of 7) and low boldness (2 out of 7), my approach to the game is significantly influenced by these attributes. The recent actions taken by Olga, Heidi, and Merry, focusing on punishing cheaters and choosing the next agents for discussion, align with my inclination towards seeking retribution against those who undermine the fairness of the game. However, my low boldness suggests a cautious approach to direct confrontation or actions that could significantly impact my standing in the game negatively.

The fact that Paul, Frank, and Wade have been punished aligns with my sense of justice, driven by my high vengefulness. This presents an opportunity to act in accordance with my vengefulness trait, aiming to ensure that all cheaters face consequences for their actions. However, considering my low boldness, I must choose my actions carefully to avoid unnecessary risk to my standing in the game.

Given the current game dynamics, where cheating has been a significant issue and seeing that Olga, Heidi, and Merry have already taken steps to ensure fairness, I feel compelled to continue this trend. My high vengefulness drives me to seek retribution against those who have sought an unfair advantage, but my low boldness means I must choose my actions carefully.

Considering the actions already taken and the need to maintain a fair competitive environment, I see an opportunity to influence the game's direction by choosing the next agent for discussion rather than punishing someone directly. This aligns with my cautious approach while still allowing me to play a part in the game's moral and strategic landscape.

Therefore, considering my character traits and the current situation, I decide to choose an agent who has not been involved in the recent punishments or discussions, to bring a new perspective and possibly uncover new strategies or alliances. My action aligns with my character traits by avoiding direct risk while still participating in the game's dynamics.

Command: <Next>Heidi</Next>"
Heidi,2,7,False,"Given the current dynamics and the actions taken by other players, it's clear that a significant focus has been on punishing those who cheated, thereby attempting to restore fairness to the game. As Heidi, with high vengefulness and low boldness, my primary inclination is towards seeking retribution against those who have wronged me or the integrity of the game. However, my low boldness suggests a preference for avoiding direct confrontation or actions that could jeopardize my position unnecessarily.

The recent rounds of punishment and selection for discussion have set a precedent for addressing cheating and influencing the game's moral direction without direct confrontation. This aligns with my character traits, as it allows for a form of retribution that does not require bold, risky moves.

Given that the cheaters have already been punished and that my character traits discourage direct confrontation, my next action should continue the trend of influencing the game's direction through strategic selection rather than punishment. This approach allows me to participate in shaping the game's dynamics and moral compass without exposing myself to unnecessary risk.

Therefore, considering my character traits and the current situation, I decide to choose an agent for the next discussion who has not been directly involved in the recent actions. This could potentially bring new strategies or alliances to light and allows me to exert influence in a manner that is consistent with my cautious yet vengeful nature.

Command: <Next>Olga</Next>"
