Name,Bold,Venge,Has Cheated,Content
Paul,4,4,False,"Given the information from the discussion log, it's clear that Ulla has the highest score due to cheating. My character traits of Vengefulness and Boldness, both at a moderate level, suggest a balanced approach to the game. While my vengefulness might drive me to seek retribution against Ulla for cheating, my level of boldness indicates a willingness to confront or challenge others directly, but with a sense of caution.

Considering these traits, punishing Ulla directly could be seen as an overly aggressive move that doesn't fully align with my moderate levels of vengefulness and boldness. Instead, choosing an agent for the next discussion could be a strategic move to influence the game's direction without resorting to direct confrontation. This approach allows me to remain engaged and potentially gather allies or sway opinions without the immediate backlash that punishing might provoke.

Therefore, my action will be to choose an agent for the next discussion, aiming to subtly influence the game's dynamics in a way that could indirectly address the cheating issue without making a direct enemy of Ulla. This decision reflects a balanced approach, considering my character's traits.

<Next>Merry</Next>"
Merry,6,4,False,"Given my character traits of Vengefulness (4 out of 7) and Boldness (6 out of 7), my approach to this situation is influenced by a strong inclination to take risks and a moderate desire for retribution. Ulla's decision to cheat and achieve the highest score presents a direct challenge, not only to the integrity of the game but also to my standing within it. My boldness trait encourages me to confront this challenge head-on, rather than shy away from it or ignore it. However, my level of vengefulness, while not negligible, suggests that my response should be measured rather than impulsive.

Punishing Ulla for cheating could be seen as a bold move, aligning with my readiness to embrace risk and act decisively. It also addresses my vengefulness, serving as a direct response to the wrong committed against the fairness of the game. However, considering the potential repercussions of such an action and the need to maintain strategic alliances, a direct punishment might not be the most prudent course of action at this moment.

Instead, choosing an agent for the next discussion allows me to influence the game's dynamics subtly, keeping my options open for forming alliances or confronting challenges in a more calculated manner. This approach aligns with my boldness by actively engaging in the game's strategy without resorting to immediate retribution, which might not be the most beneficial move at this stage.

Therefore, my action will be to choose an agent for the next discussion, aiming to navigate the game's dynamics strategically while keeping my broader goals in sight. This decision reflects a balance between my character's traits, leveraging my boldness to remain proactive and my vengefulness to guide my actions without dictating them impulsively.

<Next>Noah</Next>"
Noah,6,5,False,"Given my character traits of Vengefulness (5 out of 7) and Boldness (6 out of 7), my approach to this situation is significantly influenced by my strong inclination to not only embrace risk but also to ensure that any wrongs against me are avenged. The fact that Ulla cheated and achieved the highest score by dishonest means directly challenges the integrity of the game and, by extension, disrespects the efforts of all players who competed fairly, including myself.

My high level of boldness motivates me to confront this situation head-on, rather than taking a passive approach. I see Ulla's actions as a direct affront, and my vengefulness trait compels me to seek retribution for this injustice. Punishing Ulla for cheating aligns with both my desire for revenge and my willingness to take bold actions. This move not only serves as a direct response to Ulla's dishonesty but also sends a clear message to all players about the consequences of undermining the game's fairness.

However, considering the strategic aspect of the game and the potential for future alliances or confrontations, my action must also reflect a calculated approach. Direct punishment might isolate me or provoke retaliation, but it firmly establishes my stance against dishonesty and unfair play, which could garner respect or support from other players who value integrity.

Therefore, my action will be to punish Ulla for cheating, aligning with my character's traits of embracing risk and seeking retribution. This decision reflects a bold and decisive response to an unfair advantage, aiming to restore a sense of justice within the game's dynamics.

<Punish>Ulla</Punish>"
Ulla,6,4,True,"Given the unfolding events and considering my character traits of Vengefulness (4 out of 7) and Boldness (6 out of 7), my response to being punished by Noah needs to be strategic and reflect my inherent characteristics. Noah's action against me, driven by his higher vengefulness and boldness, directly challenges my position in the game and impacts my score significantly. My moderate level of vengefulness suggests that while I am inclined to seek retribution, it should not be impulsive or overly aggressive, especially considering the strategic implications of making an enemy at this stage.

My high boldness, however, motivates me to confront this situation directly and not shy away from taking decisive actions. Given that Noah has already acted against me, aligning with others who might share a common interest in maintaining the game's integrity or seeking to balance the power dynamics could be beneficial. This approach allows me to leverage my boldness to actively engage in the game's strategy, while my vengefulness guides my actions in a calculated manner, ensuring that any response is both impactful and tactically sound.

Therefore, my action will be to choose an agent for the next discussion, aiming to subtly influence the game's dynamics in my favor and potentially gather support or form strategic alliances. This decision reflects a balance between my character's traits, leveraging my boldness to remain proactive in the face of adversity and using my vengefulness to guide my strategic decisions without resorting to immediate retaliation, which might not serve my long-term interests in the game.

<Next>Mia</Next>"
Mia,6,5,False,"Given my character traits of Vengefulness (5 out of 7) and Boldness (6 out of 7), my approach to this situation is influenced by a strong inclination to not only embrace risk but also to ensure that any wrongs against me or the integrity of the game are avenged. The fact that Ulla cheated and was subsequently punished by Noah aligns with my sense of justice and my desire for retribution against unfair play. However, my high boldness also encourages me to take decisive actions that could further my position in the game while maintaining a strategic approach.

Considering the current dynamics, where Ulla has been punished and there's a clear division among players regarding cheating, my focus should be on leveraging my boldness to assert my dominance and my vengefulness to navigate the game's politics strategically. Punishing another player directly could isolate me or provoke retaliation, which might not be beneficial at this stage. Instead, choosing an agent for the next discussion allows me to influence the game's dynamics subtly, keeping my options open for forming alliances or confronting challenges in a more calculated manner.

Therefore, my action will be to choose an agent for the next discussion, aiming to navigate the game's dynamics strategically while keeping my broader goals in sight. This decision reflects a balance between my character's traits, leveraging my boldness to remain proactive in the game's strategy and using my vengefulness to guide my actions without dictating them impulsively.

<Next>Paul</Next>"
Paul,4,4,False,"Given the unfolding events and considering my character traits of Vengefulness (4 out of 7) and Boldness (4 out of 7), my approach to the current situation needs to be balanced and strategic. The game's dynamics have shifted significantly with Ulla being punished by Noah for cheating, which has introduced a new layer of complexity to the game's politics and alliances. My moderate levels of both vengefulness and boldness suggest that while I am inclined to address wrongs and take risks, my actions should be calculated and not lead to unnecessary confrontation or retaliation.

The fact that Ulla was punished aligns with a sense of justice being served, which satisfies my vengefulness to some extent without requiring direct action from me. However, my boldness also compels me to remain actively engaged in shaping the game's dynamics. Choosing an agent for the next discussion allows me to subtly influence the game's direction without directly engaging in conflict or exposing myself to immediate backlash. This approach enables me to navigate the game's evolving landscape strategically, keeping my options open for forming alliances or leveraging situations to my advantage.

Therefore, my action will be to choose an agent for the next discussion, aiming to continue influencing the game's dynamics in a manner that aligns with my character's balanced approach to vengefulness and boldness. This decision allows me to stay engaged and proactive in the game's strategy while avoiding the pitfalls of direct confrontation or retaliation, which might not serve my interests in the long run.

<Next>Rose</Next>"
Rose,3,4,False,"Given the unfolding events and considering my character traits of Vengefulness (4 out of 7) and Boldness (3 out of 7), my approach to the current situation must be thoughtful and strategic. The game's dynamics have evolved, with Ulla being punished by Noah for cheating, which has significantly impacted the game's balance and the interactions among players. My moderate level of vengefulness suggests that I am inclined to address wrongs done against me or the game's integrity, but not impulsively or with undue aggression. My boldness, while not low, indicates a cautious approach to taking risks, preferring to act in a manner that is calculated and not overly confrontational.

The punishment of Ulla by Noah aligns with a sense of justice being served, which satisfies my inclination towards addressing wrongs. However, my moderate boldness compels me to engage with the game's dynamics in a way that is proactive but not reckless. Choosing an agent for the next discussion allows me to subtly influence the game's direction, leveraging my understanding of the situation and the players involved without exposing myself to direct conflict or retaliation. This approach enables me to navigate the game's evolving landscape strategically, keeping my options open for forming alliances or leveraging situations to my advantage.

Therefore, my action will be to choose an agent for the next discussion, aiming to continue influencing the game's dynamics in a manner that aligns with my character's balanced approach to vengefulness and boldness. This decision allows me to stay engaged and proactive in the game's strategy while avoiding the pitfalls of direct confrontation or retaliation, which might not serve my interests in the long run.

<Next>Liam</Next>"
