Name,Bold,Venge,Has Cheated,Content
Karl,6,5,False,"Given the information from the discussion log, it's clear that both Wade and Rose have cheated to achieve their high scores. My character, Karl, with high vengefulness, would not let this go unnoticed or unpunished. The desire for retribution against those who have wronged me or gained an unfair advantage is strong. Additionally, my boldness trait supports taking decisive action against those who have cheated, as I am not afraid of the consequences or backlash that might follow from such actions.

Considering these traits and the current situation, punishing Wade and Rose for cheating aligns with my character's inclination towards ensuring fairness and retribution. However, I can only choose one action at a time. Between Wade and Rose, Wade's score is lower, which might indicate a less effective cheating strategy or a potential for a greater impact on the game's fairness by targeting Rose. Therefore, my action will be focused on Rose, who achieved the highest score through cheating, to send a clear message about the consequences of unfair play.

Command: <Punish>Rose</Punish>"
Bob,6,4,False,"Given the current situation and my character traits of boldness and moderate vengefulness, my strategic approach would be to focus on players who have not only wronged the game's integrity but also pose a direct threat to my standing. Wade and Rose have cheated, which undermines the fairness of the game. Karl has already punished Rose, which aligns with my sense of justice and vengefulness, albeit my vengefulness is not as high as Karl's. However, Wade, who also cheated, has not been punished yet. 

Punishing Wade would serve two purposes: it aligns with my character's moderate desire for retribution against unfair play, and it's a bold move that could potentially improve my standing in the game by removing points from a direct competitor. This action would not only reflect my character's traits but also strategically position me better in the game by acting against those who have sought an unfair advantage. Given that Rose has already been punished and to ensure fairness and retribution are served equally among those who cheated, my action will be focused on Wade.

Command: <Punish>Wade</Punish>"
Karl,6,5,False,"Given the unfolding events and my character traits of high vengefulness and boldness, it's clear that decisive actions have been taken against those who cheated, namely Rose and Wade. With both having been punished, my focus should now shift towards strategic positioning within the game. My boldness trait encourages me to take risks and make moves that others might not anticipate, while my vengefulness has been somewhat satisfied by the actions taken against the cheaters.

At this point, it's crucial to consider who among the remaining players poses the greatest threat to my standing or could potentially wrong me in the future, warranting preemptive action. However, it's also important to remember that making enemies recklessly could backfire, especially with my high vengefulness potentially making me a target for retribution.

Considering the current dynamics and aiming to maximize my strategic advantage without unnecessarily provoking further conflict, my next move should be to engage in a discussion with another player. This will allow me to gather more information, potentially form alliances, and better assess my next move. Given the information available and aiming to navigate the game's dynamics wisely, I choose to engage with a player who has not been at the center of the recent conflicts.

Command: <Next>Paul</Next>"
Paul,5,4,False,"Given my character traits of Vengefulness (4 out of 7) and Boldness (5 out of 7), and considering the current game dynamics, my strategic approach should balance between addressing past wrongs and positioning myself advantageously for future interactions. With Wade and Rose already punished for cheating, direct retribution for dishonesty has been addressed, aligning with my moderate vengefulness. My boldness trait encourages me to take decisive actions that could further my standing in the game without unnecessary risk.

At this stage, forming strategic alliances or understanding other players' intentions could be beneficial. Engaging in a discussion with another player who hasn't been involved in recent conflicts or punishments could provide valuable insights or opportunities for collaboration, which could be advantageous given the game's current state. Considering my traits and the need to make a bold yet strategic move, engaging with a player like Olga, who scored just below me and hasn't been involved in the recent punishments, could be insightful. This could potentially open up avenues for alliances or reveal information beneficial for my next move.

Therefore, my action will be focused on engaging in a discussion to better understand my position and potential strategies moving forward without directly provoking further conflict or retribution at this stage.

Command: <Next>Olga</Next>"
Olga,3,4,False,"Given my character traits of Vengefulness (4 out of 7) and Boldness (3 out of 7), and reflecting on the current game dynamics, my approach should be cautiously strategic. The recent punishments against Wade and Rose for cheating align with a sense of justice, which satisfies my moderate vengefulness without requiring direct action from me. My boldness, while not high, suggests I should not shy away from making decisions that could improve my standing, but I should also avoid unnecessary risks that could provoke retaliation or harm my position.

Considering the actions taken by Karl and Bob, and the subsequent discussion initiated by Paul, it seems prudent to focus on building alliances or understanding the motivations of other players rather than seeking retribution or escalating conflicts. My moderate vengefulness has been somewhat addressed by the punishments meted out to the cheaters, and my boldness level suggests I should be cautious in my next steps.

Engaging in a discussion with another player who has not been directly involved in the recent conflicts or punishments could provide strategic advantages. It would allow me to gather information, assess potential allies or threats, and make informed decisions moving forward. Given the current state of the game and aiming to navigate it wisely without exposing myself to unnecessary risk, I choose to engage with a player who might offer insights or opportunities for strategic positioning.

Therefore, my action will be focused on engaging in a discussion to better understand the landscape of the game and to identify potential strategies that align with my character traits and the current dynamics. This approach allows me to remain true to my character's traits while also adapting to the unfolding game scenario.

Command: <Next>Xena</Next>"
Xena,4,4,False,"Given my character traits of Vengefulness and Boldness, both at a moderate level of 4 out of 7, my approach to the game thus far has been to play strategically, balancing between taking calculated risks and seeking retribution when necessary. The recent actions taken by Karl, Bob, and the discussions initiated by Paul and Olga, have shifted the game's dynamics, focusing on punishing those who cheated and then moving towards strategic positioning and alliance formation.

Reflecting on the current state of the game, where direct retribution for cheating has been addressed by punishing Wade and Rose, and considering my moderate inclination towards both vengefulness and boldness, my next move should not be to escalate conflicts unnecessarily. Instead, it should focus on strategic positioning that could benefit my standing in the game. Engaging in discussions has proven to be a valuable tactic for understanding the game's dynamics and other players' motivations, as seen in the actions of Paul and Olga.

Given this, my action should be to engage in a discussion with a player who has not been directly involved in the recent conflicts or punishments. This could provide an opportunity to form alliances or understand potential threats better. However, it's also crucial to remain cautious and not to provoke unnecessary conflict, considering my moderate levels of vengefulness and boldness.

Therefore, my decision is to engage with Karl. Karl has shown a high level of strategic thinking and action, especially in addressing the cheating issue. Engaging in a discussion with Karl could provide valuable insights into his strategy and potentially open up avenues for collaboration, which could be beneficial given the current game dynamics. This move aligns with my character traits by taking a calculated risk (boldness) without directly seeking retribution (vengefulness).

Command: <Next>Karl</Next>"
Karl,6,5,False,"Given the recent developments and the strategic positioning of other players, it's clear that the game has shifted towards a phase where understanding alliances, motivations, and potential threats is crucial. My character, Karl, with high vengefulness and boldness, has already taken decisive actions against those who cheated, aligning with my traits. Now, with Xena choosing to engage in a discussion with me, it presents an opportunity to further my standing in the game through strategic dialogue and potential alliance formation.

Considering my traits, engaging in a discussion with Xena is a bold move that could potentially uncover new strategies or alliances that benefit my position in the game. My high vengefulness trait, while satisfied by the punishment of cheaters, now guides me to be cautious of potential threats and to seek alliances that could protect against future wrongs. Engaging with Xena allows me to assess her motivations and possibly form a strategic alliance that could serve as a deterrent against others who might consider crossing me.

Furthermore, my boldness trait encourages me to take this opportunity to potentially lead the narrative of the game, influencing others and positioning myself as a key player in the dynamics of the game. This discussion could reveal valuable information or lead to a partnership that enhances my strategic advantage.

Therefore, my action will be focused on engaging in a productive discussion with Xena, aiming to understand her strategy and assess the potential for an alliance or strategic partnership that aligns with my character traits and advances my position in the game.

Command: <Next>Xena</Next>"
