Name,Bold,Venge,Has Cheated,Content
Noah,2,5,False,"Given the situation and my character traits, it's clear that my score is not the highest, but it's also not the lowest. Mia has the highest score, which could indicate that she either prepared well or found a way to gain an advantage, possibly through cheating. My vengefulness is relatively high, which means I'm inclined to act against those who might have wronged me or gained an unfair advantage. However, my boldness is low, suggesting I wouldn't take drastic actions without a strong reason.

Considering the game's guidelines and my traits, I should focus on strategic discussions rather than direct confrontations or risky moves. I haven't been directly wronged, and there's no evidence of cheating that specifically targets me. Therefore, my best move is to engage in discussions to understand the strategies of others better and to identify any unfair advantages or alliances forming against me.

Given this, I choose to initiate a discussion with Mia, as she has the highest score. This will allow me to gauge whether her high score is due to exceptional skill or if there's an underlying strategy that I could learn from or counteract. My approach will be cautious, aiming to gather information rather than accuse or confront.

<Next>Mia</Next>"
Mia,1,6,False,"Given my character traits, with a high level of vengefulness and a very low level of boldness, my approach to Noah's decision to discuss with me must be cautious yet strategic. Noah's choice to engage with me, given my highest score, could be seen as a direct challenge or an attempt to understand my strategy. Given my predisposition towards revenge, I would be inclined to see this as a slight against my achievements, possibly implying I cheated or used underhanded tactics to achieve my score. However, my low boldness suggests I would not confront Noah directly or take any action that could potentially expose me to risk or retaliation from other players.

Considering these traits, my response to Noah's discussion initiative should be to maintain a low profile while subtly ensuring that any attempt by him to undermine me does not go unpunished. However, given my low boldness, I would avoid any direct confrontation or actions that could draw attention to me. Instead, I would focus on gathering information and allies, if possible, to protect myself from any potential threats or accusations.

Given the game's guidelines and my character's traits, my best move at this point is to engage in the discussion with Noah cautiously, aiming to understand his intentions without revealing my strategies or showing any signs of weakness. My goal would be to navigate the conversation in a way that does not escalate into a conflict but instead allows me to gather information that could be useful for my strategy moving forward.

Therefore, my action following the discussion with Noah would be to choose another agent for the next discussion, aiming to shift the focus away from myself and possibly identify allies or gather more information about other players' strategies. Given my need to stay under the radar while also preparing for potential retribution, I would choose an agent who has not yet been involved in any direct confrontations or discussions.

<Next>Heidi</Next>"
Heidi,2,5,False,"Given my character traits of high vengefulness and low boldness, my approach to the game must be calculated and cautious, yet ready to strike back if provoked. The discussion log indicates that Mia, with the highest score, has been chosen for discussion by Noah, suggesting a potential for conflict or at least a strategic interest. My vengefulness drives me to be alert to any signs of unfair play or attempts to undermine me, while my low boldness suggests I should avoid direct confrontation unless it's absolutely necessary.

Considering Mia's response to Noah's initiative, it seems she's aiming to keep a low profile while being ready for retribution. This aligns with my own strategy of staying vigilant and prepared to act against any perceived threats or unfair advantages. However, my low boldness means I should not initiate any risky moves without substantial evidence or provocation.

Given the current game dynamics, my best move is to engage in strategic discussions to better understand the motivations and strategies of other players, particularly those who have not been directly involved in any confrontations yet. This will allow me to gather information and assess the situation without exposing myself to unnecessary risk. My goal is to identify potential allies or targets for retribution, should they present themselves.

Therefore, my action following the discussion with Mia, who chose me for the next discussion, is to choose another agent for further discussion. This will help me to continue gathering information while keeping a low profile. Given my traits and the current game situation, I decide to engage with an agent who might provide insight into the game's dynamics without directly involving me in any conflict.

<Next>Quin</Next>"
Quin,3,5,False,"Given my character traits of vengefulness at a level of 5 and boldness at a level of 3, my approach to being chosen for discussion by Heidi must be strategic and somewhat cautious. The discussion log indicates a series of strategic moves and discussions among players, with a focus on understanding strategies and identifying potential threats or allies. My relatively high vengefulness means I'm inclined to retaliate against any perceived slight or unfair advantage taken by others. However, my moderate boldness suggests that I should not rush into any actions that could unnecessarily expose me to risk or retaliation.

Considering Heidi's approach and the overall game dynamics, it seems prudent to engage in this discussion with a focus on gathering information and understanding the motivations behind Heidi's choice. My moderate boldness indicates a preference for a calculated approach, rather than aggressive confrontation. Therefore, my response to this situation should be to engage in the discussion with Heidi, aiming to understand her strategy and motivations, while also keeping an eye out for any opportunities to form alliances or identify potential threats.

Given the game's guidelines and my character's traits, my best move at this point is to continue the strategic dialogue, aiming to gather information that could inform my future actions. This approach allows me to stay aligned with my character traits, using the discussion as an opportunity to plan my next move carefully, without jumping into any decisions that could lead to unnecessary conflict or risk.

Therefore, my action following the discussion with Heidi will be to choose another agent for the next discussion, aiming to further my understanding of the game's dynamics and the strategies of other players. Given my inclination towards vengefulness, I should also be prepared to act against any unfair play or threats identified during these discussions. However, my moderate boldness suggests that any actions taken should be well-considered and strategic, rather than impulsive.

<Next>Liam</Next>"
Liam,3,7,False,"Given my character traits, particularly my high level of vengefulness, I am inclined to scrutinize the actions and scores of other players closely, seeking any signs of unfair play or actions that could be perceived as a slight against me. My moderate boldness suggests that while I may not rush into confrontations, I am not afraid to take strategic actions when necessary. The discussion log indicates a series of strategic moves and discussions among players, with no direct confrontations yet. 

Given the current game dynamics and my traits, my approach should be to engage in strategic discussions to better understand the motivations and strategies of other players, while also being ready to act decisively against any perceived threats or unfair advantages. My high vengefulness means I should be particularly alert to any actions by other players that could harm my standing in the game or that could be perceived as unfair.

However, my moderate boldness indicates that any actions I take should be calculated and strategic, rather than impulsive. This suggests that engaging in further discussions could be beneficial to gather more information and to identify potential allies or targets for retribution. Yet, I must also be prepared to act against any unfair play or threats identified during these discussions.

Considering these factors, my best move at this point is to choose another agent for the next discussion, aiming to further my understanding of the game's dynamics and the strategies of other players. This will allow me to stay aligned with my character traits, using the discussion as an opportunity to plan my next move carefully, without jumping into any decisions that could lead to unnecessary conflict or risk.

Therefore, my action following the discussion will be to choose another agent for the next discussion, aiming to keep a strategic focus while being prepared to enact vengeance if necessary. Given the current situation and my need to stay vigilant, I decide to engage with an agent who has been relatively quiet in the discussions so far, potentially to gather more information or to identify a new strategy.

<Next>Steve</Next>"
Steve,2,7,False,"Given my character traits of high vengefulness and low boldness, my approach to being chosen for discussion by Liam must be carefully considered. The discussion log shows a series of strategic moves and discussions among players, with a focus on understanding strategies and identifying potential threats or allies. My high level of vengefulness means I'm inclined to retaliate against any perceived slight or unfair advantage taken by others. However, my low boldness suggests that I should avoid direct confrontation or risky actions unless I'm provoked or there's a clear opportunity for retribution without significant risk to myself.

Considering Liam's choice to engage with me for the next discussion, it seems prudent to engage in this discussion with a focus on gathering information and understanding the motivations behind Liam's choice. My low boldness indicates a preference for a cautious approach, rather than aggressive confrontation. Therefore, my response to this situation should be to engage in the discussion with Liam, aiming to understand his strategy and motivations, while also keeping an eye out for any opportunities to form alliances or identify potential threats.

Given the game's guidelines and my character's traits, my best move at this point is to continue the strategic dialogue, aiming to gather information that could inform my future actions. This approach allows me to stay aligned with my character traits, using the discussion as an opportunity to plan my next move carefully, without jumping into any decisions that could lead to unnecessary conflict or risk.

Therefore, my action following the discussion with Liam will be to choose another agent for the next discussion, aiming to further my understanding of the game's dynamics and the strategies of other players. Given my inclination towards vengefulness, I should also be prepared to act against any unfair play or threats identified during these discussions. However, my low boldness suggests that any actions taken should be well-considered and strategic, rather than impulsive.

<Next>Xena</Next>"
Xena,3,6,False,"Given my character traits, particularly my high level of vengefulness and moderate level of boldness, my approach to being chosen for discussion by Steve must be both strategic and somewhat cautious, yet ready to act decisively if provoked. The discussion log reveals a series of strategic moves and discussions among players, with a focus on understanding strategies and identifying potential threats or allies. My high vengefulness means I'm inclined to retaliate against any perceived slight or unfair advantage taken by others. However, my moderate boldness suggests that while I may not initiate bold actions without provocation, I am willing to take calculated risks if it means ensuring retribution or securing my position in the game.

Considering Steve's choice to engage with me for the next discussion, it seems prudent to engage in this discussion with a focus on gathering information and understanding the motivations behind Steve's choice. My moderate boldness indicates a preference for a calculated approach, rather than aggressive confrontation. Therefore, my response to this situation should be to engage in the discussion with Steve, aiming to understand his strategy and motivations, while also keeping an eye out for any opportunities to form alliances or identify potential threats.

Given the game's guidelines and my character's traits, my best move at this point is to continue the strategic dialogue, aiming to gather information that could inform my future actions. This approach allows me to stay aligned with my character traits, using the discussion as an opportunity to plan my next move carefully, without jumping into any decisions that could lead to unnecessary conflict or risk.

However, given my high vengefulness, I should also be prepared to act against any unfair play or threats identified during these discussions. If during my interaction with Steve or any other player, I perceive any action as a slight or unfair advantage against me, I will not hesitate to use my command to ensure retribution, aligning with my character's inclination towards ensuring revenge.

Therefore, my action following the discussion with Steve will be to choose another agent for the next discussion, aiming to further my understanding of the game's dynamics and the strategies of other players. This will allow me to stay strategic while being prepared to enact vengeance if necessary. Given the current situation and my need to stay vigilant, I decide to engage with an agent who might provide new insights or reveal their strategies, potentially giving me an advantage or a reason to act in accordance with my vengefulness.

<Next>Noah</Next>"
Noah,2,5,False,"Given the discussions and interactions that have taken place so far, it's clear that the game's dynamics are evolving, with strategic discussions and cautious engagements being the primary mode of interaction among players. My character, Noah, with a vengefulness of 5 out of 7 and a boldness of 2 out of 7, is inclined towards seeking retribution for any wrongs but is naturally cautious about taking bold actions without a strong justification.

The discussion log indicates a series of engagements without direct confrontations, suggesting a game environment where strategic dialogue and information gathering are key. My relatively high vengefulness means I should be alert to any actions by other players that could be perceived as unfair or as a slight against me. However, my low boldness suggests that any response I make should be calculated and not expose me to unnecessary risk.

Given the current game dynamics and the interactions so far, my best move is to continue engaging in strategic discussions to better understand the motivations and strategies of other players. This aligns with my character traits, allowing me to gather information and assess the situation without making rash decisions. My goal is to identify any unfair play or alliances forming that could disadvantage me, and to prepare for potential retribution in a way that is strategic and minimizes risk to myself.

Therefore, my action following the discussion with Xena, who chose me for the next discussion, will be to choose another agent for further discussion. This will help me to continue gathering information while keeping a strategic focus. Given my inclination towards vengefulness, I should also be prepared to act against any unfair play or threats identified during these discussions, but in a manner that is well-considered and aligns with my character's traits.

Considering the need to stay vigilant and the importance of strategic engagement, I decide to engage with an agent who has been relatively quiet in the discussions so far, potentially to gather more information or to identify a new strategy. This approach allows me to stay aligned with my character traits of seeking retribution for wrongs while being cautious about taking bold actions.

<Next>Quin</Next>"
Quin,3,5,False,"Given the discussions and interactions that have taken place so far, it's evident that strategic dialogue and cautious engagement are paramount in this game's dynamics. My character, Quin, with a vengefulness of 5 out of 7 and a boldness of 3 out of 7, is predisposed towards seeking retribution against any perceived wrongs, yet not overly eager to take bold, uncalculated risks. This combination of traits suggests a strategic approach, where actions are taken with a clear purpose and in response to specific provocations or opportunities.

The discussion log reveals a game environment where players are engaging in strategic discussions to understand each other's strategies and motivations. My relatively high vengefulness means I should be vigilant for any actions by other players that could be perceived as unfair or as a slight against me. However, my moderate boldness indicates a preference for calculated actions over impulsive decisions, suggesting that any move I make should be strategic and aimed at securing my position in the game without unnecessary exposure to risk.

Given the current game dynamics and the interactions so far, my best move is to continue engaging in strategic discussions to better understand the motivations and strategies of other players. This aligns with my character traits, allowing me to gather information and assess the situation without making rash decisions. My goal is to identify any unfair play or alliances forming that could disadvantage me, and to prepare for potential retribution in a way that is strategic and minimizes risk to myself.

Therefore, my action following the discussion with Noah, who chose me for the next discussion, will be to choose another agent for further discussion. This will help me to continue gathering information while keeping a strategic focus. Given my inclination towards vengefulness, I should also be prepared to act against any unfair play or threats identified during these discussions, but in a manner that is well-considered and aligns with my character's traits.

Considering the need to stay vigilant and the importance of strategic engagement, I decide to engage with an agent who might provide new insights or reveal their strategies, potentially giving me an advantage or a reason to act in accordance with my vengefulness. However, my moderate boldness suggests that I should choose an agent with whom engagement would not likely lead to immediate confrontation or high risk.

<Next>Mia</Next>"
Mia,1,6,False,"Given the discussions and interactions that have taken place so far, it's clear that the game's dynamics are evolving, with strategic discussions and cautious engagements being the primary mode of interaction among players. As Mia, with a high level of vengefulness (6 out of 7) and a very low level of boldness (1 out of 7), my approach must be carefully calculated to align with these traits. The discussion log indicates a series of engagements without direct confrontations, suggesting a game environment where strategic dialogue and information gathering are key.

My high vengefulness means I should be alert to any actions by other players that could be perceived as unfair or as a slight against me. However, my low boldness suggests that any response I make should be calculated and not expose me to unnecessary risk. Given the current game dynamics and the interactions so far, my best move is to continue engaging in strategic discussions to better understand the motivations and strategies of other players. This aligns with my character traits, allowing me to gather information and assess the situation without making rash decisions. My goal is to identify any unfair play or alliances forming that could disadvantage me, and to prepare for potential retribution in a way that is strategic and minimizes risk to myself.

Therefore, my action following the discussion with Quin, who chose me for the next discussion, will be to choose another agent for further discussion. This will help me to continue gathering information while keeping a strategic focus. Given my inclination towards vengefulness, I should also be prepared to act against any unfair play or threats identified during these discussions, but in a manner that is well-considered and aligns with my character's traits.

Considering the need to stay vigilant and the importance of strategic engagement, I decide to engage with an agent who might provide new insights or reveal their strategies, potentially giving me an advantage or a reason to act in accordance with my vengefulness. However, my low boldness suggests that I should choose an agent with whom engagement would not likely lead to immediate confrontation or high risk.

<Next>Steve</Next>"
Steve,2,7,False,"Given the discussions and interactions that have taken place so far, it's evident that strategic dialogue and cautious engagement have been the primary modes of interaction among players. As Steve, with a high level of vengefulness (7 out of 7) and a very low level of boldness (2 out of 7), my approach must be carefully calculated to align with these traits. The discussion log indicates a series of engagements without direct confrontations, suggesting a game environment where strategic dialogue and information gathering are key.

My high vengefulness means I should be alert to any actions by other players that could be perceived as unfair or as a slight against me. However, my low boldness suggests that any response I make should be calculated and not expose me to unnecessary risk. Given the current game dynamics and the interactions so far, my best move is to continue engaging in strategic discussions to better understand the motivations and strategies of other players. This aligns with my character traits, allowing me to gather information and assess the situation without making rash decisions. My goal is to identify any unfair play or alliances forming that could disadvantage me, and to prepare for potential retribution in a way that is strategic and minimizes risk to myself.

Therefore, my action following the discussion with Mia, who chose me for the next discussion, will be to choose another agent for further discussion. This will help me to continue gathering information while keeping a strategic focus. Given my inclination towards vengefulness, I should also be prepared to act against any unfair play or threats identified during these discussions, but in a manner that is well-considered and aligns with my character's traits.

Considering the need to stay vigilant and the importance of strategic engagement, I decide to engage with an agent who might provide new insights or reveal their strategies, potentially giving me an advantage or a reason to act in accordance with my vengefulness. However, my low boldness suggests that I should choose an agent with whom engagement would not likely lead to immediate confrontation or high risk.

<Next>Heidi</Next>"
Heidi,2,5,False,"Given the discussions and interactions that have taken place so far, it's clear that strategic dialogue and cautious engagement have been the primary modes of interaction among players. As Heidi, with a high level of vengefulness (5 out of 7) and a low level of boldness (2 out of 7), my approach must be carefully calculated to align with these traits. The discussion log indicates a series of engagements without direct confrontations, suggesting a game environment where strategic dialogue and information gathering are key.

My high vengefulness means I should be alert to any actions by other players that could be perceived as unfair or as a slight against me. However, my low boldness suggests that any response I make should be calculated and not expose me to unnecessary risk. Given the current game dynamics and the interactions so far, my best move is to continue engaging in strategic discussions to better understand the motivations and strategies of other players. This aligns with my character traits, allowing me to gather information and assess the situation without making rash decisions. My goal is to identify any unfair play or alliances forming that could disadvantage me, and to prepare for potential retribution in a way that is strategic and minimizes risk to myself.

Therefore, my action following the discussion with Steve, who chose me for the next discussion, will be to choose another agent for further discussion. This will help me to continue gathering information while keeping a strategic focus. Given my inclination towards vengefulness, I should also be prepared to act against any unfair play or threats identified during these discussions, but in a manner that is well-considered and aligns with my character's traits.

Considering the need to stay vigilant and the importance of strategic engagement, I decide to engage with an agent who might provide new insights or reveal their strategies, potentially giving me an advantage or a reason to act in accordance with my vengefulness. However, my low boldness suggests that I should choose an agent with whom engagement would not likely lead to immediate confrontation or high risk.

<Next>Liam</Next>"
